uid,
7.21E+17,im at dallasite billiards in dallas tx
7.21E+17,im at dart route stop southbound in dallas tx
7.21E+17,im at deep ellum in dallas tx
7.21E+17,im at deep ellum in dallas tx
7.21E+17,im at downtown dallas in dallas tx
7.21E+17,im at earle cabell federal building in dallas tx
7.21E+17,im at earle cabell federal building in dallas tx
7.21E+17,im at ernst young ssc in dallas tx
7.21E+17,im at fiesta de frutas in dallas tx
7.21E+17,im at frys electronics in dallas tx
7.21E+17,im at fuel city tacos in dallas tx
7.21E+17,im at happiest hour in dallas tx
7.21E+17,im at havana social club in dallas tx
7.21E+17,im at highland park in dallas tx
7.21E+17,im at imax theater for the jungle book in dallas tx
7.21E+17,im at in dallas tx
7.21E+17,im at in dallas tx
7.21E+17,im at in dallas tx
7.21E+17,im at in dallas tx
7.21E+17,im at in dallas tx
7.21E+17,im at in dallas tx
7.21E+17,im at in dallas tx
7.21E+17,im at in dallas tx
7.21E+17,im at in dallas tx
7.21E+17,im at in dallas tx
7.21E+17,im at in dallas tx
7.21E+17,im at in dallas tx
7.21E+17,im at infomart in dallas tx
7.21E+17,im at jays home in dallas tx
7.21E+17,im at kroger in dallas tx
7.21E+17,im at le dallas by the galleria in dallas tx
7.21E+17,im at lexus service center in dallas tx
7.21E+17,im at liberty burger in dallas tx
7.21E+17,im at liberty one credit union in dallas tx
7.21E+17,im at library bar in dallas tx
7.21E+17,im at luxx nightclub in dallas tx
7.21E+17,im at main street district in dallas tx
7.21E+17,im at martin hair design in dallas tx
7.21E+17,im at mckinney pool
7.21E+17,im at mikes chicken in dallas tx
7.21E+17,im at mission east dallas health center in dallas tx
7.21E+17,im at mutts canine cantina in dallas tx
7.21E+17,im at nola brasserie in dallas tx
7.21E+17,im at northwest dallas in dallas tx
7.21E+17,im at oak cliff in dallas tx
7.21E+17,im at of nature and science in dallas tx
7.21E+17,im at one main place in dallas tx
7.21E+17,im at orangetheory fitness preston and frankford in dallas tx
7.21E+17,im at ragin crab in dallas tx
7.21E+17,im at rbc deep ellum in dallas tx
7.21E+17,im at rbc deep ellum in dallas tx
7.21E+17,im at redbird transit center in dallas tx
7.21E+17,im at renaissance tower in dallas tx
7.21E+17,im at schlotzskys in dallas tx
7.21E+17,im at sky house dallas in dallas tx
7.21E+17,im at skyline high school in dallas tx
7.21E+17,im at skyline high school p16 in dallas tx
7.21E+17,im at southwest airlines corporate headquarters in dallas tx
7.21E+17,im at southwest airlines employee bus parking in dallas tx
7.21E+17,im at southwest airlines employee bus parking in dallas tx
7.21E+17,im at southwest tops in dallas tx
7.21E+17,im at starbucks in dallas tx
7.21E+17,im at studio movie grill for batman v superman dawn of justice in dallas tx
7.21E+17,im at studio movie grill in dallas tx
7.21E+17,im at the bell house in dallas tx
7.21E+17,im at the for penny and sparrow and corey kilgannon in dallas tx
7.21E+17,im at the ginger man in dallas tx
7.21E+17,im at the grove at harwood in dallas tx
7.21E+17,im at the shade store_ in dallas tx
7.21E+17,im at the steakhouse in dallas tx
7.21E+17,im at tom center in dallas tx
7.21E+17,im at turtle creek pain management in dallas tx
7.21E+17,im at twisted root burger company in dallas tx
7.21E+17,im at twisted root burger company in dallas tx
7.21E+17,im at u.s post office in dallas tx
7.21E+17,im at victory station dart rail tre in dallas tx
7.21E+17,im at village burger bar in dallas tx
7.21E+17,im at village square in dallas tx
7.21E+17,im at vine barbeque in dallas tx
7.21E+17,im at west end station dart rail in dallas tx
7.21E+17,im at zephyr bakery cafe in dallas tx
7.21E+17,im feeling pretty dumb for paying to add a side of chicken bites from
7.21E+17,im gonna try to love you as much as nashville but youve got big shoes to fill dallas texas
7.21E+17,im sure youve seen this smiling face around the studio we love having this lady on not one
7.21E+17,im tweeting from backstage tonight for the dsm high school musical theatre awards
7.21E+17,impecable downtown dallas inc
7.21E+17,impostor who sold dead mans oak cliff house with him buried in yard indicted in murder
7.21E+17,in just kooling
7.21E+17,in minutes get over here EMO_POS j erik
7.21E+17,in perot museum of science and nature
7.21E+17,in those moments when you feel unworthy unable or unqualified its the exact time to turn to
7.21E+17,in tx antimoney laundering consultantctr at crowe horwath
7.21E+17,in tx application developer at robert half technology
7.21E+17,in tx care manager ii rn dallas texas at superior health plan
7.21E+17,in tx concierge at hei hotels resorts
7.21E+17,in tx cook at lifecare hospitals
7.21E+17,in tx crew member at einstein bros bagels
7.21E+17,in tx director corp strategy at
7.21E+17,in tx edi b2b gateway resumes to david.moore com at robert half technology
7.21E+17,in tx human resources assistant at officeteam
7.21E+17,in tx keyholder j.crew retail west village at j crew
7.21E+17,in tx manager on duty at ihop acg texas
7.21E+17,in tx retail sales consultant at
7.21E+17,in tx senior project manager facilities management at utsw
7.21E+17,in tx speech language pathologist slpcc at accountable healthcare staffing
7.21E+17,in tx travel rn picu dallas tx at supplemental health care
7.21E+17,interested in a near texas this could be a great fit
7.21E+17,interested in a near texas this could be a great fit
7.21E+17,interested in a near texas this could be a great fit
7.21E+17,interested in a near tx this could be a great fit
7.21E+17,interested in a near tx this could be a great fit
7.21E+17,interested in a near tx this could be a great fit
7.21E+17,interested in a near tx this could be a great fit
7.21E+17,interested in a near tx this could be a great fit
7.21E+17,interested in a near tx this could be a great fit
7.21E+17,interested in a near tx this could be a great fit
7.21E+17,interested in a near tx this could be a great fit
7.21E+17,interested in a near tx this could be a great fit
7.21E+17,interested in a near tx this could be a great fit
7.21E+17,interested in a near tx this could be a great fit
7.21E+17,interested in a near tx this could be a great fit
7.21E+17,interested in a near tx this could be a great fit
7.21E+17,interested in a near tx this could be a great fit
7.21E+17,interested in a near tx this could be a great fit
7.21E+17,interested in a near tx this could be a great fit
7.21E+17,interested in a near tx this could be a great fit
7.21E+17,interested in a near tx this could be a great fit
7.21E+17,interested in a near tx this could be a great fit
7.21E+17,interested in a near tx this could be a great fit
7.21E+17,interested in a near tx this could be a great fit
7.21E+17,interested in a near tx this could be a great fit
7.21E+17,interested in a near tx this could be a great fit
7.21E+17,interested in a near tx this could be a great fit
7.21E+17,interested in a near tx this could be a great fit
7.21E+17,interested in a near tx this could be a great fit
7.21E+17,interested in a near tx this could be a great fit
7.21E+17,interested in a near tx this could be a great fit
7.21E+17,interested in a near tx this could be a great fit
7.21E+17,interested in a near tx this could be a great fit
7.21E+17,interested in a near tx this could be a great fit
7.21E+17,interested in a near tx this could be a great fit
7.21E+17,interested in a near tx this could be a great fit
7.21E+17,interested in a near tx this could be a great fit
7.21E+17,interested in a near tx this could be a great fit
7.21E+17,interested in a near tx this could be a great fit
7.21E+17,interested in a near tx this could be a great fit
7.21E+17,interested in a near tx this could be a great fit
7.21E+17,interested in a near tx this could be a great fit
7.21E+17,iron mike tee
7.21E+17,iron mike tyson tee
7.21E+17,is coming
7.21E+17,is everyday for me
7.21E+17,is in the building this is the official dallas edition of layers le
7.21E+17,it follows me wherever i go cane rosso
7.21E+17,it was so nice meeting and chatting with luke and vinny to in dallas they are
7.21E+17,italchos deedee75201 terillis
7.21E+17,its always a hoot when these two roll into town
7.21E+17,its an art dallas weekend cant wait to see what this years has in store
7.21E+17,its been a long time since ive been up in a legit skyscraper im on top of the metroplex
7.21E+17,its finally friday start your weekend right and join us for happy hour from
7.21E+17,its goin downn later south side ballroom
7.21E+17,its oclock somewhere right dallas texas
7.21E+17,its texas yall the foundry bar
7.21E+17,its that time again va medical center in dallas tx
7.21E+17,its was nice to meet to tonight you was real cool person we didnt get to talk long
7.21E+17,ive always had the best the time just doesnt compare to my jail broken
7.21E+17,ive been doing this since a young age god reached down and put his hands on me now im trying
7.21E+17,ive missed this place another lesson in learning to stick with
7.21E+17,j crew sales associate j.crew mercantile shops at park lane tx
7.21E+17,jadehud iamyayatheredd me all the way to the
7.21E+17,jason spezza scores dallasstars up over by
7.21E+17,johnny strong and his posse stick around for a session after the presentation of
7.21E+17,join the cgi team see our latest opening here tx
7.21E+17,join the cognizant team see our latest opening here tx
7.21E+17,join the cvs health team see our latest opening here tx
7.21E+17,join the department of veterans affairs team see our latest opening here tx
7.21E+17,join the hei hotels resorts team see our latest opening here tx
7.21E+17,join the languageline solutions team see our latest opening here
7.21E+17,join the lifecare hospitals team see our latest opening here tx
7.21E+17,join the niagara bottling team see our latest opening here tx
7.21E+17,join the robert half technology team see our latest opening here tx
7.21E+17,join the sonic drivein team see our latest opening here tx
7.21E+17,join the sous chef team see our latest opening here tx
7.21E+17,join the sperry team see our latest opening here tx
7.21E+17,join the the creative group team see our latest opening here tx
7.21E+17,join the utsw team see our latest opening here tx
7.21E+17,join the utsw team see our latest opening here tx
7.21E+17,join the utsw team see our latest opening here tx
7.21E+17,join the utsw team see our latest opening here tx
7.21E+17,join the utsw team see our latest opening here tx
7.21E+17,join us at the dallas institute to celebrate the opening of cour regard the new addition to
7.21E+17,join us for food drinks and root beer floats support the residents of aids services of dallas
7.21E+17,join us for seder this year the intown chabad
7.21E+17,just another day at the office with brand ambassador
7.21E+17,just hanging out white rock lake dallas texas
7.21E+17,just in mercedes e350 luxury miles
7.21E+17,just in time for the movie city center district in dallas tx
7.21E+17,just posted a photo absinthe lounge
7.21E+17,just posted a photo american airlines center
7.21E+17,just posted a photo bank of america plaza
7.21E+17,just posted a photo big t plaza
7.21E+17,just posted a photo carlos bakery dallas
7.21E+17,just posted a photo dallas farmers market
7.21E+17,just posted a photo dallas international film festival
7.21E+17,just posted a photo dallas museum of art
7.21E+17,just posted a photo dallas texas
7.21E+17,just posted a photo dallas world aquarium
7.21E+17,just posted a photo dfw mantiques
7.21E+17,just posted a photo fine line body arts
7.21E+17,just posted a photo j erik johnson public library
7.21E+17,just posted a photo murphys mansion
7.21E+17,just posted a photo renaissance tower
7.21E+17,just posted a video heroes lounge
7.21E+17,just posted a video reunion tower
7.21E+17,just some of the reasons why you should be here at in dallas tx
7.21E+17,just take my haand as long as you love me we could be starving we could be homeless we
7.21E+17,kari with a shutout thank you and good night
7.21E+17,kevin gates quote this with the two most relatable rappers to
7.21E+17,keys to the series heres where the mavericks must succeed to upset thunder eddie sefko
7.21E+17,kickball game strong__ fair oaks softball complex
7.21E+17,kicking it with fam and friends bar and grill
7.21E+17,kicking it with these boys xtc cabaret in dallas tx
7.21E+17,kold trans hiring veterans thank you for serving our tx
7.21E+17,la guardia dallas kennedy davenport house
7.21E+17,lake highlands business development byob
7.21E+17,landed safely at dal in dallas tx
7.21E+17,languageline solutions chaldean interpreters tx
7.21E+17,languageline solutions ilocano interpreters tx
7.21E+17,las mezclas buenonas a las la mezcla perfecta con dj ivan g el la grande con la
7.21E+17,last weekend my bestie__ dallas texas
7.21E+17,lead marketing manager tx
7.21E+17,lead marketing manager tx
7.21E+17,lead product marketing manager ecommerce tx
7.21E+17,lead product marketing mgr advanced solutions colocation EMO_NEG tx
7.21E+17,lemme hold from to within a year i gon flex i aint rich but im proud of my growth at a dead end
7.21E+17,lemmon ave surgery center
7.21E+17,lessee katy trail ice house in dallas tx
7.21E+17,lets get it spent all visiting hrs with my niece hopefully discharged tomorrow until
7.21E+17,lets get this party started iron cactus
7.21E+17,lets go stars american airlines center in dallas tx
7.21E+17,lets go stars american airlines dallas stars game
7.21E+17,lets kick ass tee
7.21E+17,lhhs vs rhs baseball l lake highlands high school
7.21E+17,lifecare hospitals administrative assistant prn tx
7.21E+17,lilflip713 always showing love
7.21E+17,lilflip713 true legend
7.21E+17,lmfao fam eating
7.21E+17,lmfao i said this im starting to realize that im that nigga
7.21E+17,lmfaoo ladies do you think that ya cycle get synced with the other ya man
7.21E+17,lol not me im saying lil b rawer ive never heard an uzi vert song
7.21E+17,lol she was
7.21E+17,lol snap ariannaangel96
7.21E+17,look what we have for you again they know that were going to make you work the dance floor
7.21E+17,look who is in morning walk up the with katy trail
7.21E+17,looks like dallasstars got some new toys for the arena great atmosphere for game last night
7.21E+17,love is in the air gorgeous kalli_k
7.21E+17,love ken block and love me some sister hazel at the granada
7.21E+17,love the different art pieces around the center for brain health this little guy made a great
7.21E+17,love this photo of me holding up the now infamous orange beachball
7.21E+17,love u me encanta verte feliz y creciendo en dallas urban vines wine bistro
7.21E+17,love what raysuperremote is doing and how they are supporting
7.21E+17,loving my new watch bag hg sply co
7.21E+17,loving running into my swa bro knoxedward he is one special person
7.21E+17,maintenance mechanic aerotek EMO_NEG tx
7.21E+17,malaamusic south side ballroom
7.21E+17,man texas is deep is rich with history and culture dallas texas
7.21E+17,man yall gotta cut the fat out of your foods least a lil bit
7.21E+17,martin luther king jr blvd
7.21E+17,martin luther king jr blvd
7.21E+17,masterfoz mercat bistro
7.21E+17,may trucking were hiring otr drivers sign on bonus tx
7.21E+17,me at the end though
7.21E+17,me in the number doing what i love to do baseball is my freedom my escape from this world
7.21E+17,medical city childrens hospital pediatric cardiac critical care tx
7.21E+17,medical coder inpatient audit consultant us travel dell EMO_NEG tx
7.21E+17,medical technologist on off nights utsw EMO_NEG tx
7.21E+17,meet idol runnerup dalton rapattoni win free lessons as school of rock expands to plano
7.21E+17,melissa just received her signed copy of a coachs nightmare of taking a
7.21E+17,melrose store stores sales associate melrose store dallas tx tx
7.21E+17,met a new friend shes also one of the awesome volunteers if you see mindy around say hello
7.21E+17,met one of my all because of a he wore in it had one of
7.21E+17,miles ahead is out catching it at the magnolia tonight im also featured on the song violets
7.21E+17,mindblown dallas texas
7.21E+17,mix before i go on fire bro the den
7.21E+17,models we painted today common desk
7.21E+17,models we painted today common desk
7.21E+17,models we painted today common desk
7.21E+17,monday april at absinthe lounge s
7.21E+17,monday april at absinthe lounge showtime at
7.21E+17,monkey see monkey do
7.21E+17,more than half sold out guess who just moved into museum tower
7.21E+17,morning skate in dallas prior to game american airlines center
7.21E+17,motions video link in bio dallas texas
7.21E+17,motown tearing up his new fretless bass
7.21E+17,mount drinkmore british beverage company
7.21E+17,mountain view college
7.21E+17,much luv and congrats to my fam for winning on the
7.21E+17,musical.ly givin the vibes the nephew el taquito cafe
7.21E+17,must be nice he too calm sumn aint right
7.21E+17,my beautiful mom lake highlands dallas
7.21E+17,my best friend yall cant have her because shes all mine
7.21E+17,my boy with some fancy filter action thank you for all of
7.21E+17,my brother is here with me to see ten eleven grill
7.21E+17,my face right now at this and they always rude aint got something short staffed
7.21E+17,my favorite part morton h meyerson symphony center
7.21E+17,my its way past my bedtime face blue mesa grill
7.21E+17,my march you know your
7.21E+17,my midmorning boost grande soy double dirty chai starbucks
7.21E+17,my my post bravo demarremcgill fortworthweekly proof pantry
7.21E+17,my new doo for
7.21E+17,my talons need tlc castle nail spa in dallas tx
7.21E+17,nada que perder nothing to lose
7.21E+17,nashville calls at dal in dallas tx
7.21E+17,neily faves on sale apples red bell peppers
7.21E+17,new chic at every age post live on the blog featuring this versatile and chic white blazer
7.21E+17,new dallas young professionals group plants roots at earth day party
7.21E+17,new friends new life luncheon today with amal clooney speaking400 trafficked teens on the
7.21E+17,new luggage i looked at it for a year finally
7.21E+17,new phone hand me down selfie bigger phone same sized head old lake highlands neighborhood
7.21E+17,new recruits will be getting their badges along dallas fire arson investigator
7.21E+17,new rental projects bring more residents to downtown dallas farmers market
7.21E+17,new rental projects bring more residents to downtown dallas farmers market
7.21E+17,newton ave dallas tx beds baths
7.21E+17,nice session notes that finish clean and fresh d citra sunshine slacker
7.21E+17,niggas too damn grown to be
7.21E+17,night before lone star classic let the fun begin reunion tower
7.21E+17,nimbii at the iot startup showcase pacific avenue
7.21E+17,nonmalignant hematology physician utsw EMO_NEG tx
7.21E+17,noodle snuggle dallas texas
7.21E+17,nossa dallas que nos recebeu t_o bem adoramos essa cidade dallas texas
7.21E+17,not my real face oo__ dallas texas
7.21E+17,oak farms dairy east
7.21E+17,of content fundraiser set for april
7.21E+17,off at bgr the burger joint
7.21E+17,off services
7.21E+17,off services
7.21E+17,off three selfserve dog baths
7.21E+17,oh hey dallas winspear opera house
7.21E+17,ollie norths over jersey barriers are only a minor threat to my year old knees
7.21E+17,on rotation
7.21E+17,on the real jax week
7.21E+17,one foot in front of the other the only way i know to get better dallas texas
7.21E+17,one of my biggest highlights of weekend was interviewing truekofi
7.21E+17,one of my favorite girls victor tangos
7.21E+17,one of our props album covers for our character frannie our crowdfunding is live check us
7.21E+17,opening night
7.21E+17,opening night barbershop the next cut barbershop live at by
7.21E+17,opening night for showboat winspear opera house in dallas tx
7.21E+17,oracle legal counsel cloud legal team tx
7.21E+17,our daily struggle artifacture
7.21E+17,our lady of the street by stephen adly guirgis rep play
7.21E+17,our lady of the street by stephen adly guirgis rep play
7.21E+17,our race director adam wants to see how long you can hang on our course what obstacle
7.21E+17,our time in the lone star state we are so excited for this show and honored to be on the
7.21E+17,out at in dallas tx
7.21E+17,out of this world
7.21E+17,overcast skies this am better light rain chances after lunchtime isolated tstorms are west of dfw wfaaweather
7.21E+17,pappas barbq
7.21E+17,parts delivery oreilly auto parts EMO_NEG tx
7.21E+17,paul
7.21E+17,penny sparrow the kessler theater for penny and sparrow and corey kilgannon in dallas tx
7.21E+17,peopleslaststand the peoples last stand
7.21E+17,performance food group driver check in texas
7.21E+17,period selfies from last nights round game shutout win
7.21E+17,picking up mkneth for leslies wedding at dal in dallas tx
7.21E+17,pit stop at our favorite spot
7.21E+17,pizza party elm street tattoo
7.21E+17,playoff hockey is the best hockey american airlines center
7.21E+17,plaza de las americas salones
7.21E+17,point point he aight south side ballroom
7.21E+17,police working a shooting outside denton jack in the box injured denton police dept says poss drug related nbc
7.21E+17,post movie nosh jorges texmex cafe in dallas tx
7.21E+17,post photoshoot this a.m thank god im free
7.21E+17,postitnotes pacific avenue
7.21E+17,pqchotspot friday calling all greeks to
7.21E+17,pre game for the show house of blues dallas
7.21E+17,pre temple spirit date night she just might like me creative
7.21E+17,prepping the course wilson
7.21E+17,preservice has started still time to get here
7.21E+17,pretrip inspection mobile units available in
7.21E+17,pretty delicious place glad to know there is a healthy spot fairly close to the office
7.21E+17,preview night at the dallas art fair dallas art fair
7.21E+17,prewedding posh cocktails bowen house dallas
7.21E+17,principal member of technical staff data scientist EMO_NEG tx
7.21E+17,probably the most literal shot ive ever posted more from this shoot on
7.21E+17,punky reggae party with gabe ben going on till am
7.21E+17,rachael leading our iot design hands on session pacific avenue
7.21E+17,ragin crab
7.21E+17,rainbow days luncheon omni dallas hotel in dallas tx
7.21E+17,rbc
7.21E+17,ready for
7.21E+17,ready for the nba lottery ima be pissed of the lakers have to trade their
7.21E+17,ready for their plane ride
7.21E+17,red jacket nightclub
7.21E+17,registered respiratory therapist rrt accountable healthcare staffing EMO_NEG tx
7.21E+17,rep joaquin castro and cookie monster unite in common purpose prek education
7.21E+17,replanted and it feels so good feels good to get the back online for the
7.21E+17,repost at booth d8
7.21E+17,research associate pharmacology corey lab utsw EMO_NEG tx
7.21E+17,reunion tower
7.21E+17,reynolds ave dallas tx beds bath
7.21E+17,rha pine tree ct dallas beds baths sq ft listed
7.21E+17,rha sandhurst dr flower mound beds baths sq ft
7.21E+17,rn ii utsw EMO_NEG tx
7.21E+17,road construction right lane closed in on lp nb at singleton blvd stop and go traffic in the area back to delay of
7.21E+17,rooftop barre at sunset with my girls tonight exactly what the doctor ordered now for
7.21E+17,rosewood mansion on turtle
7.21E+17,round game i expected absolutely nothing less with my team bringing the w.__
7.21E+17,round one of the stanley cup playoffs stars with the w
7.21E+17,royalty
7.21E+17,s t r e e t l o v e
7.21E+17,same i havent gone on a date in forever i really wouldnt even know what to do
7.21E+17,saquen la o cuando menos el saludos EMO_POS univision
7.21E+17,saquen las jejejee saludos kuvn univision channel
7.21E+17,sarah jarosz revisits her roots and shares new music at kessler theater in dallas
7.21E+17,saw wonderful touching tear jerker at screening of
7.21E+17,scott hamilton featured at annual childrens hope dinner benefiting orphan outreach
7.21E+17,seattle at dal in dallas tx
7.21E+17,see our latest tx and click to apply assistant instructor
7.21E+17,see our latest tx and click to apply baker
7.21E+17,see our latest tx and click to apply cdl fuel driver hutchins tx
7.21E+17,see our latest tx and click to apply congenital heart surgery peds
7.21E+17,see our latest tx and click to apply dietitian prn
7.21E+17,see our latest tx and click to apply director of clinical medical physics
7.21E+17,see our latest tx and click to apply greek interpreters
7.21E+17,see our latest tx and click to apply in fulltime
7.21E+17,see our latest tx and click to apply korean interpreters
7.21E+17,see our latest tx and click to apply macedonian interpreters
7.21E+17,see our latest tx and click to apply maternalfetal medicine physician
7.21E+17,see our latest tx and click to apply neonatalperinatal medicine physician
7.21E+17,see our latest tx and click to apply nvicu
7.21E+17,see our latest tx and click to apply pediatric nurse practitioner acute care for cicu
7.21E+17,see our latest tx and click to apply pharmacy technician
7.21E+17,see our latest tx and click to apply pharmacy technician
7.21E+17,see our latest tx and click to apply principal sales consultant
7.21E+17,see our latest tx and click to apply print representative
7.21E+17,see our latest tx and click to apply regulatory submissions coordinator
7.21E+17,see our latest tx and click to apply research study coordinator radiation oncology kronos
7.21E+17,see our latest tx and click to apply respiratory therapist prn day night shifts avail
7.21E+17,see our latest tx and click to apply restaurant general manager
7.21E+17,see our latest tx and click to apply rheumatologist
