uid,
7.21E+17,lunch then blowing up rockets with stacyredden dallas
7.21E+17,meet the browns city of mesquite texas
7.21E+17,mesquite chamber hosts candidate forums april at eastfield college
7.21E+17,mil gracias a mis hermosas chicas de y mis bellas instructoras por unirse a esta gran
7.21E+17,misd professional development
7.21E+17,modlin st mesquite tx beds bath
7.21E+17,mood
7.21E+17,needd the black white ones
7.21E+17,out here working lil slip at the end but we finished the play
7.21E+17,police chatter mesquite chief discusses crime at inaugural town hall tuesdays event
7.21E+17,poteet rounding into playoff form
7.21E+17,ridgedale dr mesquite tx beds baths
7.21E+17,see our latest tx and click to apply carhop server
7.21E+17,see our latest tx and click to apply restaurant team member crew
7.21E+17,so proud of all these grade readers and their sponsors great job misd
7.21E+17,stallcup dr mesquite tx beds baths
7.21E+17,teach me please
7.21E+17,this bear hasnt been in the bed with me for two nights and ive been restless af hes hear now and im sleepy as
7.21E+17,this might be a great fit for you hourly manager tx
7.21E+17,tx assistant store manager at the vitamin shoppe
7.21E+17,update pretty damn
7.21E+17,want to work at amc theatres were in tx click for details
7.21E+17,want to work in tx view our latest opening
7.21E+17,were click to apply hourly manager tx
7.21E+17,westview dr mesquite tx beds baths
7.21E+17,when you want a homecooked meal but dont wanna cook boston market
7.21E+17,why compare yourself to others no one else in the whole world can do a better job of being you than
7.21E+17,wow chocolate noseand taste drinking a sweet sin chocolate ale at
7.21E+17,you really should just prove yourself to yourself and not try to prove yourself to
7.21E+17,alert general manager sonic drivein tx
7.21E+17,parts delivery oreilly auto parts EMO_NEG tx
7.21E+17,alert carhop server sonic drivein tx
7.21E+17,alert customer service representative officeteam tx
7.21E+17,can you recommend anyone for this field property claims adjuster tx
7.21E+17,can you recommend anyone for this tx
7.21E+17,can you recommend anyone for this tx
7.21E+17,fast er care
7.21E+17,good food with plenty to take home clear springs restaurant
7.21E+17,i like the crawdad shirt at memaws work daddy bruce thats dangerous they could pinch your
7.21E+17,interested in a near tx this could be a great fit
7.21E+17,join the officeteam team see our latest opening here tx
7.21E+17,join the whbm team see our latest opening here tx
7.21E+17,just posted a photo midland texas
7.21E+17,lithia auto stores lube technician tx
7.21E+17,see our latest texas and click to apply personal care attendant
7.21E+17,see our latest texas and click to apply rheumatology product texas
7.21E+17,tx lube technician at lithia auto stores
7.21E+17,tx starbucks shift supervisor at simon
7.21E+17,want to work in tx view our latest opening
7.21E+17,water transfer technician aerotek EMO_NEG tx
7.21E+17,were click to apply customer service associate ii mf part time tx
7.21E+17,working out the bugs before she gets a full rebuild and make over
7.21E+17,can you recommend anyone for this maintenance technician tire care tx
7.21E+17,ellis county sheriff march
7.21E+17,garage sale meadow court
7.21E+17,garage sale park place blvd
7.21E+17,loves travel stops country st diesel mechanic tire care tx
7.21E+17,mt peak elementary
7.21E+17,mt peak elementary
7.21E+17,mt peak elementary
7.21E+17,mt peak elementary
7.21E+17,niadra
7.21E+17,scholars luncheon may
7.21E+17,this might be a great fit for you shift supervisor trainee tx
7.21E+17,well at least he can play sideline catch with himself in a new uniform this
7.21E+17,were click to apply diesel mechanic tire care tx
7.21E+17,wind mph barometer in falling slowly temperature rain today in humidity
7.21E+17,wind mph barometer in falling slowly temperature rain today in humidity
7.21E+17,wind mph barometer in falling slowly temperature rain today in humidity
7.21E+17,wind mph barometer in falling slowly temperature rain today in humidity
7.21E+17,wind mph barometer in falling slowly temperature rain today in humidity
7.21E+17,wind mph e barometer in falling slowly temperature rain today in humidity
7.21E+17,wind mph e barometer in falling slowly temperature rain today in humidity
7.21E+17,wind mph e barometer in falling slowly temperature rain today in humidity
7.21E+17,wind mph e barometer in falling slowly temperature rain today in humidity
7.21E+17,wind mph e barometer in falling slowly temperature rain today in humidity
7.21E+17,wind mph e barometer in falling slowly temperature rain today in humidity
7.21E+17,wind mph e barometer in rising slowly temperature rain today in humidity
7.21E+17,wind mph ene barometer in falling temperature rain today in humidity
7.21E+17,wind mph ene barometer in falling temperature rain today in humidity
7.21E+17,wind mph ene barometer in rising slowly temperature rain today in humidity
7.21E+17,wind mph ese barometer in falling slowly temperature rain today in humidity
7.21E+17,wind mph ese barometer in rising slowly temperature rain today in humidity
7.21E+17,wind mph ese barometer in rising slowly temperature rain today in humidity
7.21E+17,wind mph ese barometer in rising slowly temperature rain today in humidity
7.21E+17,wind mph nne barometer in falling slowly temperature rain today in humidity
7.21E+17,wind mph nw barometer in falling temperature rain today in humidity
7.21E+17,this is me at of my followers okay ima go cry brb bye doce
7.21E+17,this is so true EMO_POS sadly the only way some people will learn to appreciate you is by losing doce
7.21E+17,in tx general manager at sonic drivein wells
7.21E+17,alert stores shoe associate melrose store melrose store tx
7.21E+17,alert stores shoe associate melrose store mission tx melrose store tx
7.21E+17,im at bryan elementary school in mission tx
7.21E+17,llegando a casa de vero en mission me encuentro con om mora el nuevo perruno de vero mora
7.21E+17,sundae paleteria y neveria yusma
7.21E+17,were read about our latest opening here ready mix drivermission tx tx
7.21E+17,appleridge dr missouri city tx beds baths city
7.21E+17,bari rocky launch vlone x offwhite collaboration city
7.21E+17,baybay baybayy ms destini effie came to play no games you better sang city
7.21E+17,cemex driver ready mix south houston missouri city galveston tx city
7.21E+17,chasewood dr missouri city tx beds baths city
7.21E+17,city
7.21E+17,cypress point dr missouri city tx beds baths city
7.21E+17,ellis dr missouri city tx beds baths city
7.21E+17,feeling the beautiful sun set on the grass city
7.21E+17,fort bend kwik stop store held up and robbed city
7.21E+17,fresenius medical care pctfort bend tx city
7.21E+17,got me a cadillac hightower high school city
7.21E+17,greenbriar dr missouri city tx beds baths city
7.21E+17,im at star cinema grill for batman v superman dawn of justice in missouri city tx city
7.21E+17,in tx shift manager at raising canes city
7.21E+17,indigo ln missouri city tx beds baths city
7.21E+17,ivy fls missouri city tx beds baths city
7.21E+17,join the cvs health team see our latest opening here tx city
7.21E+17,lakecrest dr missouri city tx beds baths city
7.21E+17,nearly pounds of crystal meth found in fort bend bust city
7.21E+17,oakland lake way missouri city tx beds baths city
7.21E+17,outside sales representative unifirst unifirst corporation EMO_NEG tx city
7.21E+17,parks and recreation events city
7.21E+17,poplar springs dr missouri city tx beds baths city
7.21E+17,sales manager unifirst unifirst corporation EMO_NEG tx city
7.21E+17,show support for troops at fun family event memorial day weekend city
7.21E+17,sometimes we say or do things when were mad to those we love lord instead forgive me help me show love compassion_ city
7.21E+17,stepping to the bad side yess boys hightower high school city
7.21E+17,stoney brook ln missouri city tx beds baths city
7.21E+17,the dreams sang ms guice deena hightower high school city
7.21E+17,want to work in tx view our latest opening city
7.21E+17,were read about our latest opening here driver ready mix south houston missouri city city
7.21E+17,when gets white washed lol hightower high school city
7.21E+17,womans body found near ft bend toll city
7.21E+17,you better get deena together effie hightower high school city
7.21E+17,tx cook at sonic drivein
7.21E+17,were click to apply wanted journeyman electrician tx
7.21E+17,crawfish is massive here crawfish express point resort
7.21E+17,shout glory
7.21E+17,can you recommend anyone for this tx pleasant
7.21E+17,join the sonic drivein team see our latest opening here tx pleasant
7.21E+17,see our latest tx and click to apply controller pleasant
7.21E+17,can you recommend anyone for this assistant manager tx vernon
7.21E+17,moonlight movie on april to honor earth day
7.21E+17,some mornings are better than the others ru and i grabbed an early breakfast and are reading a
7.21E+17,blues jam beer wine tasting with our new cheese boards tonight the liberty
7.21E+17,can you recommend anyone for this general manager tx
7.21E+17,can you recommend anyone for this pharmacy manager tx
7.21E+17,cy babbyy
7.21E+17,dance marathon was great stephen f austin state university
7.21E+17,dudes get mad when they see someone else treating their girl betterwhat you wont do someone else will do
7.21E+17,fall football photo from my days i recall what it took to earn this spot guys
7.21E+17,happy bday becky love you lots sissy__
7.21E+17,happy birthday cole
7.21E+17,happy birthday to my roommate youre really cool and im in the
7.21E+17,hey im on my username is inkedupwb80
7.21E+17,im so blessed to have you in my life thank you for supporting me in everything i do i love
7.21E+17,its just a crazy
7.21E+17,lol
7.21E+17,lol fasho
7.21E+17,lol ok
7.21E+17,lol okay be safe sweetie
7.21E+17,myles got third in the proud
7.21E+17,people tend to forget that what god gave you he can take it away stay
7.21E+17,ready to watch the jungle book
7.21E+17,sabine river brass band tonight willow james tomorrow new drinks and spring menu is
7.21E+17,shes like texas she likes me__ banita creek hall nacogdoches
7.21E+17,someone that is not afraid to show you
7.21E+17,thanks
7.21E+17,well today was an adventure as always especially with her by my
7.21E+17,were click to apply customer service associate ii weekday tx
7.21E+17,were read about our latest opening here building materials lumber store seasonal employee
7.21E+17,whats a trip to nac without a little ink work caseys tattoo llc
7.21E+17,you cant fight true love unless you have claws then you can
7.21E+17,you right i need my rematch
7.21E+17,you see
7.21E+17,you the oneyoung
7.21E+17,aerotek escrow assistant tx bay
7.21E+17,aerotek systems engineer tx bay
7.21E+17,stretching before swimming in aqua therapy houston methodist orthopedic sports medicine bay
7.21E+17,ten minutes to curtain to start our second weekend of performances audiences are loving bay
7.21E+17,want to work in tx view our latest opening bay
7.21E+17,but the real question is does she miss me
7.21E+17,i miss
7.21E+17,interested in a near tx this could be a great fit
7.21E+17,join the loves travel stops country st team see our latest opening here
7.21E+17,brooklyn and i went to visit our duck friends today dornboss park
7.21E+17,can you recommend anyone for this operations manager tx
7.21E+17,can you recommend anyone for this tx
7.21E+17,operations manager raising canes EMO_NEG tx
7.21E+17,try grilled or fried chicken__
7.21E+17,were read about our latest opening here multi unit
7.21E+17,even though you eat all of the big crawfish i guess i can keep you around bar grill
7.21E+17,a late to that time i told kristen she was my lollipop braunfels
7.21E+17,after dinner coffee desserts at bakery catering in new braunfels tx braunfels
7.21E+17,alert crew member einstein bros bagels tx braunfels
7.21E+17,alert front receptionist favorite health care staffing tx braunfels
7.21E+17,alert hair stylist great clips tx braunfels
7.21E+17,and the one in the braunfels
7.21E+17,baptist health system dietitian resolute healthcare new braunfels pool prn texas braunfels
7.21E+17,braunfels
7.21E+17,braunfels
7.21E+17,braunfels
7.21E+17,can you recommend anyone for this tx braunfels
7.21E+17,dinner clear springs new braunfels braunfels
7.21E+17,dinner with my boy gristmill river restaurant bar braunfels
7.21E+17,dont make me mention the braunfels
7.21E+17,dont wanna hit tweets bc then im braunfels
7.21E+17,gonna have to stop tweeting after these next few braunfels
7.21E+17,hey avery check out my tshirts i drew with my artsiness yeah thats right take a seat on the braunfels
7.21E+17,im at casa garcia in new braunfels tx braunfels
7.21E+17,im at cvs in new braunfels tx braunfels
7.21E+17,im at oreilly auto parts in new braunfels tx braunfels
7.21E+17,interested in a near tx this could be a great fit braunfels
7.21E+17,is a day for play just ask our mountain lions animal world snake farm zoo braunfels
7.21E+17,joel osteens finest brew drinking a lakewood lager by the pour haus braunfels
7.21E+17,just going for a causal mile run old braunfels
7.21E+17,lunch panera bread in new braunfels tx braunfels
7.21E+17,mrs.mann will realize that i will slash her tires its all braunfels
7.21E+17,my beautiful gia and i playing in the car outside the animal hospital this morning before her braunfels
7.21E+17,my mind is telling me no but my body my body is telling me yes marvin braunfels
7.21E+17,remembering our epic adventure honeymoon and a fun day at braunfels
7.21E+17,schnitzel fest river hofbr_u beer garden in new braunfels tx braunfels
7.21E+17,sr software engineer harland clarke EMO_NEG tx braunfels
7.21E+17,stop trying to get replies to make me break braunfels
7.21E+17,such a great evening dado was enjoying his grandchildren so much with the bride in his lap braunfels
7.21E+17,there is a special place in my heart for thebeaverbuccee and it started over a year ago its braunfels
7.21E+17,walking to math on the braunfels
7.21E+17,want to work at baptist health system were in texas click for details braunfels
7.21E+17,want to work in tx view our latest opening braunfels
7.21E+17,were click to apply carhop server tx braunfels
7.21E+17,were read about our latest opening here sales agent san antonio tx braunfels
7.21E+17,wind mph e barometer in falling slowly temperature rain today humidity braunfels
7.21E+17,wind mph e barometer in falling slowly temperature rain today humidity braunfels
7.21E+17,wind mph e barometer in falling slowly temperature rain today humidity braunfels
7.21E+17,wind mph e barometer in falling slowly temperature rain today humidity braunfels
7.21E+17,wind mph e barometer in falling slowly temperature rain today humidity braunfels
7.21E+17,wind mph e barometer in falling slowly temperature rain today humidity braunfels
7.21E+17,wind mph e barometer in falling slowly temperature rain today humidity braunfels
7.21E+17,wind mph e barometer in falling slowly temperature rain today humidity braunfels
7.21E+17,wind mph e barometer in falling slowly temperature rain today humidity braunfels
7.21E+17,wind mph e barometer in falling slowly temperature rain today humidity braunfels
7.21E+17,wind mph e barometer in falling temperature rain today humidity braunfels
7.21E+17,wind mph e barometer in falling temperature rain today humidity braunfels
7.21E+17,wind mph e barometer in falling temperature rain today humidity braunfels
7.21E+17,wind mph e barometer in falling temperature rain today humidity braunfels
7.21E+17,wind mph e barometer in falling temperature rain today humidity braunfels
7.21E+17,wind mph e barometer in falling temperature rain today humidity braunfels
7.21E+17,wind mph e barometer in falling temperature rain today humidity braunfels
7.21E+17,wind mph e barometer in falling temperature rain today humidity braunfels
7.21E+17,wind mph e barometer in falling temperature rain today humidity braunfels
7.21E+17,wind mph e barometer in falling temperature rain today humidity braunfels
7.21E+17,wind mph e barometer in falling temperature rain today humidity braunfels
7.21E+17,wind mph e barometer in rising slowly temperature rain today humidity braunfels
7.21E+17,wind mph e barometer in rising slowly temperature rain today humidity braunfels
7.21E+17,wind mph e barometer in rising slowly temperature rain today humidity braunfels
7.21E+17,wind mph e barometer in rising slowly temperature rain today humidity braunfels
7.21E+17,wind mph e barometer in rising temperature rain today humidity braunfels
7.21E+17,wind mph e barometer in rising temperature rain today humidity braunfels
7.21E+17,wind mph e barometer in rising temperature rain today humidity braunfels
7.21E+17,wind mph e barometer in rising temperature rain today humidity braunfels
7.21E+17,wind mph e barometer in rising temperature rain today humidity braunfels
7.21E+17,wind mph e barometer in rising temperature rain today humidity braunfels
7.21E+17,wind mph e barometer in rising temperature rain today humidity braunfels
7.21E+17,wind mph e barometer in steady temperature rain today humidity braunfels
7.21E+17,wind mph ene barometer in falling slowly temperature rain today humidity braunfels
7.21E+17,wind mph ene barometer in falling slowly temperature rain today humidity braunfels
7.21E+17,wind mph ene barometer in falling slowly temperature rain today humidity braunfels
7.21E+17,wind mph ene barometer in falling temperature rain today humidity braunfels
7.21E+17,wind mph ene barometer in falling temperature rain today humidity braunfels
7.21E+17,wind mph ene barometer in falling temperature rain today humidity braunfels
7.21E+17,wind mph ene barometer in rising slowly temperature rain today humidity braunfels
7.21E+17,wind mph ene barometer in rising slowly temperature rain today humidity braunfels
7.21E+17,wind mph ene barometer in rising slowly temperature rain today humidity braunfels
7.21E+17,wind mph ene barometer in rising slowly temperature rain today humidity braunfels
7.21E+17,wind mph ene barometer in rising slowly temperature rain today humidity braunfels
7.21E+17,wind mph ene barometer in rising slowly temperature rain today humidity braunfels
7.21E+17,wind mph ene barometer in rising temperature rain today humidity braunfels
7.21E+17,wind mph ene barometer in rising temperature rain today humidity braunfels
7.21E+17,wind mph ese barometer in falling slowly temperature rain today humidity braunfels
7.21E+17,wind mph ese barometer in falling slowly temperature rain today humidity braunfels
7.21E+17,wind mph ese barometer in rising slowly temperature rain today humidity braunfels
7.21E+17,wind mph ese barometer in rising temperature rain today humidity braunfels
7.21E+17,wind mph ese barometer in rising temperature rain today humidity braunfels
7.21E+17,wind mph n barometer in falling slowly temperature rain today humidity braunfels
7.21E+17,wind mph n barometer in falling slowly temperature rain today humidity braunfels
7.21E+17,wind mph n barometer in falling slowly temperature rain today humidity braunfels
7.21E+17,wind mph n barometer in falling slowly temperature rain today humidity braunfels
7.21E+17,wind mph n barometer in falling slowly temperature rain today humidity braunfels
7.21E+17,wind mph n barometer in falling slowly temperature rain today humidity braunfels
7.21E+17,wind mph n barometer in falling slowly temperature rain today humidity braunfels
7.21E+17,wind mph n barometer in falling slowly temperature rain today humidity braunfels
7.21E+17,wind mph n barometer in falling slowly temperature rain today humidity braunfels
7.21E+17,wind mph n barometer in falling slowly temperature rain today humidity braunfels
7.21E+17,wind mph n barometer in falling slowly temperature rain today humidity braunfels
7.21E+17,wind mph n barometer in rising slowly temperature rain today humidity braunfels
7.21E+17,wind mph n barometer in rising slowly temperature rain today humidity braunfels
7.21E+17,wind mph n barometer in rising slowly temperature rain today humidity braunfels
7.21E+17,wind mph n barometer in rising temperature rain today humidity braunfels
7.21E+17,wind mph ne barometer in falling slowly temperature rain today humidity braunfels
7.21E+17,wind mph ne barometer in falling slowly temperature rain today humidity braunfels
7.21E+17,wind mph ne barometer in falling slowly temperature rain today humidity braunfels
7.21E+17,wind mph ne barometer in falling slowly temperature rain today humidity braunfels
7.21E+17,wind mph ne barometer in falling temperature rain today humidity braunfels
7.21E+17,wind mph ne barometer in falling temperature rain today humidity braunfels
7.21E+17,wind mph nne barometer in rising slowly temperature rain today humidity braunfels
7.21E+17,wind mph nne barometer in steady temperature rain today humidity braunfels
7.21E+17,wind mph w barometer in steady temperature rain today humidity braunfels
7.21E+17,wind mph wnw barometer in falling slowly temperature rain today humidity braunfels
7.21E+17,wind mph wnw barometer in rising slowly temperature rain today humidity braunfels
7.21E+17,wind mph wnw barometer in rising slowly temperature rain today humidity braunfels
7.21E+17,wind mph wnw barometer in steady temperature rain today humidity braunfels
7.21E+17,wind mph wsw barometer in falling slowly temperature rain today humidity braunfels
7.21E+17,wind mph wsw barometer in rising slowly temperature rain today humidity braunfels
7.21E+17,you guys take her too braunfels
7.21E+17,yum longhorn steakhouse in new braunfels tx braunfels
7.21E+17,thank you new territory
7.21E+17,interested in a near tx this could be a great fit
7.21E+17,texas wildflowers on my familys farm in nocona tx photo taken just the other day
7.21E+17,this is what it looks like in nocona right now look at those blue bonnets damn nocona texas
7.21E+17,a sweet gonzalez flag set up on od green for a springfield armory xd45 richland hills
7.21E+17,a sweet gonzalez flag set up on od green for a springfield armory xd45 richland hills
7.21E+17,a sweet gonzalez flag set up on od green for a springfield armory xd45 richland hills
7.21E+17,a sweet gonzalez flag set up on od green for a springfield armory xd45 richland hills
7.21E+17,a sweet gonzalez flag set up on od green for a springfield armory xd45 richland hills
7.21E+17,a sweet gonzalez flag set up on od green for a springfield armory xd45 richland hills
7.21E+17,a sweet gonzalez flag set up on od green for a springfield armory xd45 richland hills
7.21E+17,a sweet gonzalez flag set up on od green for a springfield armory xd45 richland hills
7.21E+17,a sweet gonzalez flag set up on od green for a springfield armory xd45 richland hills
7.21E+17,alert retail sales consultant havertys furniture tx richland hills
7.21E+17,bold claim family pet clinic north richland hills richland hills
7.21E+17,caladium dr north richland hills tx beds baths richland hills
7.21E+17,can you recommend anyone for this icu tx richland hills
7.21E+17,can you recommend anyone for this med surg tx richland hills
7.21E+17,come to the richland hills
7.21E+17,developers unveil plans for massive river district project near downtown fort worth via richland hills
7.21E+17,edinburg dr north richland hills tx beds baths richland hills
7.21E+17,emerald cir north richland hills tx beds baths richland hills
7.21E+17,EMO_POS north richland hills
7.21E+17,haltom high school show choir presents musica richland hills
7.21E+17,hvac tune up are hot at today see dana from stark to set your appointment today richland hills
7.21E+17,it took about coins to make this design finally fail nice job ladies richland hills
7.21E+17,just posted a photo tst survival richland hills
7.21E+17,just posted a video sub zero ice cream hurst tx richland hills
7.21E+17,love richland hills
7.21E+17,paula ct north richland hills tx beds baths richland hills
7.21E+17,pedernales rdg north richland hills tx beds baths richland hills
7.21E+17,pluckers richland hills
7.21E+17,richland hills
7.21E+17,richland hills
7.21E+17,richland hills
7.21E+17,richland hills
7.21E+17,richland hills
7.21E+17,richland hills
7.21E+17,richland hills
7.21E+17,see our latest tx and click to apply cook richland hills
7.21E+17,see our latest tx and click to apply cvpcu richland hills
7.21E+17,see our latest tx and click to apply fl med surg richland hills
7.21E+17,sierra dr north richland hills tx beds baths richland hills
7.21E+17,spring meadow dr north richland hills tx beds baths richland hills
7.21E+17,this might be a great fit for you cook tx richland hills
7.21E+17,this might be a great fit for you pharmacy technician target store richland hills
7.21E+17,this might be a great fit for you retail store positions tx richland hills
7.21E+17,ulster dr north richland hills tx beds baths richland hills
7.21E+17,were read about our latest opening here family practice opportunity richland hills
7.21E+17,who richland hills
7.21E+17,alert restaurant general manager ihop acg texas tx ridge north
7.21E+17,can you recommend anyone for this tx ridge north
7.21E+17,can you recommend anyone for this tx ridge north
7.21E+17,come see our free production may faith bible church ridge north
7.21E+17,drinking a fruitlands apricots by at ridge north
7.21E+17,drinking a wolf mother by at ridge north
7.21E+17,drinking a yellow rose by at ridge north
7.21E+17,i am shitting really hard in a bathroom ridge north
7.21E+17,if youre a professional in tx check out this ridge north
7.21E+17,just posted a photo spring hills texas ridge north
