uid,
7.21E+17,manive got some attracktive teammates__
7.21E+17,alert customer service associate ii lowes stores tx
7.21E+17,aselect starts tommorrow__ come watch our first game at achs at
7.21E+17,bche formal mcm elegante suites abilene
7.21E+17,bche steampunk formal mcm elegante suites abilene
7.21E+17,bche steampunk formal mcm elegante suites abilene
7.21E+17,can you recommend anyone for this tx
7.21E+17,can you recommend anyone for this tx
7.21E+17,carhop server sonic drivein EMO_NEG tx
7.21E+17,chillin on a friday evening at themillabilene with love these guys the mill
7.21E+17,compass group usa parttime clinical dietitian abilene tx tx
7.21E+17,date fave wildcat copper creek restaurant
7.21E+17,fun in the sun abilene texas
7.21E+17,gosh shes beautiful abilene texas
7.21E+17,i am so so so proud of us with only people we made it to state
7.21E+17,i have real love for you abilene the mill winery
7.21E+17,i just began a doing weight training workout using peptalk me now
7.21E+17,i love my two favorite
7.21E+17,im at aa alpine self storage in abilene tx
7.21E+17,im at cisco college in abilene tx
7.21E+17,im at in abilene tx
7.21E+17,im at in abilene tx
7.21E+17,im at mcdonalds in abilene tx
7.21E+17,im at of abilene in abilene tx
7.21E+17,im at prosperity bank in abilene tx
7.21E+17,im grateful for friends who are teachers because they go on awesome
7.21E+17,im loving
7.21E+17,in tx salon manager at great clips
7.21E+17,interested in a near tx this could be a great fit
7.21E+17,interested in a near tx this could be a great fit
7.21E+17,mcdonalds at s st
7.21E+17,my amazing friend pastor tony cruz tearing it up at fine arts service new life temple
7.21E+17,my dog is a dingus dyess airforce base abilene tx
7.21E+17,my fav future ahs cheerleader st johns episcopal school
7.21E+17,only things can bring me back to abilene sharks and super excited to be
7.21E+17,see our latest tx and click to apply assistant manager
7.21E+17,see our latest tx and click to apply cook
7.21E+17,set up looking nice get at djr music for your events student approved parent
7.21E+17,this might be a great fit for you sales rep tx
7.21E+17,uncle ralph abilene texas
7.21E+17,want to work at tractor supply company were in tx click for details
7.21E+17,want to work in tx view our latest opening
7.21E+17,we go hard in the skate the skatin place
7.21E+17,were read about our latest opening here caregiver hour shifts available
7.21E+17,were read about our latest opening here on call caregiver texas
7.21E+17,where it all begins abilene dixie little league
7.21E+17,working from home abilene texas
7.21E+17,accident cleared in on dallas n tollway nb at trinity mills rd stop and go traffic in the area back to lbj frwy
7.21E+17,aerotek construction project manager tx
7.21E+17,after school ice cream party parish episcopal school
7.21E+17,after school ice cream party parish episcopal school
7.21E+17,back with my tlcbfrb girls
7.21E+17,being one of the speakers at the tlcbfrb for
7.21E+17,birthday lunch with my baby girl love you to the moon and back
7.21E+17,can you recommend anyone for this tx
7.21E+17,clearly im obsessed with fastfurious_addison chirashi bowl over a bed of veggies and sushi
7.21E+17,disrespectful behavior in addison
7.21E+17,fogo de ch_o with my parents my heart and my tummy is content
7.21E+17,friday feels waiting for to get here so i can go tear up the gym with my bro jakefit11
7.21E+17,gearing up for taste addison
7.21E+17,greenhill debate team continues to earn national recognition
7.21E+17,grey jacket
7.21E+17,help joshlunatattoo do some work come down to irondaggertattootx right now and get the fire
7.21E+17,hornet sports report april
7.21E+17,i am looking for a buyer on parkview pl
7.21E+17,i cant quit you at in addison tx
7.21E+17,i didnt quite perfect the art of holding the but since ill never win a
7.21E+17,im at american flyers airline training center in addison tx
7.21E+17,im at freebirds world burrito in dallas tx
7.21E+17,im at newnew buffet in addison tx
7.21E+17,im at olive garden in addison tx
7.21E+17,im at parish episcopal baseball field in farmers branch tx
7.21E+17,im at radisson hotel dallas north addison in addison tx
7.21E+17,im at tgi fridays in dallas tx
7.21E+17,im at the londoner in addison tx
7.21E+17,in tx health coach cde at aerotek
7.21E+17,jetlag had me awake at this morning wonder if this place has a bed millennium tower in addison tx
7.21E+17,just posted a video glorias salsa club
7.21E+17,last night was awesome thanks to everyone that came out had a blast feeling very blessed__
7.21E+17,learn how to salsa sundays los lupes
7.21E+17,lets get started alamiraddison on right now my set is up
7.21E+17,new orleans jazz and heritage festival
7.21E+17,paso robles california dream destination for wine lovers
7.21E+17,pedicures in the corridor
7.21E+17,presenting the winner of taste the competition infamous butter cake join other
7.21E+17,rescue dogs start their new lives on the right paw
7.21E+17,road trippin dfw style daily heads to austin fashion week
7.21E+17,robert half legal legal secretary tx
7.21E+17,see our latest texas and click to apply restaurant team member
7.21E+17,see our latest tx and click to apply tech customer walk through
7.21E+17,sometimes our production artist matt brunworth needs to take a break from juggling projects by
7.21E+17,students sing their hearts out at annual cabaret night
7.21E+17,taking another final exam for the degree dunn brothers coffee
7.21E+17,these my bestfriends my bestfriends sherlocks addison
7.21E+17,this is frustrated me this is the uhaul key this is me after pictured uhaul key is found
7.21E+17,this might be a great fit for you bartender tx
7.21E+17,tx fulltime asp developer in addision salary at robert half technology
7.21E+17,video for this saturday our annual dj battle salsa party caribe saturdays blue
7.21E+17,we would like to thank for allowing us to partner
7.21E+17,wylie familys nerves frayed after hail
7.21E+17,yes just finished week day of with thats first week
7.21E+17,youth league play starts april
7.21E+17,also do you see how your base motivation is coherence then and not the bible once again if the bible becomes heights
7.21E+17,and why do you believe heights
7.21E+17,do you still believe heights
7.21E+17,here we go so logic is the reason you believe the bible the bible doesnt come heights
7.21E+17,i think much of the reformation was off heights
7.21E+17,i totally admit my presuppositions i assume we are real in some sense that love is heights
7.21E+17,if that scripture ever leaves the character of jesus that the scriptures themselves portray the scripture should heights
7.21E+17,im more roman catholic or orthodox than protestant on heights
7.21E+17,is that a logical conclusion or an assumption in heights
7.21E+17,jesusfollowers tell storyfollowers organize and form churchchurch wrote heights
7.21E+17,late nights with my work wives bird bakery heights
7.21E+17,look at the perfume centerpieces the flowers and decor are gorgeous thank you for this event heights
7.21E+17,love haircutters studio heights
7.21E+17,modernism the enlightenment fundamentally changed epistemology your and much of protestsntisms epistemology is heights
7.21E+17,not true you can build on assumptions heights
7.21E+17,only have you thoroughly looked at all worldviews and analyzed heights
7.21E+17,party on boardway whole team heights
7.21E+17,reminds me of a beatles song heights
7.21E+17,so if the bible ever refutes that primary reason that makes you believe in it do you still believe in heights
7.21E+17,so is logic primary or heights
7.21E+17,so the bible is valuable only in that line imo the church of jesus gives us scripture so it is heights
7.21E+17,thank you mike sieger for your sweet and inspiring story heights
7.21E+17,very quick lunch at in san antonio tx heights
7.21E+17,which argument of mine are you referring heights
7.21E+17,you do realize the church assembled the bible hundreds of years after jesus heights
7.21E+17,conquista resurrection catholic church
7.21E+17,meet n greet peter piper pizza in alamo tx
7.21E+17,were click to apply pct tx
7.21E+17,can you recommend anyone for this texas
7.21E+17,love these girls red horse boutique
7.21E+17,such a great time with these aledo ladies hebscott with much fun
7.21E+17,girls abby tellomettlach relay boys travis
7.21E+17,gp favianna
7.21E+17,im so proud of my best friend and my team weve been through so
7.21E+17,just finished up an order of here at
7.21E+17,megan
7.21E+17,selection is the best youll find in the area its stocked full of the best
7.21E+17,a donald trump presidency would be bad for corporate deal making global survey
7.21E+17,alert hair stylist great clips tx
7.21E+17,already ran code once tonight cant wait to do it again
7.21E+17,bogo lunch bjs restaurant and brewhouse in allen tx
7.21E+17,can you recommend anyone for this restaurant team member crew tx
7.21E+17,can you recommend anyone for this sales associate tx
7.21E+17,can you recommend anyone for this tx
7.21E+17,can you recommend anyone for this windows iis administrator tx
7.21E+17,director of marketing business development ii simon EMO_NEG tx
7.21E+17,dog park dog park canine commons
7.21E+17,drinking a crackberry by at
7.21E+17,drinking a witbier by allen tx
7.21E+17,excited to see the jungle book cinemark allen
7.21E+17,full time salesdressbarn dressbarn EMO_NEG tx
7.21E+17,glen rose drive allen texas
7.21E+17,got some new kicks and thought id share_ converse all star
7.21E+17,grateful would be an understatement allen event center
7.21E+17,i love representing and the whole family thanks to
7.21E+17,im at bjs restaurant and brewhouse in allen tx
7.21E+17,im at bjs restaurant and brewhouse in allen tx
7.21E+17,in tx line cook at bjs restaurants inc
7.21E+17,in tx network engineer ii at jack henry associates inc
7.21E+17,interested in a near tx this could be a great fit
7.21E+17,interested in a near tx this could be a great fit
7.21E+17,interested in a near tx this could be a great fit
7.21E+17,interested in a near tx this could be a great fit
7.21E+17,jack henry associates inc malware research engineer ii tx
7.21E+17,join the the vitamin shoppe team see our latest opening here tx
7.21E+17,kmcdonald7 alumni allen texas
7.21E+17,love these nude nails on sarah with a splash of sparkle
7.21E+17,man let me tell youbarbershop the next cut was soo awesome from the comedy to the drama to
7.21E+17,prom week allen texas
7.21E+17,sales associate chicos EMO_NEG tx
7.21E+17,see our latest tx and click to apply head cashier
7.21E+17,see our latest tx and click to apply learning development facilitator ii
7.21E+17,see our latest tx and click to apply retail commission sales flex fairview tx macys
7.21E+17,see our latest tx and click to apply store manager
7.21E+17,see our latest tx and click to apply systems programmer manager
7.21E+17,so proud of my baby boy for his confirmation this evening and
7.21E+17,sweepstakes all ones for this crew allen performing arts center
7.21E+17,the texas revolution indoor football
7.21E+17,this might be a great fit for you shift supervisor trainee tx
7.21E+17,tx retail sales consultant at havertys furniture
7.21E+17,tx store manager at whbm
7.21E+17,want to work at jack henry associates inc were in tx click for details
7.21E+17,want to work at jack henry associates inc were in tx click for details
7.21E+17,want to work at jack henry associates inc were in tx click for details
7.21E+17,want to work in tx view our latest opening
7.21E+17,want to work in tx view our latest opening
7.21E+17,want to work in tx view our latest opening
7.21E+17,well yes i am tired after the mavs game and the bluesblackhawks overtime but so what there are
7.21E+17,were click to apply assistant store manager tx
7.21E+17,were click to apply full time salesdressbarn tx
7.21E+17,were in love__ allen performing arts center
7.21E+17,whbm support associate tx
7.21E+17,when your choir becomes your family__ we are not the best but we tried__
7.21E+17,caught a little swallow hanging out above the door there are dozens of nests above our front
7.21E+17,mass volume density
7.21E+17,cvs health pharmacy technician tx
7.21E+17,delii mi segundo lugar favorito whataburger in mission tx
7.21E+17,ughh taco rico in mission tx
7.21E+17,can you recommend anyone for this tx
7.21E+17,tx parttime administrative assistant at resourcemfg
7.21E+17,alert shift supervisor us starbucks
7.21E+17,alvin isd educator sings at austin music festival
7.21E+17,annual alvin rotary frontier days celebration
7.21E+17,another colorway of the nike air more uptempo is hitting shelves
7.21E+17,bari rocky launch vlone x offwhite collaboration
7.21E+17,come on rain city of alvin in alvin tx
7.21E+17,county road casteel rd alvin tx beds baths
7.21E+17,done for the day jodies hair center in alvin tx
7.21E+17,done for the day patricia suhre stylist colorist in alvin tx
7.21E+17,fathers day gifts from james dean eyewear
7.21E+17,finally home for the night fairway square apts in alvin tx
7.21E+17,harwell cir alvin tx beds baths
7.21E+17,home hell home fairway square apts in alvin tx
7.21E+17,home sweet home casa de suhre in alvin tx
7.21E+17,im at china buffet in alvin tx
7.21E+17,im proud of myself my feet not so much im going to have to
7.21E+17,im proud of myself my feet not so much im going to have to
7.21E+17,join the cvs health team see our latest opening here tx
7.21E+17,s lee st alvin tx beds baths
7.21E+17,shopping with jim was a hoot i needed the laughs kroger
7.21E+17,the texans are going to make history this year winning the super
7.21E+17,volunteering with my nrwhopecicles new hope church alvin campus in alvin tx
7.21E+17,w adoue st alvin tx beds baths
7.21E+17,want to work at sonic drivein were in tx click for details
7.21E+17,way too hot city of alvin in alvin tx
7.21E+17,alert physician cardiologist department of veterans affairs tx
7.21E+17,alert restaurant manager ihop acg texas tx
7.21E+17,alert store management internship loves travel stops country st tx
7.21E+17,amarillo tx tonight
7.21E+17,amarillo tx tonight st
7.21E+17,best experience cadilac ranch amarillo tx
7.21E+17,bicycle today go wow someone today amarillo fudds coming in may
7.21E+17,champion en directo trikys bar
7.21E+17,department of veterans affairs rn staff nurse tx
7.21E+17,four confirmed tornadoes in ok panhandle
7.21E+17,good morning amarillo
7.21E+17,graffiti and steel cadillac ranch in amarillo texas
7.21E+17,home to get ready for the ok trip reddoch manor in amarillo tx
7.21E+17,ihop acg texas host tx
7.21E+17,im at
7.21E+17,im at butlers in amarillo tx
7.21E+17,im at mcdonalds in amarillo tx
7.21E+17,im so happy i could flip a pancake ye old
7.21E+17,in the news april is child abuse preve tion month aayc
7.21E+17,in tx product service supervisor at lowes stores
7.21E+17,in tx restaurant team member crew at sonic drivein
7.21E+17,interested in a near tx this could be a great fit
7.21E+17,interested in a near tx this could be a great fit
7.21E+17,join the ihop acg texas team see our latest opening here tx
7.21E+17,looking at switches at in amarillo tx
7.21E+17,milk face because he is only weeks vet advised me to give him a milk substitute
7.21E+17,off coupons joann fabric and craft in amarillo tx
7.21E+17,olive oil cake and balsamic cherry ice cream it really is good
7.21E+17,oreilly auto parts parts delivery tx
7.21E+17,quick shopping trip with the family target in amarillo tx
7.21E+17,see our latest tx and click to apply customer service associate ii
7.21E+17,see our latest tx and click to apply dish machine operator
7.21E+17,see our latest tx and click to apply sales associate
7.21E+17,significant weather advisory for northeastern deaf smith northwestern randallpotter and southeastern oldha
7.21E+17,such a cool museum jack sisemore rv museum in amarillo tx
7.21E+17,this is what friendship looks like rick husband amarillo international airport ama in amarillo tx
7.21E+17,this little man sleeps so weird
7.21E+17,this might be a great fit for you general manager tx
7.21E+17,this might be a great fit for you service assistant tx
7.21E+17,three different sections of level today the response in each to baptism presentations spontaneous songs of praise
7.21E+17,time for a fill up at in amarillo tx
7.21E+17,tonight at hoots pub hoots pub
7.21E+17,tx cdla owner operator truck driver truckload big at roadrunner transportation
7.21E+17,want to work at loves travel stops country st were in tx click for details
7.21E+17,want to work at sonic drivein were in tx click for details
7.21E+17,want to work in tx view our latest opening
7.21E+17,want to work in tx view our latest opening
7.21E+17,we love our youth and the youth of this city generation next
7.21E+17,welltomorrow marks year at nicksfightclub in one year ive
7.21E+17,were click to apply diesel mechanic tire care tx
7.21E+17,were click to apply host tx
7.21E+17,were click to apply per diem hospice nurse practitioner texas
7.21E+17,were read about our latest opening here assistant manager tx
7.21E+17,were read about our latest opening here cdl class a drivers needed
7.21E+17,were read about our latest opening here dish machine operator tx
7.21E+17,were read about our latest opening here personal care attendant texas
7.21E+17,were read about our latest opening here registered nurse rn
7.21E+17,were read about our latest opening here rn staff nurse community living center
7.21E+17,whbm store manager tx
7.21E+17,when you eat a whole ounce steak and sides and beat whole grown men in competition the
7.21E+17,que canciones mill
7.21E+17,watching the romulons with westwood apartments in austin tx mill
7.21E+17,alert general manager restaurant loves travel stops country st tx
7.21E+17,alert manager loves travel stops country st tx
7.21E+17,angleton city council hopefuls address community at luncheon
7.21E+17,another colorway of the nike air more uptempo is hitting shelves
7.21E+17,bari rocky launch vlone x offwhite collaboration
7.21E+17,cr angleton tx
7.21E+17,fathers day gifts from james dean eyewear
7.21E+17,houston st angleton tx beds baths
7.21E+17,hurricane predictions
7.21E+17,n kaysie st angleton tx beds baths
7.21E+17,phillips rd angleton tx bath
7.21E+17,see our latest tx and click to apply general manager in training
7.21E+17,try crust availability prices participation delivery areas and charges and minimum purchase
7.21E+17,want to work at cvs health were in tx click for details
7.21E+17,for some reason ally doesnt want me to wear my hat into the nhs
7.21E+17,see our latest tx and click to apply shift supervisor trainee
7.21E+17,but about to hit that mark pass
7.21E+17,i cant wait for this layoff i need a very long pass
7.21E+17,a slight change of pace for a sunny friday starbucks
7.21E+17,accident three right lanes blocked in on eb at new york ave stopped traffic back to matlock rd delay of mins
7.21E+17,alert pharmacy technician cvs health tx
7.21E+17,alert primary care physicians needed in medical center of arlington tx
7.21E+17,alert registered nurse rn cardiovascular accountable healthcare staffing tx
7.21E+17,alert restaurant general manager ihop acg texas tx
7.21E+17,alert supervisor cholula porch delaware north tx
7.21E+17,arlington peeps join me saturday morning at fitness nationarlington for an early morning
7.21E+17,assistant director of dining servicesuniv of texasarlington compass group usa EMO_NEG tx
7.21E+17,baby waiting games arlington
7.21E+17,back at the ballparkhes gonna turn me into baseball fan yet globe life park in arlington
7.21E+17,baseball time in texas on jackie robinson day globe life
7.21E+17,be your own competition dont worry about what others think you be your own judge and find
7.21E+17,bein and stuff with
7.21E+17,beltre just got a contract extension so were jazzed
7.21E+17,best friends who go to sketchy wig stores together stay together kiwi beauty supply
7.21E+17,better off contacting than
7.21E+17,boiling king crab
7.21E+17,bonding arlington
7.21E+17,boy my schedules a mess the university of texas at arlington
7.21E+17,brady is single and a double tonight at arlington martin we are losing bottom of
7.21E+17,can you recommend anyone for this registered nurse rn intensive care unit
7.21E+17,can you recommend anyone for this sustainability project manager arlington texas tx
7.21E+17,can you recommend anyone for this tx
7.21E+17,can you recommend anyone for this tx
7.21E+17,can you recommend anyone for this tx
7.21E+17,caption this arlington parks and recreation
7.21E+17,carrera matutina con bella arlington texas
7.21E+17,checked in globe life park for the vs game
7.21E+17,checkedin corner store n state highway
7.21E+17,checkedin corner store six flags dr
7.21E+17,co worker hooked it up for me arlington texas
7.21E+17,compass group usa director of operationspotential new businessu of tx arlington tx
7.21E+17,construction work in on wb near great sw pkwy stopped traffic back to carrier pkwy delay of mins
7.21E+17,cowboy boots and cowboys dallas cowboys
7.21E+17,damn its been a long long time since i played some
7.21E+17,darty texas rangers ballpark in arlington
7.21E+17,data analysts bring new tools to the table
7.21E+17,date night with my hunky husband and my favorite beverage
7.21E+17,dave and busters with this crazy crew tonight photo cred ron_fulton dave busters
7.21E+17,delaware north busser captain morgan club tx
7.21E+17,delaware north ice cream attendant suites tx
7.21E+17,delaware north porter concessions warehouse day crew tx
7.21E+17,delaware north tx
7.21E+17,dinner with pop and big sis red robin gourmet burgers in arlington tx
7.21E+17,dinos subs no the big d with a cold me back to my childhood dinos
7.21E+17,dont know bout yall but i sleep pretty good every night
7.21E+17,double giveaway globe life park in arlington for orioles vs rangers
7.21E+17,drinking a stormcloud by at
7.21E+17,drinking the temptress by sherlocks baker street pub grill
7.21E+17,during national anthem tonight in texas
7.21E+17,during tonights national anthem in texas stadium
7.21E+17,el mundo es como un espejo que devuelve a cada persona un reflejo de lo que a echo en su vida y
7.21E+17,enjoying life with you__ texas rangers ballpark in arlington
7.21E+17,etx_odphi holding it down at uta s alpha rho unveiling
7.21E+17,fedex office center assistant manager tx
7.21E+17,finally were here after days of travelling nice to see you again krizzaa arlington
7.21E+17,finishes up front side with back to back birdies and this birdie decides to land on tee
7.21E+17,fireworks to cap off a historic os win texas rangers ballpark in
7.21E+17,friday night baseball orioles vs rangers texas rangers ball park
7.21E+17,gbbyhrpr nd me singing usher ft lil freak six flags
7.21E+17,get you a woman that will love you and go to baseball games with ya__
7.21E+17,getting my first tan coating applied for the southwest usa
7.21E+17,giving the the texas rangers experience
7.21E+17,globe life park in arlington
7.21E+17,globe life park in arlington
7.21E+17,globe life park in arlington
7.21E+17,globe life park in arlington
7.21E+17,go team the seed company
7.21E+17,god gives you the peace you wont find in mankind trust
7.21E+17,goodnight from arlingtons dream sculpture in downtown read more about this sculpture our
7.21E+17,got my ticket for tonights game now time for party favors beer
7.21E+17,hair stylist great clips EMO_NEG tx
7.21E+17,happy birthday to my super beautiful
7.21E+17,happy jackie robinson day globe life
7.21E+17,hello gorgeous tonight are in frisco for aa fun but sat and sun we are here
7.21E+17,helluva friday in texas huge thank you very kindly to prince and
7.21E+17,here for tcu night picked up this nice hat globe life park in arlington
7.21E+17,how would you wear it
7.21E+17,i am happy as fck six flags over texas
7.21E+17,i surrender tails
7.21E+17,if youre a professional in tx check out this
7.21E+17,if youre a professional in tx check out this
7.21E+17,if youre a professional in tx check out this
7.21E+17,im at between the temple and death star in arlington tx
7.21E+17,im at caves lounge in arlington tx
7.21E+17,im at globe life park in arlington for baltimore orioles vs texas rangers in arlington tx
7.21E+17,im at globe life park in arlington for baltimore orioles vs texas rangers in arlington tx
7.21E+17,im at in arlington tx
7.21E+17,im at speeds billiards and games arlington in arlington tx
7.21E+17,in tx busser jack daniels club at delaware north
7.21E+17,in tx director of dining servicesuniv of texasarlington at compass group usa
7.21E+17,in tx dish machine operator at ihop acg texas
7.21E+17,in tx dishwasher jack daniels club at delaware north
7.21E+17,in tx pharmacy technician at cvs health
7.21E+17,in tx restaurant general manager at ihop acg texas
7.21E+17,in tx restaurant team member crew at sonic drivein
7.21E+17,in tx retail sales consultant at
7.21E+17,instead of going to class night and i decided to go to a baseball game globe life
7.21E+17,interested in a near south cooper tx this could be a great fit
7.21E+17,interested in a near tx this could be a great fit
7.21E+17,interested in a near tx this could be a great fit
7.21E+17,interested in a near tx this could be a great fit
7.21E+17,interested in a near tx this could be a great fit
7.21E+17,interested in a near tx this could be a great fit
7.21E+17,interested in a near tx this could be a great fit
7.21E+17,it is baseball time in texas globe life park in arlington
7.21E+17,it was a good night for baseball texas rangers
7.21E+17,its about that time arlington texas
