uid,
7.21E+17,clearly from ewomennetwork is a bundle of fun and clearly im much taller
7.21E+17,click link in bio
7.21E+17,cliffbrook ct houston tx beds baths
7.21E+17,cliffmarshall st houston tx beds bath
7.21E+17,clinical spclst i houston methodist hospital EMO_NEG tx
7.21E+17,closed due to major accident in on sw fwy outbound at weslayan
7.21E+17,closed due to wheeler accident in on i45 gulf fwy inbound at broadway
7.21E+17,closed due to wheeler accident in on i45 gulf fwy inbound at broadway stop and go traffic back to monroe
7.21E+17,closed due to wheeler accident in on i45 gulf fwy inbound at broadway stopped traffic back to monroe delay of
7.21E+17,closed due to wheeler accident in on sw fwy outbound at weslayan
7.21E+17,clowning with the kids at
7.21E+17,club quarters hotel in houston
7.21E+17,coach ced sports and fitness
7.21E+17,coach ced sports and fitness
7.21E+17,cody in honor band tomball memorialhigh school
7.21E+17,collaboration houston
7.21E+17,come cop one at langley rd for
7.21E+17,come hang out with terragina and rose for happy hour at our baybrook location the
7.21E+17,come in were hiring monday thursday am pm call for interviews in touch
7.21E+17,come out and support our football team and show respect to our two fallen soldiers hate that
7.21E+17,come out and support your houston dynamo vs la galaxy tonight
7.21E+17,come pull up on the kid at tonight ima be dropping some new warehouse live
7.21E+17,come support your tiger football team this saturday at at the
7.21E+17,come through shape community center
7.21E+17,come to the club before and get some fliers for later tonight ask for frank bonitas
7.21E+17,comfort zone is where your dreams go to die hotel zaza
7.21E+17,coming down dripping candy on the ground houston texas
7.21E+17,coming soon create
7.21E+17,community service neighborhood centers wesley community center in houston tx
7.21E+17,como lumen
7.21E+17,company customer appreciation crawfish boil drinking a shiner bock by engineers
7.21E+17,con el gera gusto en saludarte viejon lewis food town
7.21E+17,con la chappie alamo drafthouse mason in katy tx
7.21E+17,congrats to our awesome buyer on his investment purchase thank you brittany
7.21E+17,congrats to the students of my graphic novel seminar on their class show match midtown arts
7.21E+17,congrats to the warriors on breaking the bulls record tho houston astros minute maid park
7.21E+17,continues to grow contact us today xtreme nitelife
7.21E+17,convertible top open minute maid park
7.21E+17,cooking pork chops never gets old underbelly
7.21E+17,coordinator case management st joseph medical center EMO_NEG tx
7.21E+17,coppercrest
7.21E+17,corporate medicare billing follow up tx
7.21E+17,counting down its almost time grab those tickets you might just have the winning ticket these
7.21E+17,country music and fire works love my state god
7.21E+17,couple things by far my favorite makeup removing face wipes
7.21E+17,coverall field a must tx
7.21E+17,crawfish time
7.21E+17,creekside the woodlands tx
7.21E+17,creepy bathroom selfieamy quit smelling my neck texas t tavern
7.21E+17,crescent mountain ln humble tx beds baths
7.21E+17,crew member einstein bros bagels EMO_NEG tx
7.21E+17,cringe houston texas
7.21E+17,crispy duck fontina pizza at hs green h.s green
7.21E+17,crude oil accountant downtown growing team robert half finance accounting EMO_NEG tx
7.21E+17,crystal ct houston tx beds baths
7.21E+17,cuban gov needs to end apartheid of its own people
7.21E+17,currently here at boys getting beefy lol fit factory houston
7.21E+17,customer service cashier retail loves travel stops country st EMO_NEG tx
7.21E+17,cute behind the scenes shot of yesterdays shoot with at the studio
7.21E+17,cvs health pharmacy technician target store tx
7.21E+17,cvs health pharmacy technician target store tx
7.21E+17,cvs health pharmacy technician tx
7.21E+17,cvs health retail store positions tx
7.21E+17,d__z houston texas
7.21E+17,da janela lateral do quarto de dormir houston texas
7.21E+17,dale dale dale dynamo bbva compass stadium
7.21E+17,dallas tonight we got that merch hwy
7.21E+17,dangerouscurves2dd and i chillin the caddy shack
7.21E+17,dawg
7.21E+17,day bp ms150 tully stadium
7.21E+17,de baile con mi princesita el matador bar grill
7.21E+17,de larosa sosa charged w counts failure to render aid counts felony racing khou news houston
7.21E+17,deborah mouton jeremyah payne will be performing at
7.21E+17,decided to do some abs after i regained a bit of energy after doing some power leg
7.21E+17,dee_since81 grooves restaurant lounge
7.21E+17,definitely wild lots going on finish seems like it almost wants to sour but do ape snake
7.21E+17,delahaye competition coupe sculpted in steel at and
7.21E+17,delahaye competition coupe sculpted in steel at and
7.21E+17,delicious drinking a coffissar mysterium verum by at
7.21E+17,delicious ipa with a slight barrel aged not upfront finished s stone sierra nevada nxs ipa
7.21E+17,delightful dinner with amazing friends peli peli in houston tx
7.21E+17,delivering yummy alfajores get your boxes before they are all gone
7.21E+17,democratic national debate cinema de layfield el memorial in houston tx
7.21E+17,dep alden clopton is an veteran of the harris co pct constables office abc13
7.21E+17,deputy recovering in hospital after being shot multiple times
7.21E+17,desde vertigo houston y djscanproches nombres que se ponen estos vatos
7.21E+17,despite teslas success toyota hypes hydrogen cars
7.21E+17,details
7.21E+17,devil dont stay
7.21E+17,dewberry shores ln humble tx beds baths
7.21E+17,din din with the baes houston texas
7.21E+17,dinner club7 years strong collinas italian cafe
7.21E+17,discover united states visit houston
7.21E+17,disney symphony time with louis alan jones hall in houston tx
7.21E+17,distant woods dr houston tx beds baths
7.21E+17,district meter relay champions on to regionals barnett stadium
7.21E+17,divine moon club movie time friday at come enjoy good wine good food
7.21E+17,dj mr rodgers bday bash drink houston
7.21E+17,djing at till come by and boogie down with your ol uncle remix
7.21E+17,djing the gala it was amazing tomm house
7.21E+17,dm me for info houston texas
7.21E+17,do you really care though
7.21E+17,document review project coordinator robert half legal EMO_NEG tx
7.21E+17,doliver dr houston tx beds baths
7.21E+17,dolph pulled up
7.21E+17,done and done green
7.21E+17,dont judge me lol houston zoo
7.21E+17,dont put your fucking hands on a female
7.21E+17,dont sleep on this expo so many opportunities for everyone vendors get your booth showcase
7.21E+17,donuts for dinner at in houston tx
7.21E+17,dormstom ln houston tx beds baths
7.21E+17,dorothy st houston tx beds baths
7.21E+17,dorothy st houston tx beds baths
7.21E+17,dos and crawfish cedar creek bar grill
7.21E+17,download our ios app for latest news and weather in houston local now wishes you a great friday evening
7.21E+17,download the app and be ready for the april launch of ladies choice radio nurturing the
7.21E+17,drag the lake
7.21E+17,drinking a black raz by at
7.21E+17,drinking a conspiracy theory by at
7.21E+17,drinking a divine reserve no by at
7.21E+17,drinking a guinness draught by dave busters
7.21E+17,drinking a haterade by at
7.21E+17,drinking a hi5 ipa by sith tavern imperial culinary academy
7.21E+17,drinking a hibernation ale by at
7.21E+17,drinking a love street by at
7.21E+17,drinking a saigon sunset by at
7.21E+17,drinking a sams wake n bake by at
7.21E+17,drinking a samuel adams boston lager by dave busters
7.21E+17,drinking a shiner birthday beer by uncle touchys naked puzzle basement
7.21E+17,drinking an by piola
7.21E+17,drinking an elissa ipa by at
7.21E+17,drinking an oclock pils by at
7.21E+17,drop a in a ginger ale it taste like bubbly
7.21E+17,dropping monday available on spotify
7.21E+17,dunain park ct houston tx beds baths
7.21E+17,dynamo are down which makes for a sad claudia and linda boo its a good thing our happy juice
7.21E+17,dynamo v la plenty of time for a comeback right bbva compass stadium for lag vs hou
7.21E+17,dynamo vs galaxy bbva compass stadium for in houston tx
7.21E+17,dynamo vs la galaxy bbva compass stadium
7.21E+17,each and every third of the month come enjoy with and
7.21E+17,early work saturday but id rather be running memorial hermann hospital at medical
7.21E+17,earning my till the bell rings and they turn off the lights
7.21E+17,eat at today and say its for the of proceeds will go to
7.21E+17,edwards houston marqe imax rpx for cloverfield lane in houston tx
7.21E+17,eight row babes eight row flint
7.21E+17,emerson electric co engineering director electrics tx
7.21E+17,en vertigoclubhouston vertigo houston
7.21E+17,enchanted path so magical
7.21E+17,everybody knows it yup thats my bitch percent cheer babies
7.21E+17,everything aint for
7.21E+17,ewebresults
7.21E+17,exchanging my prosthesis second silhouette in houston tx
7.21E+17,excited about the progress we made today
7.21E+17,excited for the iriscovetbook launch this saturday this time with the correct
7.21E+17,excited to see tomorrow at plugged in so great to have them in studio
7.21E+17,exclusive army approves first female officers for ground combat jobs
7.21E+17,ey advisory senior consultant cybersecurity incident response tx
7.21E+17,eyes on tha prize lets run up a check103 mlk blvd
7.21E+17,f th_ fa can go church houston texas
7.21E+17,f unicorns its time to fly like the phoenix circularb hotel zaza
7.21E+17,faculty i diploma zenith education group EMO_NEG tx
7.21E+17,fairgrove park dr houston tx beds baths
7.21E+17,fall river pass ln humble tx beds baths
7.21E+17,fam crossoverbf this sunday made to make the greatest thing we
7.21E+17,family memories and family support at the shield bearer family fun run and walk
7.21E+17,family memories and family support at the shield bearer family fun run and walk
7.21E+17,famous pineapple seafood mixture of seafood prepares in a flavored light cream with
7.21E+17,fancy nature starbucks louisiana
7.21E+17,fashionfoodies and the beauties and raining men oh yessupporting with
7.21E+17,fat shamming
7.21E+17,fatal crash shuts down southwest freeway at new castle it just opened houston news
7.21E+17,fathers day gifts from james dean eyewear
7.21E+17,fathers day gifts from james dean eyewear
7.21E+17,fathers day gifts from james dean eyewear
7.21E+17,fathers day gifts from james dean eyewear
7.21E+17,fathers day gifts from james dean eyewear
7.21E+17,fathers day gifts from james dean eyewear
7.21E+17,fathers day gifts from james dean eyewear
7.21E+17,favorite health care staffing licensed practical nurse lpn tx
7.21E+17,favorite health care staffing registered nurse rn pacu tx
7.21E+17,fbf to a night out with baby love you are the picture of beauty grace compassion hospitality
7.21E+17,fedex office retail customer service associate tx
7.21E+17,fedex worker falls asleep stows away on texas flight
7.21E+17,feel good friday is almost here get ready to get your laugh on at the on friday may
7.21E+17,feels like i just got off work at ttbc and now at the airport heading to road atlanta for the
7.21E+17,ffps fields george bush park
7.21E+17,fidelity investments wealth management relationship manager tx
7.21E+17,field service technician aerotek EMO_NEG tx
7.21E+17,final for this beautiful new construction almost closing time excited for my
7.21E+17,final game of the season for my md baseball sluggers in so proud of
7.21E+17,finally home now im about to watch the film day of the
7.21E+17,finally made it to nourishjuicebarhtx for an after workout smoothie i had nanas
7.21E+17,finally pete is feeling
7.21E+17,finish them houston astros
7.21E+17,first comes heights then comes marriage
7.21E+17,first crawfish out of the boil a pound plus sides every friday saturday sunday from
7.21E+17,first game back at the juice box this year houston astros
7.21E+17,first game for the buckley boys good to be back minute maid park
7.21E+17,first phase of body camera rollout at hpd central patrol division hounews
7.21E+17,first shoot of the day picos chef arnaldo and plates of food at picos one shoot down
7.21E+17,first time meeting russell simmons at his book signing in houston in i guess he
7.21E+17,fliying back george bush intercontinental airport iah in houston tx
7.21E+17,fo fo and me at byz byzantio
7.21E+17,follow on
7.21E+17,food for the road at in houston tx
7.21E+17,for appointments also by the
7.21E+17,for certificate at bathtub refinishing houston
7.21E+17,for our anniversary great seats good music wortham
7.21E+17,for the weekend george bush intercontinental airport
7.21E+17,foreva got my lil bro back u digg houston texas
7.21E+17,forget the lessons if it sounds good it is good
7.21E+17,found my mommy her mob dress today love her houston texas
7.21E+17,fountain hermann park
7.21E+17,four seasons hotel houston
7.21E+17,fowler pines dr humble tx beds baths
7.21E+17,fox hollow
7.21E+17,fresenius medical care patient care technician home program tx
7.21E+17,friday april
7.21E+17,friday april
7.21E+17,friday april
7.21E+17,friday april focus jackie focus
7.21E+17,friday april go houston texas
7.21E+17,friday april im focused man jayz
7.21E+17,friday night turn up
7.21E+17,friday vibes baanou
7.21E+17,friday vibrations houston texas
7.21E+17,fridayfridayfridayfriday this is my first time there so i would the
7.21E+17,friend x sister pure club lounge turnt up fridays
7.21E+17,frisky river friday whiskey river houston
7.21E+17,friyay wonder brewery in houston tx
7.21E+17,from lazendanortena_promo nos vemos este en
7.21E+17,from nos vemos hoy en en junto a
7.21E+17,from to with by for menil
7.21E+17,fun night houston astros minute maid park
7.21E+17,funners howl at the moon houston
7.21E+17,gala fun the merrill house
7.21E+17,game on come watch the lacrosse game pershingms pershing middle
7.21E+17,gang or die__ houston astros minute maid park
7.21E+17,gday mate this float baby visited us from down under making him the farthest traveling
7.21E+17,genesee st houston tx beds baths
7.21E+17,george bush intercontinental airport iah in houston tx
7.21E+17,get yo money
7.21E+17,getting closer to home george bush intercontinental airport iah in houston tx
7.21E+17,getting our infusion flights on we may need of
7.21E+17,getting ready for this weekend bike barn
7.21E+17,getting xpel houston
7.21E+17,gilbert khou with blushh warehouse live
7.21E+17,giveaway time take a selfie with a or charger at and tag us and use
7.21E+17,giving thanks and praise st michaels catholic church in houston tx
7.21E+17,glenbank way houston tx beds baths
7.21E+17,go astros minute maid park for detroit tigers vs houston astros in houston tx
7.21E+17,go tigers
7.21E+17,go watch all my music video here add me on snapchat zaena_morisho
7.21E+17,go wins are always better in stellar seats minute maid park
7.21E+17,gol
7.21E+17,gon be a legend in my city im da youngest nigga reppin houston texas
7.21E+17,gone wow8 spa nails co
7.21E+17,good beer has a real pinot grigio feel and tast drinking a bourbon peach american wild ale at
7.21E+17,good food good company the pass and provisions
7.21E+17,good luck to everyone this weekend with tournament baseball be safe play hard anticipate
7.21E+17,good morning beautiful people have a happy thursday houston texas
7.21E+17,good morning houston the veldt espresso is back ethiopia rwanda delicious dark chocolate
7.21E+17,good morning strategic
7.21E+17,good morning world lady crochets house of crochet fashion cell may your day
7.21E+17,good night
7.21E+17,good times
7.21E+17,gosh this high school is yuge here for codys honor band performance tomball memorial h.s in tomball tx
7.21E+17,got
7.21E+17,got caught with my head down than heard amen but im blessed up next
7.21E+17,got my bro maciasm624 for his many to yall fam
7.21E+17,got to spend some time with the viral justin bieber dancer officer d moore his awesome wife
7.21E+17,gotta love the road show nicks place
7.21E+17,grabbing a cocktail with bae catbirds lounge patio bar
7.21E+17,grabbing lunch for my babyluv el rey taqueria in houston tx
7.21E+17,grateful for these beautiful purpleblooming flower vines growing with our bamboo
7.21E+17,great hefe maybe the best if not a close second to my favorite hacker pschorr hefeweizen
7.21E+17,great shot of downtown houston tonight from abc13eyewitness joshua gonzalez he shared this pic on instagram
7.21E+17,great time last night showing a liverpool fc legend how we do sports in houston
7.21E+17,great way to start this series
7.21E+17,greater houston partnership information technology support technician tx
7.21E+17,gusto ver a dr amjadi el mejor de en y y
7.21E+17,ha ha kmsl its very funny to me lol houston texas
7.21E+17,had a blast as always scratcheventsdjs
7.21E+17,had it bourbon barrel aged but never the lone hellfighter expla hellfighter imperial porter
7.21E+17,had to bring the trailer for some after work work lol planet ford
7.21E+17,had to cop this one wired up modern conveniences
7.21E+17,had to repost this clip of my crush
7.21E+17,haha experience prison break tattoos today come see why we are houstons hottest new theme
7.21E+17,halliburton houston us international income tax specialist tx
7.21E+17,hallowed ground
7.21E+17,hang on orbit minute maid park
7.21E+17,hanging out with mom this morning dental illusions
7.21E+17,happened to him g my stomach hurts im off here
7.21E+17,happy birthday erinmione love you girl prospect park sportsbar
7.21E+17,happy birthday sarah
7.21E+17,happy cougar red friday university of houston
7.21E+17,happy early birthday to me__ texas roadhouse spring tx n houston
7.21E+17,happy for elijah will be here soon and we celebrated that this morning
7.21E+17,happy friday one misstep doesnt have to throw you off course get back on track and enjoy
7.21E+17,happy friday tax from my favorite restaurant in houston to yours hear we have till
7.21E+17,happy g day warehouse live
7.21E+17,happy is an understatement houston texas
7.21E+17,happy me the breakfast klub
7.21E+17,hard work and dedication trying to prepare for this years lms success u course
7.21E+17,harden named player of the month rockets preparing for playoffs usatodaysportsimages
7.21E+17,have you tried anything from this brewery theyre having a block party at my friends bar today
7.21E+17,having a blast with my friend karen derr at the outsmart party saint arnold brewing company
7.21E+17,having a day miyako
7.21E+17,having dinner with my love benihana
7.21E+17,having good time houston motorsports park
7.21E+17,hearing jennie allen speak twice in one this brave woman is inspiring a
7.21E+17,heavenly father i confess that my first instinct when hardship comes is often to grumble and
7.21E+17,heavy rain threat may bring flooding to parts of our area early next week especially monday and tuesday
7.21E+17,heels and bowtie may at cool runnings edition klein
7.21E+17,heels and bowtie may at cool runnings houston texas
7.21E+17,heels handbags and lipstick in hued spring tones only at
7.21E+17,hei hotels resorts director of finance tx
7.21E+17,hello friend minute maid park
7.21E+17,hello liberty drinks and girlfriends a perfect night
7.21E+17,hello world woop new border chinese buffet
7.21E+17,hello yes ive been told i put in work a time or two houston texas
7.21E+17,heres a photo that i shot last night for the houston grand operas new production of wagners
7.21E+17,hes looking she falls apart__
7.21E+17,hey ern totally impressive the shows youve been doing the world needs a replacement for mr
7.21E+17,hey this is delish keep your pimm hand strong la grange houston
7.21E+17,hey we gon get through this week together big fella tomorrow night rsvp link
7.21E+17,hi daddy zak aka sushi house in houston tx
7.21E+17,him and grant hill going down at the same time
7.21E+17,hiring exotic dancer ask for frank the manager bonitas
7.21E+17,hisd schools named winners of sat promotional campaigns
7.21E+17,hisd schools named winners of sat promotional campaigns
7.21E+17,hisd schools named winners of sat promotional campaigns
7.21E+17,hitting it at in houston tx
7.21E+17,honor band tomball memorialhigh school
7.21E+17,honored to meet starting pitcher last night
7.21E+17,hope your day is filled with iced lattes so pretty and creamy that ya wanna swim in it.__
7.21E+17,host ihop acg texas EMO_NEG tx
7.21E+17,hot off the presses teacher certificates for those who passed the written exam theyll get
7.21E+17,house of blues houston
7.21E+17,house of blues houston
7.21E+17,house of blues houston
7.21E+17,house of blues houston
7.21E+17,house of blues houston
7.21E+17,house of blues houston
7.21E+17,house of blues houston
7.21E+17,house of blues houston
7.21E+17,house of blues houston
7.21E+17,house of blues line cooks house of blues tx
7.21E+17,houston
7.21E+17,houston
7.21E+17,houston arboretum
7.21E+17,houston arboretum nature center
7.21E+17,houston astros minute maid park
7.21E+17,houston astros minute maid park
7.21E+17,houston astros minute maid park
7.21E+17,houston dynamo against la galaxy
7.21E+17,houston dynamo los angeles galaxy
7.21E+17,houston galleria microsoft store
7.21E+17,houston galleria microsoft store
7.21E+17,houston get ready tonight for the last friday turn up for all my
7.21E+17,houston methodist global health international pat liaison prnarabic tx
7.21E+17,houston methodist hospital courier prn shift medical center tx
7.21E+17,houston methodist hospital food service assistant prn shift tx
7.21E+17,houston methodist hospital food services assistant ft shift tx
7.21E+17,houston methodist hospital patient care assistant i full tx
7.21E+17,houston methodist hospital patient care asst i slicu ft day tx
7.21E+17,houston methodist hospital patient care asst ii fulltime tx
7.21E+17,houston methodist hospital regional administrator tx
7.21E+17,houston methodist hospital registered nurse i tx
7.21E+17,houston methodist hospital registered nurse prn tx
7.21E+17,houston methodist hospital registered nursetransplant coordinator ii pre liver tx
7.21E+17,houston methodist hospital respiratory care practitioner float option b shift tx
7.21E+17,houston methodist hospital rn ii ent ophth pacu tx
7.21E+17,houston methodist hospital rn ii rehab ft nights tx
7.21E+17,houston methodist hospital unit administrative assistant tx
7.21E+17,houston methodist hospital unit administrative asst cvicu tx
7.21E+17,houston methodist research insti research assistant tx
7.21E+17,houston methodist research insti sr clinical research tx
7.21E+17,houston methodist specialty phys coding specialist ii tx
7.21E+17,houston methodist specialty phys vascular technologist i pearland outpatient tx
7.21E+17,houston methodist specialty phys vascular technologist tx
7.21E+17,houston methodist st john hospital rn ii ambulatory surgery center pt days tx
7.21E+17,houston methodist west hospital patient care associate ii cardiac rehab tx
7.21E+17,houston methodist willowbrook ho charging coordinator part tx
7.21E+17,houston methodist willowbrook ho medical technologist tx
7.21E+17,houston methodist willowbrook ho registered nurse cath tx
7.21E+17,houston methodist willowbrook ho registered nurse ii med surg days tx
7.21E+17,houston methodist willowbrook ho rn ii float pool full tx
7.21E+17,houston methodist willowbrook ho rn ii float poolfull tx
7.21E+17,houston methodist willowbrook ho utilization specialist lvn tx
7.21E+17,houston motorsports park
7.21E+17,houston rapper paul wall puts on a suit heads to congress grammysonthehill khou
7.21E+17,houston showing mad love lil homie all_about_accezzories and people got
7.21E+17,houston texas
7.21E+17,houston texas
7.21E+17,houston texas
7.21E+17,houston texas
7.21E+17,houston texas
7.21E+17,houston texas
7.21E+17,houston texas
7.21E+17,houston texas
7.21E+17,houston texas
7.21E+17,houston texas
7.21E+17,houston texas
7.21E+17,houston texas
7.21E+17,houston texas
7.21E+17,houston texas
7.21E+17,houston texas
7.21E+17,houston texas
7.21E+17,houston tx tonight ill be doing some acoustic jams starting at yall cmon out
7.21E+17,how ever long it takes thats my answer domcooper11 be fit gym
7.21E+17,how i feel about this floorset tonight thanks
7.21E+17,how i spend my time in between getting kids
7.21E+17,htinee houston texas
7.21E+17,htown houston texas
7.21E+17,huge thanks to sylvia simpson on the purchase of this beautiful brand new
7.21E+17,humble area crime summary
7.21E+17,humble isd announces national merit scholars
7.21E+17,i
7.21E+17,i am getting my beard trimmed next week i look like a bacca houston intercontinental
7.21E+17,i am looking for a buyer on north cotswold manor dr
7.21E+17,i believe this with all my heart and soul
7.21E+17,i can finally show on the outside how i feel on the inside the boulevardier lounge
7.21E+17,i cant believe the astros
7.21E+17,i cant wear baseball caps that arent
7.21E+17,i could never get enough images to do this park justice other places are lovely but nothing
7.21E+17,i def do this for my eyeliner sometimes but thats a lil
7.21E+17,i deprogrammed myself from this hypnotic system of falsities illusions a long time ago im just trying to help others do the
7.21E+17,i dont even remember penny hardaway with the
7.21E+17,i dont know not nicca from tha trey i dont love its a blessing to be alive and free
7.21E+17,i feel so alive right now
7.21E+17,i feel so alive right now
7.21E+17,i feel so alive right now getting body painted live
7.21E+17,i fuxx with snvlife but for lyrics smh on the way p__s__y__c__h__o__
