721298908597657000,fitch is checking out the sunrise over the like on a beautiful spring morning in chicago._,"Chicago, IL",41.97617512,-87.65230084,16/4/2016,11:27,0,0
721151857700245000,fjm riviera theatre in chicago il,"Chicago, IL",41.96856859,-87.65977263,16/4/2016,1:42,0,2
720836802701963000,flashback to my preteen years smashing pumpkins lyric opera civic house,"Chicago, IL",41.88211149,-87.63750498,15/4/2016,4:51,1,1
721118391864541000,flashing back to last years wrigley field,"Chicago, IL",41.94795805,-87.65568063,15/4/2016,23:29,4,1
721169241781743000,flats no,"Chicago, IL",41.96513,-87.66339,16/4/2016,2:52,1,1
720961688430706000,flex quality engineer v il,"Buffalo Grove, IL",42.1662831,-87.9631308,15/4/2016,13:07,6,0
721119063619964000,flipflop leonhard recreation center,"Champaign, IL",40.1021064,-88.2835443,15/4/2016,23:32,0,1
721021688830365000,floor dowtown chicago square feet per month sky55,"Chicago, IL",41.86623,-87.62363,15/4/2016,17:05,0,1
721155317510369000,flowers season pollys petals particulars,"Green Oaks, IL",42.27182711,-87.90624605,16/4/2016,1:56,5,1
721152683378417000,floyds illinois,"La Grange Park, IL",41.81335,-87.86954,16/4/2016,1:46,3,1
721209621747118000,focused foosball with the clique ovation,"Chicago, IL",41.88694,-87.68518,16/4/2016,5:32,1,1
720656530291294000,follett corporation book processor warehouse il,"McHenry, IL",42.3223041,-88.3044908,14/4/2016,16:54,6,0
721165335223734000,follow me chicago illinois,"Chicago, IL",41.8369,-87.6844,16/4/2016,2:36,0,1
721119717071519000,follow me on sc nonnon601 chicago illinois,"Chicago, IL",41.8369,-87.6844,15/4/2016,23:35,0,1
721288276221374000,follow me so we can private chat,"Glenview, IL",42.0980137,-87.8045121,16/4/2016,10:45,0,1
720656533252481000,food service specialistretail sales speedway EMO_NEG il,"Oak Lawn, IL",41.719978,-87.7479528,14/4/2016,16:54,5,0
720778523116494000,fool me twice vu the_,"Chicago, IL",41.91152418,-87.63505554,15/4/2016,0:59,3,1
721317729496477000,for allowing us to run,"Chicago, IL",41.997598,-87.786713,16/4/2016,12:42,6,0
721119411692834000,for at for johnny clegg in chicago il,"Chicago, IL",41.88454719,-87.65718699,15/4/2016,23:34,0,2
721019170054213000,for fun fit family nutrition,"Effingham, IL",39.1226196,-88.5421524,15/4/2016,16:55,4,2
720915718565277000,for in dinner credit bottle of premium wine at lockwood restaurant bar,"Chicago, IL",41.8803,-87.6269,15/4/2016,10:04,0,0
721317884446842000,for the native american they bank on credit cards and getting overdrafts saving consciously is almost impossible for them thats sad,"Chicago, IL",41.9908475,-87.6566487,16/4/2016,12:42,0,0
721015565326925000,for your wellbeing wellbeing korean dining,"Chicago, IL",41.852963,-87.627316,15/4/2016,16:41,0,1
721142266287546000,forever forever never seems that long until youre grown and realize the day by day rule cant_,"Richton Park, IL",41.482,-87.7253,16/4/2016,1:04,0,0
721016175937851000,forever way too early to my genius appointments apple store lincoln park in chicago il,"Chicago, IL",41.910609,-87.64849,15/4/2016,16:43,0,1
721317374981312000,forewarning for anyone traveling today is a because of cps,"Chicago, IL",41.97690122,-87.90298546,16/4/2016,12:40,2,1
721123552099966000,forgot how good the pineapple margarita is EMO_POS esquire lounge,"Champaign, IL",40.11655834,-88.2424745,15/4/2016,23:50,2,1
721128522069254000,formerly inlaws but upscale now primo italian american cuisine in gurnee il,"Gurnee, IL",42.37140966,-87.92377764,16/4/2016,0:10,0,3
721022476902223000,forward air transportation services cdla owner operator team truck il,"Belleville, IL",38.5200504,-89.9839935,15/4/2016,17:08,3,0
720962451424960000,forward air transportation services cdla team owner operator truck il,"Springfield, IL",39.7817213,-89.6501481,15/4/2016,13:10,3,0
721181128971984000,found shorts at kohls yay the rabbit hole in buffalo grove il,"Buffalo Grove, IL",42.16419831,-87.97757867,16/4/2016,3:39,0,1
721093953102168000,founders mosaic promise now available in bottles,"Villa Park, IL",41.896731,-87.978359,15/4/2016,21:52,1,1
721161856920985000,free tramampoline drinking a nightmare by gabriels trampoline,"Plainfield, IL",41.6159,-88.1929,16/4/2016,2:22,0,2
720963759724896000,freebie friday today only new existing preferred customers get a free eye cream when you_,"Joliet, IL",41.55401001,-88.26067036,15/4/2016,13:15,0,0
721118449553043000,frequent customer marianos fresh market in chicago il,"Chicago, IL",41.96905388,-87.67491763,15/4/2016,23:30,0,2
720663239663587000,fresenius medical care hemodialysis registered nurse garfield chicago il il,"Chicago, IL",41.8781136,-87.6297982,14/4/2016,17:21,4,0
721091749481828000,fresenius medical care renal dietitian chatham chicago il il,"Chicago, IL",41.8781136,-87.6297982,15/4/2016,21:44,5,0
720896884647198000,fresenius medical care will train in dialysis inpatient services hemodialysis il,"Elmhurst, IL",41.8994744,-87.9403418,15/4/2016,8:49,1,0
720661809619996000,fresh beans are in dont forget we are open until tonight,"Chicago, IL",41.99794,-87.66266,14/4/2016,17:15,2,0
721094111307173000,fresno chili spaghetti straight out of the machine tonight with octopus bolognese calabrian_,"Chicago, IL",41.8959808,-87.6605606,15/4/2016,21:53,0,0
720590359990960000,friday april a wonderful ninemile ride to a conference and nine miles back on a_,"Urbana, IL",40.106237,-88.221473,14/4/2016,12:31,0,0
721125240407875000,friday in michigan avenue bridge,"Chicago, IL",41.88886111,-87.62436111,15/4/2016,23:57,2,1
721023516238188000,friday is the day two prudential plaza,"Chicago, IL",41.88555556,-87.62277778,15/4/2016,17:12,0,1
721150415648256000,friday knight lights track style minooka community high_,"Minooka, IL",41.44975,-88.26373,16/4/2016,1:37,0,1
721018236293091000,friday lunch goals gt fish and oyster,"Chicago, IL",41.96166333,-87.69754217,15/4/2016,16:51,3,2
721008201412415000,friday morning at the beach montrose dog beach,"Chicago, IL",41.968782,-87.64287385,15/4/2016,16:12,0,1
721155717009424000,friday night adventures squirrel cage tavern in lisle il,"Lisle, IL",41.78408107,-88.07400227,16/4/2016,1:58,0,1
721163401620234000,friday night bartending shenanigans at in chicago il,"Chicago, IL",41.90291586,-87.67930984,16/4/2016,2:28,0,1
721152537915703000,friday night date night w ms jamie ditkas chicagoland,"Chicago, IL",41.898513,-87.625497,16/4/2016,1:45,4,1
721132764079202000,friday night dinner with friends main street brewery in belleville il,"Belleville, IL",38.53801345,-90.02112706,16/4/2016,0:27,0,2
721120617366495000,friday night mood in the loop chicago illinois,"Chicago, IL",41.8369,-87.6844,15/4/2016,23:38,0,1
721174030850592000,friday night turn thank you for always letting me practice on_,"Chicago, IL",41.8369,-87.6844,16/4/2016,3:11,1,1
720775372661473000,friday special guest host tho esso club,"Chicago, IL",41.90471,-87.66904,15/4/2016,0:46,3,1
720775029542268000,friday special guest host tho esso club,"Chicago, IL",41.90471,-87.66904,15/4/2016,0:45,3,1
720936245686333000,friday treat at in glenview il,"Glenview, IL",42.08066919,-87.7991063,15/4/2016,11:26,0,1
721064925804785000,fridays be like recording x iverson chicago illinois,"Chicago, IL",41.8369,-87.6844,15/4/2016,19:57,0,2
721095048784261000,friends are priceless and so was my olivet nazarene university,"Bourbonnais, IL",41.15467844,-87.87319637,15/4/2016,21:57,0,1
721183121861976000,frisky friday__ municipal bar dining co,"Chicago, IL",41.89261,-87.63491,16/4/2016,3:47,4,1
721010395759132000,friyay have you seen this weekends forecast,"Chicago, IL",41.884085,-87.641153,15/4/2016,16:20,3,0
721213675017777000,from,"Chicago, IL",41.799334,-87.587249,16/4/2016,5:48,5,2
721161061483851000,from farm to table,"Chicago, IL",41.88741047,-87.63162959,16/4/2016,2:19,5,0
720706666086449000,from john hancock tower john hancock center in chicago il,"Chicago, IL",41.89885924,-87.62313366,14/4/2016,20:13,1,1
721007602671435000,from navy pier it was such a beautiful,"Chicago, IL",41.89145729,-87.60824827,15/4/2016,16:09,1,0
720665923170996000,from shoveling dog shit in breckenridge to couture nice cleanup,"Chicago, IL",41.90088387,-87.6232167,14/4/2016,17:32,0,1
721214031890157000,from the promontory,"Chicago, IL",41.799334,-87.587249,16/4/2016,5:49,3,3
720659902943883000,from where i stand great day so far the art institute of chicago,"Chicago, IL",41.87961697,-87.62340149,14/4/2016,17:08,0,1
721128001841283000,front row for the friday night dj fremont chicago,"Chicago, IL",41.89063,-87.6287,16/4/2016,0:08,0,1
721011017975619000,fuck them niggas,"Chicago, IL",41.90241813,-87.635715,15/4/2016,16:23,0,2
721164767088353000,full class right now with edson de cuba dylans tavern grill,"Chicago, IL",41.8799,-87.64144,16/4/2016,2:34,0,1
721243599850119000,fullerton beach,"Chicago, IL",41.92310813,-87.6297049,16/4/2016,7:47,0,1
720705849379930000,fun at the park mikeyjamesii mary_,"Chicago, IL",41.8802,-87.65078,14/4/2016,20:10,3,1
721168268988411000,fun times with dinner,"Chicago, IL",41.89145729,-87.60824827,16/4/2016,2:48,1,2
721156487175913000,fun watching them set up for the comp tomorrow first ascent climbing fitness in chicago il,"Chicago, IL",41.94529284,-87.71011522,16/4/2016,2:01,0,1
721005758448537000,funeral for a friend carter temple c.m.e church in chicago il,"Chicago, IL",41.75117832,-87.62268,15/4/2016,16:02,0,1
720709256442281000,funghi fried shitake mushrooms with sage eataly chicago,"Chicago, IL",41.892126,-87.626078,14/4/2016,20:24,1,1
721171076697317000,gabulous white chocolate grill,"Naperville, IL",41.80393,-88.12681,16/4/2016,2:59,0,1
720754356409221000,gage building roosevelt university,"Chicago, IL",41.88135615,-87.62421557,14/4/2016,23:23,0,1
720830725390381000,galaxxu is ripping it up right now the empty bottle,"Chicago, IL",41.90030349,-87.6868804,15/4/2016,4:26,0,1
721173630030221000,galesburg senior jared fredrickson right runs the anchor leg of the husky man relay_,"Galesburg, IL",40.96288611,-90.38894167,16/4/2016,3:09,0,0
721154778001072000,galesburg senior josh eiker holds his golden ticket inviting him to the brooks pr invitational_,"Galesburg, IL",40.96288611,-90.38894167,16/4/2016,1:54,0,0
720778556960149000,galesburg shortstop mark mangieri gets a good bounce on a ground ball from an east peoria batter_,"Galesburg, IL",40.9665503,-90.39245827,15/4/2016,0:59,0,0
720778132169424000,galesburg shortstop sean peck left cuts off a ground ball up the middle as second baseman_,"Galesburg, IL",40.9665503,-90.39245827,15/4/2016,0:57,0,0
721173301662322000,galesburg__s joe stewart prepares to cross the finish line of the run during friday night__s_,"Galesburg, IL",40.96288611,-90.38894167,16/4/2016,3:08,0,0
720829988610510000,galvas cameron meyer connects with a pitch during the wildcats victory over_,"Galva, IL",41.1604,-90.04064,15/4/2016,4:23,0,0
721094034148569000,game duncan keith back hawks outplayed em in game one here we go hockeytown go hawks,"Chicago, IL",41.9176481,-87.6381358,15/4/2016,21:53,0,1
720608585680609000,game last night wrigley field,"Chicago, IL",41.94795805,-87.65568063,14/4/2016,13:44,2,1
720651887830142000,gang gang naperville north high school,"Naperville, IL",41.7835,-88.1573,14/4/2016,16:36,1,1
721133911028416000,garbage bar is open blackhawk caverns in johnsburg il il,"Johnsburg, IL",42.41210074,-88.23907535,16/4/2016,0:31,0,1
721134298489843000,garbage bar is open the garbage bar in johnsburg il,"Johnsburg, IL",42.4121666,-88.23911285,16/4/2016,0:33,0,1
720962300790702000,garment mender cintas corporation EMO_NEG il,"Romeoville, IL",41.6475306,-88.0895061,15/4/2016,13:09,7,0
721130482788888000,garrafa de la salle institute,"Chicago, IL",41.83161763,-87.62457557,16/4/2016,0:17,0,1
721210725025189000,garys restaurant,"Freeburg, IL",38.42207,-89.90904,16/4/2016,5:36,3,1
721069389546524000,gearing up for another popup at westelmskokie tomorrow come by from if youre in the area_,"Skokie, IL",42.0587951,-87.7475494,15/4/2016,20:15,0,0
720613799271616000,geico auto damage trainee chicago il illinois,"Chicago, IL",41.8781136,-87.6297982,14/4/2016,14:04,5,0
720708545809780000,general manager sonic drivein EMO_NEG il,"East Alton, IL",38.8823857,-90.1212923,14/4/2016,20:21,7,0
721014631116877000,genuine parts napa delivery driver il,"Downers Grove, IL",41.8132909,-88.0216334,15/4/2016,16:37,6,0
721010736374226000,genuine parts napa delivery driver il,"Glen Ellyn, IL",41.8775293,-88.0670118,15/4/2016,16:22,6,0
721010929165438000,genuine parts napa director finance new business development il,"Naperville, IL",41.7606321,-88.1437782,15/4/2016,16:22,5,0
721010423164588000,genuine parts napa divisional loss prevention manager midwest il,"Naperville, IL",41.7606321,-88.1437782,15/4/2016,16:20,5,0
720713541594914000,genuine parts napa executive management trainee il,"Naperville, IL",41.7606321,-88.1437782,14/4/2016,20:41,4,0
721166387905822000,george imma sit right here no need to take off your jacket the b3,"Berwyn, IL",41.85261456,-87.80028819,16/4/2016,2:40,0,1
721176274874580000,get here chicago state university,"Chicago, IL",41.71812295,-87.6100172,16/4/2016,3:19,0,1
721201702574145000,get it girl lincoln hall,"Chicago, IL",41.92593,-87.64981,16/4/2016,5:00,3,1
721149628507291000,get way to start the weekend raise the macallan,"Chicago, IL",41.8893421,-87.6521719,16/4/2016,1:34,1,1
721168872221446000,get ya up sounds like a pretty good night in the windy,"Chicago, IL",41.8369,-87.6844,16/4/2016,2:50,1,1
720736431862259000,get your tickets now limited seating may,"Chicago, IL",41.9333323,-87.653708,14/4/2016,22:12,0,0
721184353162661000,gets a little to us all,"Chicago, IL",41.96871,-87.66019,16/4/2016,3:52,5,1
720714725722583000,gettin a big ass pizza with papa johns pizza in rockford il,"Rockford, IL",42.25265758,-89.02954247,14/4/2016,20:45,0,2
720683741165797000,getting a haircut tricoci university of beauty culture in chicago il,"Chicago, IL",41.97776166,-87.80677397,14/4/2016,18:42,0,1
720778680704835000,getting back into it at in champaign il,"Champaign, IL",40.11944277,-88.28025683,15/4/2016,1:00,0,1
720914126558609000,getting gas before we head down south marathon in cicero il,"Cicero, IL",41.83427511,-87.74361735,15/4/2016,9:58,0,1
721005834243809000,getting our wonka on tomorrow we celebrate owen n the chocolate factory crazy cool fun style._,"Chicago, IL",41.936946,-87.665339,15/4/2016,16:02,0,0
721150301261180000,getting ready for ssb second story bar downtown chicagooh cant wait the silence when u walk in only,"Chicago, IL",41.91103011,-87.67290738,16/4/2016,1:36,0,0
721295341539225000,getting ready for this beauty trend show at old orchard center in skokie il,"Skokie, IL",42.05889076,-87.74717443,16/4/2016,11:13,0,1
720713659731812000,getting ready to do some for and with_,"Chicago, IL",41.958172,-87.781748,14/4/2016,20:41,2,2
720828916982624000,getting ready to rock the stage chicago star bar,"Chicago Ridge, IL",41.70707863,-87.79784516,15/4/2016,4:19,0,1
721011835760177000,getting set for my spring wine stroll appearance at health in chicago il,"Chicago, IL",41.9647707,-87.6858575,15/4/2016,16:26,0,1
720962223988981000,getting some footage for student council to show incoming students and parents morning dropoff,"Glencoe, IL",42.13119599,-87.75949423,15/4/2016,13:09,0,0
721181475757023000,getting the night started swing by for some good music and great drinks mercer one thirteen in chicago il,"Chicago, IL",41.8899652,-87.63177035,16/4/2016,3:40,0,1
721010047891808000,getting trained on generation hiv tests chicago department of public health training center,"Chicago, IL",41.911657,-87.664054,15/4/2016,16:19,0,1
720589470815358000,getups look cool but first you must master the airex pad after that comes a shoe and only_,"Oak Park, IL",41.880291,-87.7817688,14/4/2016,12:28,0,0
721151741035692000,gift card yay at in aurora il,"Naperville, IL",41.7711477,-88.20639144,16/4/2016,1:42,0,2
721169381200371000,gig about to commence all vinyl all afrolatin everything gold coast is cooler than you_,"Chicago, IL",41.903357,-87.629054,16/4/2016,2:52,1,0
721172264994082000,gig today come see me lets do a shot radio maria,"Champaign, IL",40.11712,-88.24259,16/4/2016,3:04,1,1
721229847159312000,gimmie a resin instead drinking a c.r.e.a.m by leclaire apartments,"Moline, IL",41.5081,-90.5115,16/4/2016,6:52,0,2
721123841590689000,gin gimlet at milliessupperclub nostalgic cocktail to kick off the weekend,"Chicago, IL",41.92616,-87.6502299,15/4/2016,23:51,1,0
721122007375618000,ginger blossom spicy designer mule and bhs shot,"Elgin, IL",42.03725728,-88.28334042,15/4/2016,23:44,3,0
721134870668394000,ginos east,"Chicago, IL",41.89933833,-87.62409171,16/4/2016,0:35,0,1
721116288521625000,girl shot in the head while riding in a car on the west side,"Chicago, IL",41.88804564,-87.62626724,15/4/2016,23:21,0,0
721171029054230000,girl stable after shot in the head while riding in car on west side,"Chicago, IL",41.88804564,-87.62626724,16/4/2016,2:59,0,0
721020324737904000,girls day EMO_POS the factory in schaumburg il,"Schaumburg, IL",42.04789045,-88.03778172,15/4/2016,17:00,0,2
721001489611694000,girls doing what girls do judah and i wait in the car at,"Arlington Heights, IL",42.14032,-87.99192,15/4/2016,15:45,0,1
721127134127865000,give me all your fruits veggies please midtown produce in chicago il,"Chicago, IL",41.93655572,-87.71985195,16/4/2016,0:04,0,1
720687934945566000,giveaways for the jungle book in theaters this friday april_,"Chicago, IL",41.87275502,-87.64983717,14/4/2016,18:59,0,0
721158759935045000,glad i got to see ya play sorry my hat was for the other team__ lewis and clark_,"Melville, IL",38.95128776,-90.19437364,16/4/2016,2:10,0,1
721066515961741000,glad i had a good meal yesterday olive garden,"Lansing, IL",41.59304736,-87.558164,15/4/2016,20:03,0,1
720656768267718000,glad to see liv bringing in her cop partner on the zombiething the in the dark thing only works so long moving forward,"Rockford, IL",42.2537771,-88.990969,14/4/2016,16:55,1,0
721125524672614000,glorias brewery but brewery tour hopewell brewing company,"Chicago, IL",41.93124,-87.71149,15/4/2016,23:58,0,1
721149613382713000,gluten free cupcakes at dessert garage in chicago il,"Chicago, IL",41.96589,-87.686546,16/4/2016,1:34,0,1
721127048048205000,go blackhawks drinking a bud light by at,"Bartlett, IL",41.9756,-88.2081,16/4/2016,0:04,0,2
721134725667139000,go blackhawks drinking a slalom king ipa by crystal lake brewing,"Crystal Lake, IL",42.2453,-88.3165,16/4/2016,0:34,1,2
721011817271726000,go check my mixtape out exclusive release on out now_,"Chicago, IL",41.74726897,-87.64414521,15/4/2016,16:26,3,0
721121311561396000,go cubs go sox see blue and black,"Chicago, IL",41.8369,-87.6844,15/4/2016,23:41,0,1
721146129526755000,go hawks cleos bar grill in chicago il,"Chicago, IL",41.89569184,-87.67603467,16/4/2016,1:20,0,1
720837761339535000,go home lincoln hall,"Chicago, IL",41.92593,-87.64981,15/4/2016,4:54,1,1
720755105717334000,go kenny go at sensory overload the montgomery club,"Chicago, IL",41.895633,-87.641673,14/4/2016,23:26,2,1
720832203475685000,go listen to be yourself by dlow youll see,"Chicago, IL",41.9130531,-87.7613035,15/4/2016,4:32,0,1
721160642179305000,go to sleep in paris wake up in tokyo have a dream in new orleans fall in love in_,"Chicago, IL",41.8787,-87.63598,16/4/2016,2:17,0,0
720686191482433000,god im so fucking happy chicago riverwalk,"Chicago, IL",41.88814262,-87.6209938,14/4/2016,18:52,0,1
720665695672000000,god know he be showing out but next sunday april meet me at_,"Charleston, IL",39.48083398,-88.17697466,14/4/2016,17:31,0,0
721175641748545000,goddess and the baker,"Chicago, IL",41.881192,-87.626219,16/4/2016,3:17,0,1
721120199307452000,goes for the classic the sonic penthouse,"Chicago, IL",41.9820202,-87.6569889,15/4/2016,23:37,3,2
721092084124512000,goes to chicago to meet decision ever,"Chicago, IL",41.87400951,-87.62528636,15/4/2016,21:45,1,0
720778800670244000,going back to liz phair smashing pumpkins keeping it classy at lyric opera of chicago_,"Chicago, IL",41.88231634,-87.63742624,15/4/2016,1:00,0,0
721125320091385000,going through this whirlwind of work tonight here is a detail from one of the talking into_,"Chicago, IL",41.8369,-87.6844,15/4/2016,23:57,0,0
720998945187442000,going to be great cant wait,"Wheaton, IL",41.8423784,-88.0846565,15/4/2016,15:35,0,0
721123911610404000,going to miss this boy rolling green school,"Rockford, IL",42.247821,-89.037835,15/4/2016,23:51,3,1
720776971748315000,gold glover brand phillips,"Wheaton, IL",41.8424179,-88.0846947,15/4/2016,0:53,0,0
720777928389177000,gonna make a guest appearance and play some music for you guys at_,"Chicago, IL",41.8369,-87.6844,15/4/2016,0:57,0,0
720711119719956000,gonna watch own the tonight,"Chicago, IL",41.94597973,-87.6580958,14/4/2016,20:31,4,3
720962915629690000,good deed done intelligentsia coffee in chicago il,"Chicago, IL",41.87790122,-87.62948513,15/4/2016,13:12,0,2
721148654510166000,good evening chicago one superior place,"Chicago, IL",41.8955,-87.629,16/4/2016,1:30,6,1
721294090676150000,good morning chicago EMO_POS noon sunset cdt utc5 april day length,"Chicago, IL",41.8781,-87.6298,16/4/2016,11:08,1,0
720609078230261000,good morning chicago theres a signed copy of martin l king early bird_,"Chicago, IL",41.85051962,-87.61254159,14/4/2016,13:46,1,1
721298588702273000,good morning eisenhower,"Chicago, IL",41.87385436,-87.73377008,16/4/2016,11:25,0,1
721290082938974000,good morning happy saturday the blue eyed bear in danville il,"Danville, IL",40.16857,-87.628466,16/4/2016,10:52,0,1
720938031646142000,good morning people,"Dixmoor, IL",41.6036036,-87.58935596,15/4/2016,11:33,0,0
720611506359033000,good morning to all my faithful followers have a happy thursday morning,"Flora, IL",38.66372,-88.48725,14/4/2016,13:55,1,0
720893985905094000,good morning uptown in chicago il,"Chicago, IL",41.9644927,-87.6548737,15/4/2016,8:38,0,1
720586750142365000,good morning world chicago illinois,"Chicago, IL",41.8369,-87.6844,14/4/2016,12:17,2,1
721211988882239000,good quick show tonight with ellis clark and jerry king and a good shot of the three of us_,"Chicago, IL",42.009424,-87.666419,16/4/2016,5:41,0,0
721021640541368000,good review no cavities or anything else dr maria ashley dds in chicago il,"Chicago, IL",41.88315467,-87.62495035,15/4/2016,17:05,0,1
721174375035068000,goodbye chicago illinois,"Chicago, IL",41.8369,-87.6844,16/4/2016,3:12,5,1
721163172351250000,goodnight gils new bedroom in chicago il,"Chicago, IL",41.9651865,-87.66359163,16/4/2016,2:27,0,1
721213259618127000,goodnight gotham rihanna anti world tour,"Chicago, IL",41.8809346,-87.6738704,16/4/2016,5:46,0,1
721005173565485000,goose island fassinator now available on tap,"Chicago, IL",41.9262367,-87.6499775,15/4/2016,16:00,1,0
720736631632826000,gorgeous day for some yard work with the boys__,"Chicago, IL",41.78978872,-87.59893246,14/4/2016,22:12,1,1
721130638846390000,gorgeous warm evening power walk with the drex i just finished walking miles in with,"Bolingbrook, IL",41.699312,-88.14121,16/4/2016,0:18,1,0
721007536879624000,gosh the human body sure is amazing isnt it through our art we hope to encourage you to love_,"Addison, IL",41.91365106,-87.97039834,15/4/2016,16:09,0,0
721127798853779000,got a healed shot of this baby i did on beth last year his name is jimmy,"Tuscola, IL",39.79999027,-88.28823941,16/4/2016,0:07,2,0
720649875851972000,got hills not many so instead we pull the sled,"Arlington Heights, IL",42.13113,-87.98382,14/4/2016,16:28,3,0
721028089875206000,got in a fun total body workout using the plyobox this workout targeted my complete core and_,"Chicago, IL",41.9101302,-87.6923879,15/4/2016,17:31,0,0
721027610315239000,got in a fun total body workout using the plyobox this workout targeted my complete core and_,"Chicago, IL",41.9101302,-87.6923879,15/4/2016,17:29,0,0
720590041400131000,gotcha robbins illinois,"Robbins, IL",41.64305556,-87.70805556,14/4/2016,12:30,0,1
720981380117766000,gotcha the bridgeport neighborhood,"Chicago, IL",41.82464963,-87.63961177,15/4/2016,14:25,0,1
720659586869538000,grade field trip happy to report i survived lunchtime in the cafeteria the field museum,"Chicago, IL",41.86619837,-87.61706545,14/4/2016,17:06,0,1
721067689595301000,graham crackers comics,"Chicago, IL",41.8819542,-87.6250381,15/4/2016,20:08,0,1
721136270110498000,graham foundation for advanced studies in the fine arts,"Chicago, IL",41.90965,-87.62922,16/4/2016,0:40,1,1
720664415058673000,grass for the pig and a new hidey hole he is a bit chubby at in matteson il,"Matteson, IL",41.50730261,-87.7342656,14/4/2016,17:26,0,1
721068255666810000,great clips hair stylist il,"Sugar Grove, IL",41.7835597,-88.3762732,15/4/2016,20:10,6,0
721005108507463000,great clips hair stylist il,"O'Fallon, IL",38.5809056,-89.8829146,15/4/2016,15:59,6,0
721001667588595000,great clips hair stylist il,"Arlington Heights, IL",42.1080983,-87.9775898,15/4/2016,15:46,6,0
720735381105184000,great clips hair stylist il,"Palos Park, IL",41.6534075,-87.8551969,14/4/2016,22:08,6,0
720652176654086000,great clips hair stylist il,"Chicago, IL",41.8929153,-87.6359125,14/4/2016,16:37,6,0
720607653882277000,great clips hair stylist il,"Oak Forest, IL",41.6028116,-87.7439384,14/4/2016,13:40,6,0
720717090567487000,great clips salon manager il,"Oak Lawn, IL",41.7178369,-87.7402811,14/4/2016,20:55,6,0
720809822476578000,great crew tonight at alteredstage i had a blast talking with these folks about the,"Chicago, IL",41.8853683,-87.6449738,15/4/2016,3:03,0,0
720709318618669000,great day of working with the and here in chicago so thankful_,"Chicago, IL",41.8896626,-87.6385883,14/4/2016,20:24,0,2
