720777246131298000,taught meditation to grade school kids tonight and this rockstar showed up,"Evanston, IL",42.03426,-87.69306,15/4/2016,0:54,2,0
721162786659778000,taus come out on top so incredibly proud to be an uic forum,"Chicago, IL",41.86714,-87.64617,16/4/2016,2:26,0,1
720688190055587000,tax accountant robert half finance accounting EMO_NEG il,"Chicago, IL",41.8839927,-87.6197056,14/4/2016,19:00,6,0
721168687500279000,tax refund oyster day shaws crab house,"Chicago, IL",41.88980595,-87.62681125,16/4/2016,2:49,0,1
720901710898675000,tbt,"Chicago, IL",41.85499518,-87.659548,15/4/2016,9:08,0,0
720901632205131000,tbt,"Chicago, IL",41.85503114,-87.65941515,15/4/2016,9:08,0,0
720888492012802000,tbt back me n my bff,"Chicago, IL",41.8550005,-87.65935438,15/4/2016,8:16,0,0
720901511929294000,tbt back suffer alot,"Chicago, IL",41.85493286,-87.65930794,15/4/2016,9:08,0,0
720888961661562000,tbt my bff,"Chicago, IL",41.8548586,-87.65924977,15/4/2016,8:18,0,0
720711716783333000,tbt to when life kinda sucked but i enjoyed it,"North Chicago, IL",42.3154817,-87.8414966,14/4/2016,20:33,1,0
721094608390909000,tea time local goods chicago,"Chicago, IL",41.99763,-87.76281,15/4/2016,21:55,0,1
721152963134300000,teaching them the classicsno downloads here galloping ghost arcade,"Brookfield, IL",41.81695,-87.85571,16/4/2016,1:47,0,1
721098953828265000,team bonding howells hood in chicago il,"Chicago, IL",41.8900106,-87.62334521,15/4/2016,22:12,0,2
720611138736627000,team breakfast meli cafe juice bar in chicago il,"Chicago, IL",41.89184972,-87.63404507,14/4/2016,13:54,0,1
721135692038836000,team member il,"Naperville, IL",41.7477845,-88.2009181,16/4/2016,0:38,4,0
720714613671604000,team member il,"Schaumburg, IL",42.025061,-88.1451791,14/4/2016,20:45,4,0
721176998521901000,teasers pub in chicago il,"Chicago, IL",41.98068198,-87.80561,16/4/2016,3:22,0,1
721008244697772000,teessttiinngg vizonary studios,"Chicago, IL",41.88546,-87.7320699,15/4/2016,16:12,0,1
720937662580805000,tell me why i just tried on a half day,"Joliet, IL",41.56210011,-88.22597404,15/4/2016,11:31,0,0
720982286770962000,tener un marido da estas jajajaja,"Chicago, IL",41.8369,-87.6844,15/4/2016,14:29,2,1
720754806332137000,tennessee governor vetoes bill making bible the states official book,"Chicago, IL",41.88804564,-87.62626724,14/4/2016,23:25,0,0
721046178369052000,tesss place style shop,"Chicago, IL",41.79363,-87.6648,15/4/2016,18:42,1,1
721070021871562000,tgif spring break style oharas tavern in chicago il,"Chicago, IL",41.70262536,-87.53733935,15/4/2016,20:17,0,1
721127190876839000,tgif state and lake,"Chicago, IL",41.88587424,-87.62807195,16/4/2016,0:04,1,1
720998862475902000,tgif were here until so stop by check out our great deals prices on some of the_,"Chicago, IL",41.8854065,-87.653038,15/4/2016,15:34,0,0
721183618584952000,thank you for constantly motivating me this season love you sami__ naperville illinois,"Naperville, IL",41.7498,-88.1557,16/4/2016,3:49,0,1
721047292606824000,thank you for my awesome new pair of shades faroutsunglasses,"Chicago, IL",41.8369,-87.6844,15/4/2016,18:47,2,0
721146400512294000,thank you sirmay i have another drinking an oharas irish stout tap in pub carvery,"Naperville, IL",41.809,-88.2008,16/4/2016,1:21,1,1
720655982880284000,thank you to each and everyone one of you that came out last night couldnt of asked for a_,"Chicago, IL",41.94795805,-87.65568063,14/4/2016,16:52,0,0
721139579974205000,thank you to everyone that stopped by today and showed love we are now officially closed._,"Chicago, IL",41.8854065,-87.653038,16/4/2016,0:54,0,0
720776352224387000,thank you to my dear friends from the birmingham municipal court for joining me at the john_,"Chicago, IL",41.8369,-87.6844,15/4/2016,0:50,0,0
721068428354723000,thankful for this one northeastern illinois university,"Chicago, IL",41.98131099,-87.71841881,15/4/2016,20:11,0,1
721120099915010000,thanks,"Cambria, IL",37.7744151,-89.1190417,15/4/2016,23:36,0,1
720831987884232000,thanks for a night,"Chicago, IL",41.881626,-87.62499,15/4/2016,4:31,5,1
720661871011897000,thanks for always dealing with me and being a shoulder to lean_,"Charleston, IL",39.48083398,-88.17697466,14/4/2016,17:15,0,0
721119372966825000,thanks for coming fun love you guys,"River Forest, IL",41.893,-87.8172,15/4/2016,23:33,4,0
720613216292876000,thanks for holding my hand through college western illinois university,"Macomb, IL",40.4707806,-90.6850149,14/4/2016,14:02,0,1
721164577254334000,thanks for introducing me to the best city in the world chicago illinois,"Chicago, IL",41.8369,-87.6844,16/4/2016,2:33,0,1
721171006035873000,thanks for the best months i love you nerd naperville illinois,"Naperville, IL",41.7498,-88.1557,16/4/2016,2:59,0,1
721184006973366000,thanks for the like,"Niles, IL",42.040415,-87.834382,16/4/2016,3:50,0,1
720775539263287000,thanks for the superb cocktails gt fish oyster,"Chicago, IL",41.89163749,-87.63394841,15/4/2016,0:47,0,2
721120124317655000,thanks im just stoked to be here,"Naperville, IL",41.76637489,-88.14279794,15/4/2016,23:36,0,1
721130351762886000,thanks jack for being my main squeeze in clinton,"Clinton, IL",40.1522,-88.9592,16/4/2016,0:17,1,1
721141825189330000,thanks lax bro ilysm,"Naperville, IL",41.7897432,-88.13971119,16/4/2016,1:03,0,1
721177654645403000,thanks miss seeing you at lunch,"Naperville, IL",41.78923999,-88.13974019,16/4/2016,3:25,0,1
720811933742411000,thanks olivet nazarene_,"Bourbonnais, IL",41.15467844,-87.87319637,15/4/2016,3:12,2,2
721069795379134000,thanks to dannalez my lid game is on point wrigley field,"Chicago, IL",41.94795805,-87.65568063,15/4/2016,20:16,4,1
720717148172234000,thanks to for taking time to meet with at to_,"Springfield, IL",39.79833333,-89.65444444,14/4/2016,20:55,2,2
721001870773383000,thanks to my brother and columbia1938 for my new montrailoriginal mountain masochist_,"Sleepy Hollow, IL",42.0735449,-88.3008136,15/4/2016,15:46,0,1
721098409965330000,thanks to the bro ryan schorr boomklack for the flicks check_,"Chicago, IL",41.93970865,-87.68083187,15/4/2016,22:10,1,0
720651601984286000,that gets me thinking could munki use a dns query to auto discover the repo,"Glencoe, IL",42.1311955,-87.75972233,14/4/2016,16:35,0,2
721067515208577000,that moment when he realizes today is the last day of his internship and he doesnt have to work_,"Chicago, IL",41.703284,-87.701434,15/4/2016,20:07,0,0
721164235296874000,that old vip life original mothers downtown chicago illinois,"Chicago, IL",41.90399153,-87.6299122,16/4/2016,2:32,0,1
720656890523295000,that said the finale wasnt that great still love the show looking forward to s3,"Rockford, IL",42.2537771,-88.990969,14/4/2016,16:56,1,0
720652511191965000,that__s an a cname though i__m thinking a domain wide srv,"Glencoe, IL",42.13108331,-87.75738078,14/4/2016,16:38,0,3
721120054641823000,thats a good looking barra,"Chicago, IL",41.93566,-87.69255,15/4/2016,23:36,3,1
720589939566444000,thats all for jordans,"Chicago, IL",41.84921249,-87.69674867,14/4/2016,12:30,8,0
721170943293333000,thats all stony island arts bank,"Chicago, IL",41.77168,-87.58663,16/4/2016,2:58,1,2
721183312128020000,thats my best friend,"Chicago, IL",41.91052675,-87.6774993,16/4/2016,3:47,3,0
721175495384178000,thats right baby pekin illinois,"Pekin, IL",40.5678,-89.6369,16/4/2016,3:16,1,2
721006790289268000,thats right this saturday will be hosting the official after party for the_,"Chicago, IL",41.848609,-87.642132,15/4/2016,16:06,1,0
720716125777051000,thats the difference between a strong and a regular iron idlewild country club,"Homewood, IL",41.54149705,-87.6628902,14/4/2016,20:51,1,1
721317898896203000,the,"Chicago, IL",41.8369,-87.6844,16/4/2016,12:42,8,0
721180079410319000,the absolutely slaying it fitzgeralds nightclub,"Berwyn, IL",41.86496,-87.78964,16/4/2016,3:35,0,2
721156546420477000,the and i rpm italian,"Chicago, IL",41.89091147,-87.62987252,16/4/2016,2:01,5,1
720887929078472000,the annoying tourists from boston cloud gate,"Chicago, IL",41.88268611,-87.623325,15/4/2016,8:14,0,1
721121147883036000,the art institute of chicago,"Chicago, IL",41.87961697,-87.62340149,15/4/2016,23:40,5,1
720755269945397000,the art institute of chicago,"Chicago, IL",41.87961697,-87.62340149,14/4/2016,23:27,3,1
720832751692218000,the band is back together,"Chicago, IL",41.88231634,-87.63742624,15/4/2016,4:34,4,0
720775237470523000,the bar is alive the montgomery club,"Chicago, IL",41.895633,-87.641673,15/4/2016,0:46,2,1
720960814044217000,the battle over real estate cantigny style eastern bluebird vs tree swallow who will_,"Winfield, IL",41.847042,-88.155082,15/4/2016,13:03,0,0
721146425355190000,the beautiful and pregnant jill andrews opening for drew holcomb i could get used to this_,"Chicago, IL",41.857817,-87.657398,16/4/2016,1:21,0,0
721014261078745000,the beauty of the long winter sometimes lies in the appreciation of spring the arrival of the_,"Timberlane, IL",42.35110233,-88.8690007,15/4/2016,16:36,0,0
721295868519821000,the best cure for thesoul is a quite mind disfruta tu propia vida,"Chicago, IL",41.8369,-87.6844,16/4/2016,11:15,1,0
721092208976404000,the best part about watching children movies on school days is that there are only adults here._,"Chicago, IL",41.8911648,-87.6185059,15/4/2016,21:45,0,0
720613180024557000,the best youll ever meet chicago ohare_,"Chicago, IL",41.97690122,-87.90298546,14/4/2016,14:02,0,1
720754272393175000,the birds are chirping the days are getting warmer and longerspring is here and you know_,"Chicago, IL",41.92682497,-87.64121121,14/4/2016,23:23,0,0
721151969734311000,the birthday girl skate swag rink chicago,"Chicago, IL",41.73726,-87.5965499,16/4/2016,1:43,0,2
720685962540511000,the bookmobile has hit the arch or rather parked get your the arch,"Evanston, IL",42.05200891,-87.67723756,14/4/2016,18:51,2,1
721121715816824000,the bowling banquet was so fun last thursday,"Schaumburg, IL",42.0185318,-88.1451569,15/4/2016,23:43,6,0
721121468239601000,the bowling banquet was so fun last thursday,"Schaumburg, IL",42.0185318,-88.1451569,15/4/2016,23:42,6,0
721121193776971000,the bowling banquet was so fun last thursday,"Schaumburg, IL",42.0185318,-88.1451569,15/4/2016,23:41,6,0
721120964918927000,the bowling banquet was so fun last thursday,"Schaumburg, IL",42.0185318,-88.1451569,15/4/2016,23:40,6,0
721134505965264000,the burger king hot dogs might be good,"Chicago, IL",41.8094535,-87.6158225,16/4/2016,0:33,0,1
720832901739220000,the calm before the storm the little mermaid opens tomorrow jedlicka performing arts center,"Cicero, IL",41.823793,-87.762224,15/4/2016,4:35,0,1
721122850401357000,the camera dept lady is great knows where to find everything you looking for real competent oan for a,"Chicago, IL",41.88553763,-87.63077259,15/4/2016,23:47,0,0
721097006328913000,the cellular connection verizon retail sales consultant il,"Salem, IL",38.6269929,-88.9456158,15/4/2016,22:04,4,0
721132222053490000,the city that my heart belongs chicago illinois,"Chicago, IL",41.8369,-87.6844,16/4/2016,0:24,0,1
721047755695767000,the classic wamo face never fails to make an appearance farm lake,"Urbana, IL",40.139,-88.19236,15/4/2016,18:49,0,1
720653290464104000,the clearing by the superb rachel grimes ensemble what an amazing record this_,"Chicago, IL",41.95561312,-87.69269471,14/4/2016,16:41,1,0
720652362172399000,the cloud gate of chicago illinois,"Chicago, IL",41.8369,-87.6844,14/4/2016,16:38,3,1
720716688497446000,the congress plaza hotel,"Chicago, IL",41.87505,-87.6247999,14/4/2016,20:53,3,1
721212059791269000,the empty bottle,"Chicago, IL",41.90030349,-87.6868804,16/4/2016,5:42,0,1
721020079861862000,the eve was intimate i desire to share details but what happens at sessions bereolaesque_,"Chicago, IL",41.90594,-87.62835,15/4/2016,16:59,0,0
721158683866976000,the famous skyline,"Chicago, IL",41.86680713,-87.60970614,16/4/2016,2:10,8,0
721167062362488000,the final flight lincolnway north high school,"Frankfort Square, IL",41.52531436,-87.79208257,16/4/2016,2:43,0,1
721009672321437000,the food mecca rare tea cellar in chicago il,"Chicago, IL",41.94896695,-87.67331425,15/4/2016,16:17,0,1
721120771733602000,the for,"Chicago, IL",41.958551,-87.744194,15/4/2016,23:39,4,3
720914623684173000,the forecast for today is clear with a high of and a low of,"Rock Island Arsenal, IL",41.5167,-90.5333,15/4/2016,10:00,4,0
720854225337458000,the forecast for today is clear with a high of and a low of,"Rock Island Arsenal, IL",41.5167,-90.5333,15/4/2016,6:00,4,0
721141114896564000,the forecast for tomorrow is clear with a high of and a low of,"Rock Island Arsenal, IL",41.5167,-90.5333,16/4/2016,1:00,3,0
721095813363998000,the forecast for tonight is partly cloudy and windy with a low of,"Rock Island Arsenal, IL",41.5167,-90.5333,15/4/2016,22:00,4,0
721151782831804000,the girls at tonight made abstract at in,"Des Plaines, IL",42.0409455,-87.8900207,16/4/2016,1:42,4,0
721019441383882000,the glamour of car maintenance and safety when you have a dream about your tire blowing,"Melrose Park, IL",41.90964396,-87.83653237,15/4/2016,16:56,0,0
721177140964761000,the goodies i received at the mad hatter tea party,"Chicago, IL",41.908558,-87.674712,16/4/2016,3:23,3,1
721006709809025000,the hard way i love running into my bros platt_336 and from_,"Chicago, IL",41.8613023,-87.62593729,15/4/2016,16:06,1,1
721134485333389000,the has reopened for business and in hasnt looked this good in a_,"Chicago, IL",41.89084,-87.64246,16/4/2016,0:33,3,0
721144197412229000,the historical in chicago is where all the deep dishing started,"Chicago, IL",41.89227,-87.62692,16/4/2016,1:12,2,1
721021169269387000,the homie for coming thru with the vintage definitive_,"Chicago, IL",41.858205,-87.651652,15/4/2016,17:03,2,2
721165103588990000,the htc interface is decent,"Urbana, IL",40.1278528,-88.1893811,16/4/2016,2:35,0,1
720957051199991000,the in chicago il,"Chicago, IL",41.88751546,-87.62696031,15/4/2016,12:48,1,2
721133145031057000,the king will say tell you the truth when you did it to one of the least of these my_,"Oakbrook Terrace, IL",41.85992,-87.95209,16/4/2016,0:28,0,0
720737182424686000,the last hs home track meet for these seniors elgin high school in elgin il,"Elgin, IL",42.03079707,-88.24467558,14/4/2016,22:15,0,1
721125875304046000,the last meal as d.i.n.ks we picked you duck duck goat,"Chicago, IL",41.88671815,-87.6495217,15/4/2016,23:59,1,2
720664080646803000,the laughing game at rehearsal collaboraction,"Chicago, IL",41.91030266,-87.67695826,14/4/2016,17:24,1,2
721094286683553000,the legend coving closer by nin the riviera theatre,"Chicago, IL",41.96871,-87.66019,15/4/2016,21:54,2,2
721241601956265000,the lips the hair the feet the phone we got this,"Chicago, IL",41.9040756,-87.6296158,16/4/2016,7:39,3,0
721182831259594000,the locale at west loop which was devoured by haleyjen15 and i because we_,"Chicago, IL",41.8845699,-87.65406,16/4/2016,3:46,0,1
721178232544841000,the mads are back in chicago north bar,"Chicago, IL",41.91037,-87.66914,16/4/2016,3:27,1,1
721155758931488000,the mailroom was the place lake forest college,"Lake Forest, IL",42.2520499,-87.82983,16/4/2016,1:58,2,1
721139711826333000,the man the myth the legend peotone illinois,"Peotone, IL",41.3294,-87.7951,16/4/2016,0:54,1,1
720981334617776000,the mentor network licensed practical nurse lpn licensed vocational nurse lvn il,"Carbondale, IL",37.7272727,-89.2167501,15/4/2016,14:25,2,0
720586437742227000,the mj of our generation,"Palos Hills, IL",41.6993,-87.8263,14/4/2016,12:16,7,1
721123626183827000,the moment opens up their hearts to wildfire chicago,"Chicago, IL",41.89399221,-87.63374501,15/4/2016,23:50,1,2
720835968052297000,the most dangerous liars are those who think they are telling the truth,"Midlothian, IL",41.6258507,-87.735527,15/4/2016,4:47,1,0
721067663162642000,the move for tonight at lounge pull up on da kid lounge,"Chicago, IL",41.848609,-87.642132,15/4/2016,20:08,1,1
721138471734288000,the national museum_,"Chicago, IL",41.9027151,-87.7024833,16/4/2016,0:49,3,1
721152992754429000,the national_,"Chicago, IL",41.9027151,-87.7024833,16/4/2016,1:47,3,1
720736739514572000,the new cushion covers are in bird trouble,"Chicago, IL",41.90204,-87.68585,14/4/2016,22:13,1,1
721047620651589000,the newest member of tcs ed marketing tcs education system,"Chicago, IL",41.88867,-87.63698,15/4/2016,18:48,1,1
720810212559556000,the nra hates sanders,"Franklin Park, IL",41.94314754,-87.88056774,15/4/2016,3:05,0,1
721176875234697000,the ocd superstition is real wear home sweater for away game dont take selfie win_,"Chicago, IL",41.8811951,-87.6744087,16/4/2016,3:22,0,0
720774826311360000,the of tonight ramen misoya chicago_,"Chicago, IL",41.8924383,-87.6220699,15/4/2016,0:44,5,2
721027909989871000,the official release date is april at exclusively for weeks but_,"Chicago, IL",41.8369,-87.6844,15/4/2016,17:30,0,0
721142985451155000,the old family church st procopius parish,"Chicago, IL",41.85817112,-87.65750292,16/4/2016,1:07,1,1
721243767546757000,the one that stuck chicago illinois,"Chicago, IL",41.8369,-87.6844,16/4/2016,7:48,0,1
721141049272303000,the only place to be tonite the friday night party at aka the,"Markham, IL",41.5933588,-87.6658418,16/4/2016,0:59,2,0
721004086741508000,the only place to be tonite the friday night party at aka the,"Markham, IL",41.5933588,-87.6658418,15/4/2016,15:55,2,0
721151720080867000,the only that can talk about himand of course just dont try us please,"Chicago, IL",41.8369,-87.6844,16/4/2016,1:42,0,1
721129643324108000,the only workout youll regret is the one you didnt do,"Country Club Hills, IL",41.52898,-87.71844,16/4/2016,0:14,3,0
721116334109679000,the original est chicago botanic garden,"Glencoe, IL",42.14858812,-87.78961804,15/4/2016,23:21,1,1
721316923510808000,the out portion of an in out visit to illinois chicago midway international airport mdw in chicago il,"Chicago, IL",41.78542507,-87.75082827,16/4/2016,12:38,0,1
720770841311444000,the pain downers grove boxing martial arts llc,"Lombard, IL",41.84238799,-88.01770464,15/4/2016,0:28,0,1
720612802113642000,the partial d4e reunion changing seats for free and having a good time last night at the cubs_,"Chicago, IL",41.94795805,-87.65568063,14/4/2016,14:00,0,0
720564250507354000,the patriot babes patriot sports and fitness patriot sports and fitness,"Villa Park, IL",41.87759648,-87.95972476,14/4/2016,10:47,0,2
721178232796667000,the people working tonight are pros really appreciated their kindness scandinavian airlines sas lounge,"Chicago, IL",41.97411237,-87.88919806,16/4/2016,3:27,0,1
720809712862699000,the promontory,"Chicago, IL",41.799334,-87.587249,15/4/2016,3:03,1,1
721158642062520000,the ray the bassment,"Chicago, IL",41.8897767,-87.6374897,16/4/2016,2:09,1,1
720868901538516000,the relationship with me and bishop revolves around my music taste lol,"Chicago, IL",41.90239,-87.63568,15/4/2016,6:58,0,0
720715907933155000,the results r4 are in we hit the super for,"Cicero, IL",41.8443,-87.7585,14/4/2016,20:50,1,1
720938961481396000,the riviera theatre,"Chicago, IL",41.96871,-87.66019,15/4/2016,11:36,4,2
720555854202806000,the road,"Chicago, IL",41.8978787,-87.6760274,14/4/2016,10:14,0,1
721024757764923000,the royale from earlslincoln with cheese of course is one impressive burger check out_,"Chicago, IL",41.908851,-87.647319,15/4/2016,17:17,0,0
721020660240289000,the schiller shissler group received this award that was presented at our national conference,"Chicago, IL",41.9135778,-87.6543005,15/4/2016,17:01,1,0
721068933369823000,the scoular company logistics assistant il,"Downers Grove, IL",41.8089191,-88.0111746,15/4/2016,20:13,5,0
721139443013459000,the second and last part of our night with some ice cream oberweis,"North Aurora, IL",41.79844289,-88.34934274,16/4/2016,0:53,3,1
720906381268815000,the shit chicago illinois,"Chicago, IL",41.8369,-87.6844,15/4/2016,9:27,0,1
721066718714556000,the silver room presents dave helem pm hosted by comedy centrals i_,"Chicago, IL",41.799714,-87.588849,15/4/2016,20:04,0,1
720652507010187000,the smallest lap tray chicago ohare international airport,"Chicago, IL",41.97690122,-87.90298546,14/4/2016,16:38,2,1
720833228802666000,the smashing pumpkins siamese dream was one of the first albums i ever bought amazing to see_,"Chicago, IL",41.88231634,-87.63742624,15/4/2016,4:36,0,0
721169866804367000,the south side is scary yo morgan park in chicago il,"Chicago, IL",41.69320125,-87.66186263,16/4/2016,2:54,0,1
721160338901757000,the stuff architectural dreams are made of oriental theatre,"Chicago, IL",41.8845749,-87.6285818,16/4/2016,2:16,0,1
721180268627947000,the sunset is pretty but rachel is prettier EMO_POS minooka community_,"Minooka, IL",41.44975,-88.26373,16/4/2016,3:35,0,1
720686996939796000,the surf turf team lifeguards sport supervisors intramural officials and swim,"Chicago, IL",41.92283614,-87.65350443,14/4/2016,18:55,0,0
720658730308788000,the talk i had with my mama,"Dixmoor, IL",41.6036036,-87.58935596,14/4/2016,17:03,0,0
721282065560440000,the things we do for our boyfriends beverly records in chicago il,"Chicago, IL",41.682327,-87.68100876,16/4/2016,10:20,1,1
721268613320192000,the train is here at wilson in chicago il,"Chicago, IL",41.96547825,-87.65808171,16/4/2016,9:26,0,1
721091000836427000,the truth is we are all so very very vulnerable life is as it isthe only thing we can_,"Glenview, IL",42.08851446,-87.79796067,15/4/2016,21:41,0,0
721125758870122000,the turn up continues dream cafe grille,"Chicago, IL",41.783555,-87.643608,15/4/2016,23:59,1,1
721205569915379000,the usual here are k h lounge k h lounge,"Chicago, IL",41.949161,-87.767175,16/4/2016,5:16,0,1
721014849950638000,the view from my desk storybook weddings events,"Chicago, IL",41.943636,-87.643461,15/4/2016,16:38,0,1
721142970402148000,the virginia theater in its nighttime glory the_,"Champaign, IL",40.11701784,-88.24534704,16/4/2016,1:07,4,1
720961683775037000,the vitamin shoppe health enthusiast parttime il,"Naperville, IL",41.7705887,-88.2049255,15/4/2016,13:07,6,0
720632793051496000,the vitamin shoppe health enthusiast parttime il,"Chicago, IL",41.9054499,-87.6697352,14/4/2016,15:20,5,0
721282561998069000,the vitamin shoppe key holder il,"Melrose Park, IL",41.9005865,-87.8567276,16/4/2016,10:22,4,0
720888624787525000,the vitamin shoppe key holder il,"Evergreen Park, IL",41.7206568,-87.6847812,15/4/2016,8:16,4,0
721244776800976000,the vitamin shoppe store manager il,"Des Plaines, IL",42.0549642,-87.8408744,16/4/2016,7:52,5,0
721246814008029000,the weather forecast for today is clear with a high of and a low of,"Rock Island Arsenal, IL",41.5167,-90.5333,16/4/2016,8:00,3,0
721005218435993000,the weather forecast for today is clear with a high of and a low of,"Rock Island Arsenal, IL",41.5167,-90.5333,15/4/2016,16:00,3,0
720899525620154000,the weather forecast for today is clear with a high of and a low of,"Rock Island Arsenal, IL",41.5167,-90.5333,15/4/2016,9:00,4,0
721126013292322000,the weather forecast for tomorrow is clear with a high of and a low of,"Rock Island Arsenal, IL",41.5167,-90.5333,16/4/2016,0:00,3,0
720688128785125000,the weather forecast for tonight is clear with a low of,"Rock Island Arsenal, IL",41.5167,-90.5333,14/4/2016,19:00,4,0
720732044603600000,the weekend is upon us getting cleaned up the art of fadez in villa park il,"Villa Park, IL",41.903754,-87.988247,14/4/2016,21:54,0,1
720588591257112000,the weekend preceding the is always one of the best of each year its a time to_,"Chicago, IL",41.8369,-87.6844,14/4/2016,12:24,1,0
721142485800611000,the westin chicago river north in chicago il,"Chicago, IL",41.88813748,-87.62983114,16/4/2016,1:05,1,1
721167782352523000,the westin heavenly,"Chicago, IL",41.8881444,-87.6297077,16/4/2016,2:46,4,0
721153788413931000,the wild feathers show with some of my favorite ladies bottom lounge,"Chicago, IL",41.8850517,-87.6617737,16/4/2016,1:50,1,1
721003882667712000,the wolfpack is back join us on may weworks grant park space drinks raffle prizes,"Chicago, IL",41.87718,-87.62514,15/4/2016,15:54,0,0
720651037699399000,the work is actually the shadow but no one knows it yet,"Chicago, IL",41.87461019,-87.6249443,14/4/2016,16:32,0,0
721150594107375000,thelaurenoneil local_h going to be a great night metro chicago,"Chicago, IL",41.94988474,-87.65876825,16/4/2016,1:37,0,2
720737927085436000,thelaurenoneil over non guarantee entry fans in line for no dough show_,"Lisle, IL",41.7830763,-88.0850401,14/4/2016,22:18,0,2
720714618096758000,therapy fashion outlets of chicago in rosemont il,"Rosemont, IL",41.97620214,-87.86583066,14/4/2016,20:45,0,2
721018897445433000,there is a fine line between mud and hero dirt,"Broadview, IL",41.85450314,-87.84119279,15/4/2016,16:54,3,0
721208278345256000,there is nothing like a late night alcohol induced good luck,"Chicago, IL",41.9452095,-87.6456985,16/4/2016,5:27,1,0
721212492874166000,there is something the way you move rihanna the united center,"Chicago, IL",41.88043554,-87.67405419,16/4/2016,5:43,3,3
720961785361219000,there was fire music drink and of course food at foodiechats sensory overload but any event_,"Chicago, IL",41.895633,-87.641673,15/4/2016,13:07,0,0
721012329505132000,thermo fisher scientific applications scientist lcms il,"Chicago, IL",41.8781136,-87.6297982,15/4/2016,16:28,6,0
721047326010302000,these came conquered,"Chicago, IL",41.88541,-87.62724,15/4/2016,18:47,6,1
721148623195607000,these golfboards are everything indian_,"Chicago, IL",41.9395,-87.84427,16/4/2016,1:30,4,1
721068590162685000,these people on this train think im crazy purple line,"Chicago, IL",41.95402659,-87.65520566,15/4/2016,20:12,3,1
720653840316502000,they aint let me on center court but blessed me with the baseline_,"Chicago, IL",41.88075442,-87.67408568,14/4/2016,16:43,0,0
