721009814000705000,interested in a near south clinton il this could be a great fit,"Chicago, IL",41.8794619,-87.6408802,15/4/2016,16:18,4,0
721090611923693000,interested in a near this could be a great fit,"Schiller Park, IL",41.9551833,-87.8715463,15/4/2016,21:39,5,0
720656544686219000,interested in a near this could be a great fit,"Chicago, IL",41.8862931,-87.6249189,14/4/2016,16:54,5,0
720652259298660000,interested in a near this could be a great fit,"Chicago, IL",41.8781136,-87.6297982,14/4/2016,16:37,5,0
721129132302569000,interesting amc dinein theatres block,"Chicago, IL",41.88379,-87.62826,16/4/2016,0:12,0,1
720714739886624000,interior of the mercedesbenz c63 s amg,"Chicago, IL",41.911007,-87.666213,14/4/2016,20:45,4,0
720778366098481000,international conference on understanding receivedtheology is a critical first step,"Chicago, IL",41.8816597,-87.6352184,15/4/2016,0:58,2,0
720631275975892000,into the for at openhousecontemporary n ogden,"Chicago, IL",41.8369,-87.6844,14/4/2016,15:14,4,0
721118719817048000,invented a cocktail tbe friday the sonic penthouse,"Chicago, IL",41.9820202,-87.6569889,15/4/2016,23:31,2,2
721095203386339000,inventory associate wis international EMO_NEG il,"Fairview Heights, IL",38.5889386,-89.990382,15/4/2016,21:57,6,0
721156420171866000,is great chicago illinois,"Chicago, IL",41.8369,-87.6844,16/4/2016,2:01,0,1
721146409567850000,is having medium deep dish pizza with pepperoni and black olives lous bruschetta and,"Chicago, IL",41.89027199,-87.63389468,16/4/2016,1:21,0,0
721181624331739000,is it about seeing your name in print or in lights stony island arts bank,"Chicago, IL",41.77168,-87.58663,16/4/2016,3:41,0,2
721129695144775000,is over but the game still goes on mccormick place,"Chicago, IL",41.85131504,-87.61717358,16/4/2016,0:14,1,2
720829952078163000,is the of area grocery stores let us cheer for low prices as small business shut down,"Chicago, IL",41.92406222,-87.69928693,15/4/2016,4:23,0,2
721173421506359000,is the word happy play,"Chicago, IL",41.92481,-87.6404,16/4/2016,3:08,4,1
721123863241875000,is there a such thing as a bad day when kombucha is on sale jewelosco,"Chicago, IL",41.8666375,-87.6259349,15/4/2016,23:51,0,1
721115580015734000,it brings me so much joy to see my spelman sisters doing,"Evanston, IL",42.050698,-87.67366802,15/4/2016,23:18,0,0
720775102091161000,it feels great to be recognized for the chancellors student service award that deals with_,"Chicago, IL",41.87228385,-87.64766586,15/4/2016,0:45,0,0
720711099541139000,it goes down in the dm tonight catch me mixing live at no cover all night and the_,"Chicago, IL",41.9453115,-87.64948207,14/4/2016,20:31,0,1
721021648707710000,it goes down tonight classes are,"Skokie, IL",42.026245,-87.73016,15/4/2016,17:05,0,2
721148911847477000,it has been soo long since ive taken a selfie i think that ive forgotten how,"Chicago, IL",41.728238,-87.553241,16/4/2016,1:31,0,0
721097692378750000,it is impossible to escape the sound of the dark that is following around but i just go for a walk in my mind and a light can be found,"Chicago, IL",42.00714416,-87.67224449,15/4/2016,22:07,0,0
720735604858830000,it is on oh yes it is on logan square chicago,"Chicago, IL",41.92833333,-87.70666667,14/4/2016,22:08,0,1
721022311327862000,it looks like chicago temps will top out in the mid this weekend via skilling,"Chicago, IL",41.88804564,-87.62626724,15/4/2016,17:08,0,0
720684117180813000,it says you need an opaque bag that means one you can see through im sorry prof but youre mistaken,"Chicago, IL",41.92324776,-87.64817927,14/4/2016,18:44,0,0
720611702123794000,it security analyst coyote logistics EMO_NEG il,"Chicago, IL",41.8781136,-87.6297982,14/4/2016,13:56,6,0
721007532777418000,it was a great experience after yrs of coming to chicago this the very first time i make_,"Chicago, IL",41.8787003,-87.6359787,15/4/2016,16:09,0,0
720770602349510000,it was all but a dream and an amazing view,"Chicago, IL",41.8369,-87.6844,15/4/2016,0:27,1,0
721175916248870000,it was degrees today so its obviously time for ice cream__,"Chicago, IL",41.967928,-87.7676249,16/4/2016,3:18,4,0
721179428848549000,it was me lol i have one i made of him too,"Grayslake, IL",42.3508495,-88.0552951,16/4/2016,3:32,0,1
721142358029504000,it was ok tacos tequilas in chicago il,"Chicago, IL",41.934405,-87.716034,16/4/2016,1:05,0,1
720963287161118000,it works like that how do you expect her to love you forever and ever if you are consistently hurting her,"Chicago, IL",41.8819916,-87.6268519,15/4/2016,13:13,0,1
721045477983182000,it__s at numbers day,"Chicago, IL",41.94635287,-87.64770317,15/4/2016,18:40,1,0
720716204529168000,it__s opening week for one of america__s favorite pastimes to last year when the flirt_,"Chicago, IL",41.88755712,-87.62652629,14/4/2016,20:51,1,0
721175239015723000,italian beef with sweet peppers at in skokie il,"Skokie, IL",42.05188581,-87.74753988,16/4/2016,3:15,0,1
720732480777691000,itll be fine,"Chicago, IL",41.88572023,-87.62666687,14/4/2016,21:56,0,1
720963031879008000,its a beautiful spring day in chicago so walk on over to the original heaven on seven on_,"Chicago, IL",41.8835716,-87.6259995,15/4/2016,13:12,0,0
721066658702340000,its a good day to be an illini university of illinois at urbanachampaign,"Champaign, IL",40.1091065,-88.23050947,15/4/2016,20:04,0,1
721122556925865000,its a proven fact that the best beef is made in a shack beef shack,"Chicago, IL",41.939937,-87.656032,15/4/2016,23:46,2,1
721158732516835000,its about that time adriannas sports bar,"Markham, IL",41.5933588,-87.6658418,16/4/2016,2:10,3,1
721001615424163000,its again already if your name is nancy stop by for a free rose today_,"Wheaton, IL",41.8659,-88.10861,15/4/2016,15:45,1,0
720664370288685000,its all about the rallies and marches in chicago,"Chicago, IL",41.8369,-87.6844,14/4/2016,17:25,3,1
721023381856980000,its almost impossible to see a legit black american without multiple piercings or screaming tatts,"Chicago, IL",41.9674768,-87.658691,15/4/2016,17:12,0,0
720684650134421000,its almost over chicago state university in chicago il,"Chicago, IL",41.71751793,-87.61073112,14/4/2016,18:46,0,1
720962958742786000,its an absolutely stunning day here in central illinois we hope you have a fabulous friday_,"Savoy, IL",40.06333333,-88.2525,15/4/2016,13:12,0,0
720607923005759000,its bagel day panera bread,"Chicago, IL",41.87552,-87.62725,14/4/2016,13:41,0,1
721115727843954000,its been a long day me and stella getting reacquainted dont judge me,"Chicago, IL",41.718587,-87.68182169,15/4/2016,23:19,0,0
721175419047776000,its been a long year full of many challenging learning experiences but im very thankful for_,"Chicago, IL",41.87275502,-87.64983717,16/4/2016,3:16,0,0
721158877329293000,its been such a pleasure working with these beautiful people thanks for_,"Chicago, IL",41.86554,-87.62461,16/4/2016,2:10,0,1
720564086031978000,its good to be home chicago ohare international airport ord in chicago il,"Chicago, IL",41.97151,-87.89537,14/4/2016,10:47,0,1
721091179387994000,its hard having a meeting when youre hungry thats why we_,"Bolingbrook, IL",41.71866883,-88.04073396,15/4/2016,21:41,0,0
720650876046548000,its here we have the newest copy of magazine we get to start selling them_,"Chicago, IL",41.98481812,-87.66905196,14/4/2016,16:32,0,1
721145200584880000,its how we roll barnabys the family inn in northbrook il,"Northbrook, IL",42.13493101,-87.79020786,16/4/2016,1:16,0,2
721169619973758000,its like they made a just for me,"Chicago, IL",41.8369,-87.6844,16/4/2016,2:53,5,1
721207094251241000,its lit club la east,"East St Louis, IL",38.62458516,-90.15193103,16/4/2016,5:22,1,1
721132298599559000,its looking feeling nice tonight so theres only one spot to be at,"Chicago, IL",41.91057766,-87.67540407,16/4/2016,0:25,1,1
721007937406144000,its matzo ball soup friday rockit_,"Chicago, IL",41.8903,-87.62895,15/4/2016,16:11,3,1
720657219918757000,its never good when you run out of coffeebut when its written_,"LaSalle, IL",41.33522149,-89.08849203,14/4/2016,16:57,0,0
721122587397459000,its not the size of the car that matters its the size of the arm driving the car that does._,"Carol Stream, IL",41.90842,-88.14832,15/4/2016,23:46,0,0
720961053694304000,its not too late to call in sick today tpc deere run,"Silvis, IL",41.47726949,-90.39219175,15/4/2016,13:04,0,1
720559655567671000,its official over followers on instagram now off to doing my morning cardio_,"Chicago, IL",41.90530503,-87.69712923,14/4/2016,10:29,0,0
721177149856681000,its only been a month since ive seen her and we have the theatre to ourselves so much_,"Quincy, IL",39.93398,-91.36255,16/4/2016,3:23,0,0
721097780974850000,its our first year anniversary happy anniversary love i love ya_,"Belleville, IL",38.52016826,-90.04291688,15/4/2016,22:08,0,0
721120232241291000,its perhaps a little chilly on the patio but were tough daisy cutter pale ale,"Naperville, IL",41.7355,-88.1289,15/4/2016,23:37,1,0
721018676414062000,its press day at the lyric check out my snaps for the inside scoop,"Chicago, IL",41.88231634,-87.63742624,15/4/2016,16:53,1,0
721023150289346000,its press day at the lyric check out my snaps thecabinbaby for the inside,"Chicago, IL",41.88231634,-87.63742624,15/4/2016,17:11,0,0
721205389392482000,its real out here to,"Chicago, IL",41.9092399,-87.63498,16/4/2016,5:15,8,0
720661209251454000,its short notice but there will be a cesar chavez si se,"Joliet, IL",41.5254,-88.0747,14/4/2016,17:13,0,0
721067311873060000,its starting to warm here in the high skies_,"Chicago, IL",41.903822,-87.628866,15/4/2016,20:06,1,0
720981045739417000,its that time of year we have front tables out and ready for your conversations back patio_,"Glen Ellyn, IL",41.87423,-88.06665,15/4/2016,14:24,0,0
720982116071301000,its the pet me brigade,"Chicago, IL",41.8369,-87.6844,15/4/2016,14:28,7,1
721091870605123000,its the repetition of affirmations that leads to belief and once that belief becomes a deep_,"Chicago, IL",41.825846,-87.631519,15/4/2016,21:44,0,0
720998726676774000,its time for your reminder that dunkin donuts is trash,"Homewood, IL",41.56710744,-87.63626183,15/4/2016,15:34,0,1
721045561487413000,its time to dance__ fringe_,"Frankfort, IL",41.498174,-87.849777,15/4/2016,18:40,7,1
721152081890033000,its time to relax after a long day of shopping,"Glenview, IL",42.0884077,-87.8234495,16/4/2016,1:43,3,0
721007432642596000,its time tune into right now am wgn radio,"Chicago, IL",41.89019854,-87.62380269,15/4/2016,16:09,0,3
721139791711105000,its time united center,"Chicago, IL",41.88075442,-87.67408568,16/4/2016,0:54,1,2
720688403528855000,its what have you done for me lately by at river north neighborhood,"Chicago, IL",41.88996,-87.63734,14/4/2016,19:01,1,1
721151038078771000,ive only seen it once and that was times too many,"Riverdale, IL",41.64342288,-87.62165872,16/4/2016,1:39,0,1
721069820196872000,iz ravnice al sam video brdo millennium park,"Chicago, IL",41.88270833,-87.62266667,15/4/2016,20:16,0,1
721021008128380000,j crew halter top dress sz great for the season available on,"Barrington, IL",42.15361111,-88.13194444,15/4/2016,17:02,0,1
721146235478913000,jael done broke her finger momma bones and her daddy heart holy cross hospital,"Chicago, IL",41.76903457,-87.69250327,16/4/2016,1:20,0,1
720963600748265000,jafri cousins spouses at mehndi missing my asad alvena fariha and both_,"Addison, IL",41.90585,-87.99451,15/4/2016,13:14,1,0
721183884176699000,jalan kaki thru at in chicago il,"Chicago, IL",41.83132121,-87.61516438,16/4/2016,3:50,0,1
721028010699141000,jalc student workers doin what we do best john a logan college,"Carterville, IL",37.74780813,-89.0894212,15/4/2016,17:30,0,1
720827780384956000,james iha showed up in to play some with thats,"Chicago, IL",41.88231634,-87.63742624,15/4/2016,4:15,3,0
721099108258189000,jared bench jeweler woodfield road il,"Schaumburg, IL",42.0333607,-88.0834059,15/4/2016,22:13,6,0
721017912123793000,jaris stop trolling me,"Nashville, IL",38.34383146,-89.38186134,15/4/2016,16:50,0,3
721175930836762000,jason held jasonlheld on twitter bid to get his makeover by me in min i think he_,"Chicago, IL",41.95517576,-87.67342255,16/4/2016,3:18,0,0
721129252624732000,jcav531 my craving went from pizza to and berries,"Chicago, IL",41.90256038,-87.69835984,16/4/2016,0:13,4,1
720683477969018000,jeff greenfield fireside chats and a dog named checkers uchicago institute of politics,"Chicago, IL",41.79124245,-87.59626626,14/4/2016,18:41,0,1
721121126588489000,jeremyjrmy of mondae productions pt,"Chicago, IL",41.8369,-87.6844,15/4/2016,23:40,5,1
721169525216055000,jess the mess x2 jerseys pizza grill,"South Barrington, IL",42.07471127,-88.13888607,16/4/2016,2:53,0,1
720683787839864000,jet isnt set chicago ohare international airport,"Chicago, IL",41.97690122,-87.90298546,14/4/2016,18:42,0,1
721094290240376000,jill who cant win them all be back tomorrow,"Chicago, IL",41.94603661,-87.65543206,15/4/2016,21:54,5,0
720612774397607000,jobjuncture hvac business development il,"Chicago, IL",41.8781136,-87.6297982,14/4/2016,14:00,6,0
721150851029581000,joe is back excited to see him drum with local_h at filming with team,"Chicago, IL",41.94988474,-87.65876825,16/4/2016,1:38,1,1
721155320958033000,joe satriani amazing the chicago theatre,"Chicago, IL",41.88541,-87.62724,16/4/2016,1:56,0,1
721172204977840000,joel king its been a minute bottom lounge,"Chicago, IL",41.8850517,-87.6617737,16/4/2016,3:03,0,2
721155679721926000,joes bar on weed,"Chicago, IL",41.91011,-87.65201,16/4/2016,1:58,2,1
721146387807735000,john i had a delicious dinner and fun visit with dear friendsa mom and daughter tandem._,"Oakbrook Terrace, IL",41.8537,-87.9682,16/4/2016,1:21,0,0
720810301134872000,join april at for the release of our limited edition battlepug_,"Chicago, IL",41.91533242,-87.68727081,15/4/2016,3:05,0,2
721145004136230000,join me this sunday for one last open house s indiana,"Chicago, IL",41.866251,-87.623038,16/4/2016,1:15,4,0
721090478846791000,join the accountemps team see our latest opening here il,"Chicago, IL",41.8839927,-87.6197056,15/4/2016,21:39,5,0
721011992379559000,join the accountemps team see our latest opening here il,"Northbrook, IL",42.1275267,-87.8289548,15/4/2016,16:27,5,0
720608970512007000,join the accountemps team see our latest opening here il,"Rosemont, IL",41.9867507,-87.8721602,14/4/2016,13:45,5,0
721069220549828000,join the aerotek team see our latest opening here il,"Chicago, IL",41.8781136,-87.6297982,15/4/2016,20:14,4,0
721025513666383000,join the aerotek team see our latest opening here il,"Chicago, IL",41.8781136,-87.6297982,15/4/2016,17:20,4,0
721024398493229000,join the aerotek team see our latest opening here il,"Northlake, IL",41.9172526,-87.8956185,15/4/2016,17:16,4,0
721022946966306000,join the aerotek team see our latest opening here il,"Grayslake, IL",42.3444664,-88.041746,15/4/2016,17:10,4,0
721016977267888000,join the aerotek team see our latest opening here il,"Countryside, IL",41.77655,-87.876561,15/4/2016,16:46,4,0
721012809635471000,join the aerotek team see our latest opening here il,"Bridgeview, IL",41.7500323,-87.8042216,15/4/2016,16:30,4,0
721003637040779000,join the aerotek team see our latest opening here il,"Rockford, IL",42.2711311,-89.0939952,15/4/2016,15:53,4,0
720684575895072000,join the aerotek team see our latest opening here il,"Plainfield, IL",41.632223,-88.2120315,14/4/2016,18:46,4,0
720661520665808000,join the aerotek team see our latest opening here il,"Glendale Heights, IL",41.9202,-88.078849,14/4/2016,17:14,4,0
720651529980477000,join the aerotek team see our latest opening here il,"Richmond, IL",42.4758522,-88.3059251,14/4/2016,16:34,4,0
720650829959602000,join the aerotek team see our latest opening here il,"Chicago, IL",41.8781136,-87.6297982,14/4/2016,16:32,4,0
721090475927560000,join the allstate insurance team see our latest opening here il,"Northbrook, IL",42.138337,-87.84006,15/4/2016,21:39,5,0
720663079684444000,join the allstate insurance team see our latest opening here il,"Northbrook, IL",42.138337,-87.84006,14/4/2016,17:20,4,0
721064813384740000,join the amtrak team see our latest opening here il,"Chicago, IL",41.8817767,-87.6371461,15/4/2016,19:57,5,0
721067695790104000,join the ati physical therapy team see our latest opening here illinois,"Bolingbrook, IL",41.6986416,-88.0683955,15/4/2016,20:08,4,0
721045948202258000,join the ati physical therapy team see our latest opening here illinois,"Bolingbrook, IL",41.6986416,-88.0683955,15/4/2016,18:42,4,0
720712888361431000,join the bobs discount furniture team see our latest opening here il,"Schaumburg, IL",42.0333607,-88.0834059,14/4/2016,20:38,5,0
720686543631814000,join the chicos team see our latest opening here il,"Rosemont, IL",41.9754926,-87.8659742,14/4/2016,18:53,4,0
721045699765272000,join the cintas corporation team see our latest opening here il,"Schaumburg, IL",42.0333607,-88.0834059,15/4/2016,18:41,4,0
720777136676560000,join the citi trends team see our latest opening here il,"Cahokia, IL",38.5604245,-90.173729,15/4/2016,0:53,4,0
720959991956418000,join the cna insurance team see our latest opening here il,"Chicago, IL",41.8781136,-87.6297982,15/4/2016,13:00,5,0
720711795745300000,join the cna insurance team see our latest opening here il,"Lisle, IL",41.801141,-88.0747875,14/4/2016,20:34,5,0
721023043313664000,join the cognizant team see our latest opening here il,"Riverwoods, IL",42.1675254,-87.897014,15/4/2016,17:11,4,0
720587005097222000,join the cognizant team see our latest opening here il,"Elgin, IL",42.0372484,-88.2834849,14/4/2016,12:18,4,0
721099583313436000,join the combined insurance team see our latest opening here il,"Springfield, IL",39.7817213,-89.6501481,15/4/2016,22:15,5,0
721294171798024000,join the compass group usa team see our latest opening here il,"Chicago, IL",41.8781136,-87.6297982,16/4/2016,11:08,5,0
721151762371977000,join the compass group usa team see our latest opening here il,"Bolingbrook, IL",41.6986416,-88.0683955,16/4/2016,1:42,5,0
721067314175614000,join the compass group usa team see our latest opening here il,"Chicago, IL",41.8781136,-87.6297982,15/4/2016,20:06,5,0
720661268923686000,join the compass group usa team see our latest opening here il,"Bolingbrook, IL",41.6986416,-88.0683955,14/4/2016,17:13,5,0
721134131128590000,join the cvs health team see our latest opening here il,"Chicago, IL",41.8781136,-87.6297982,16/4/2016,0:32,4,0
721093450691547000,join the cvs health team see our latest opening here il,"Salem, IL",38.6269929,-88.9456158,15/4/2016,21:50,5,0
721046212699226000,join the cvs health team see our latest opening here il,"Elmhurst, IL",41.8994744,-87.9403418,15/4/2016,18:43,5,0
721017313462329000,join the cvs health team see our latest opening here il,"Schaumburg, IL",42.0333607,-88.0834059,15/4/2016,16:48,5,0
720737927374839000,join the cvs health team see our latest opening here il,"Mendota, IL",41.5472547,-89.1175851,14/4/2016,22:18,4,0
720737004770578000,join the cvs health team see our latest opening here il,"Chicago, IL",41.8781136,-87.6297982,14/4/2016,22:14,5,0
720664170199257000,join the dayton freight team see our latest opening here il,"Crest Hill, IL",41.554753,-88.0986709,14/4/2016,17:25,5,0
721093235083386000,join the delaware north team see our latest opening here il,"Rock Island, IL",41.5094771,-90.5787476,15/4/2016,21:49,5,0
720962439332761000,join the department of veterans affairs team see our latest opening here il,"North Chicago, IL",42.325578,-87.8411818,15/4/2016,13:10,3,0
720889989035376000,join the favorite health care staffing team see our latest opening here,"DeKalb, IL",41.9294736,-88.7503647,15/4/2016,8:22,2,0
720631879955718000,join the favorite health care staffing team see our latest opening here il,"Waukegan, IL",42.3636331,-87.8447938,14/4/2016,15:16,4,0
720715648448339000,join the federalmogul team see our latest opening here il,"Skokie, IL",42.0333636,-87.7333934,14/4/2016,20:49,5,0
720712352610394000,join the federalmogul team see our latest opening here il,"Skokie, IL",42.0333636,-87.7333934,14/4/2016,20:36,5,0
721136475790774000,join the fight stop sexual assault main quad,"Urbana, IL",40.1082893,-88.22727737,16/4/2016,0:41,0,1
721010095883030000,join the fiserv team see our latest opening here il,"Chicago, IL",41.8781136,-87.6297982,15/4/2016,16:19,5,0
720732061766590000,join the follett corporation team see our latest opening here il,"McHenry, IL",42.3223041,-88.3044908,14/4/2016,21:54,5,0
721020577452982000,join the forward air transportation services team see our latest opening here il,"Gurnee, IL",42.3702996,-87.9020186,15/4/2016,17:01,3,0
721012840799178000,join the glanbia performance nutrition team see our latest opening here il,"Bensenville, IL",41.9550296,-87.9400657,15/4/2016,16:30,4,0
720611945468928000,join the great clips team see our latest opening here il,"Oak Park, IL",41.8850317,-87.7845025,14/4/2016,13:57,5,0
721317363853819000,join the guaranty bank team see our latest opening here il,"Melrose Park, IL",41.9096734,-87.8658524,16/4/2016,12:40,3,0
720710939109003000,join the guckenheimer team see our latest opening here il,"Chicago, IL",41.8781136,-87.6297982,14/4/2016,20:30,5,0
720659812590034000,join the hair cuttery salon team see our latest opening here,"Elmhurst, IL",41.8948129,-87.9615842,14/4/2016,17:07,3,0
721093962761502000,join the helzberg diamonds team see our latest opening here il,"Joliet, IL",41.525031,-88.0817251,15/4/2016,21:52,4,0
721092776666931000,join the hhgregg team see our latest opening here il,"Rockford, IL",42.2711311,-89.0939952,15/4/2016,21:48,5,0
720631035247988000,join the hhgregg team see our latest opening here il,"Vernon Hills, IL",42.2393323,-87.9653565,14/4/2016,15:13,5,0
721071540838596000,join the jared team see our latest opening here il,"Joliet, IL",41.525031,-88.0817251,15/4/2016,20:23,5,0
721093538952249000,join the kelly services team see our latest opening here il,"Lisle, IL",41.794402,-88.0803051,15/4/2016,21:51,6,0
721001887634358000,join the kelly services team see our latest opening here il,"Springfield, IL",39.7853965,-89.6722171,15/4/2016,15:47,5,0
720687651938897000,join the kelly services team see our latest opening here il,"Orland Park, IL",41.5718051,-87.8844309,14/4/2016,18:58,5,0
720686327004422000,join the kellymitchell group team see our latest opening here il,"Riverwoods, IL",42.1675254,-87.897014,14/4/2016,18:53,4,0
721095030186770000,join the languageline solutions team see our latest opening here il,"Chicago, IL",41.8781136,-87.6297982,15/4/2016,21:57,4,0
720687830968590000,join the languageline solutions team see our latest opening here il,"Springfield, IL",39.7817213,-89.6501481,14/4/2016,18:59,4,0
721072366340612000,join the liberty mutual insurance team see our latest opening here il,"Warrenville, IL",41.817807,-88.1734021,15/4/2016,20:27,4,0
720735899336638000,join the lowes stores team see our latest opening here il,"Arlington Heights, IL",42.0883603,-87.9806265,14/4/2016,22:10,4,0
720715623450284000,join the lowes stores team see our latest opening here il,"Granite City, IL",38.7014389,-90.1487199,14/4/2016,20:49,4,0
721069112193974000,join the loyola university chicago team see our latest opening here il,"Chicago, IL",41.9998468,-87.6570368,15/4/2016,20:14,4,0
720632478352822000,join the loyola university chicago team see our latest opening here il,"Chicago, IL",41.9998468,-87.6570368,14/4/2016,15:19,4,0
720652468657328000,join the macys beauty team see our latest opening here il,"Skokie, IL",42.0587645,-87.7498796,14/4/2016,16:38,5,0
721046052736905000,join the maggianos team see our latest opening here il,"Skokie, IL",42.0258969,-87.7580355,15/4/2016,18:42,5,0
721096342538313000,join the mcdonalds corporation team see our latest opening here il,"Wheaton, IL",41.8661403,-88.1070127,15/4/2016,22:02,4,0
721064877431721000,join the medexpress team see our latest opening here il,"Alton, IL",38.8906038,-90.1842764,15/4/2016,19:57,6,0
720872059685851000,join the medexpress team see our latest opening here il,"Quincy, IL",39.9356016,-91.4098726,15/4/2016,7:11,6,0
721012515606372000,join the memorial health system team see our latest opening here il,"Springfield, IL",39.7817213,-89.6501481,15/4/2016,16:29,4,0
720706958869725000,join the memorial health system team see our latest opening here il,"Lincoln, IL",40.1523387,-89.3882737,14/4/2016,20:15,5,0
721131010872582000,join the molina healthcare team see our latest opening here il,"Chicago, IL",41.8781136,-87.6297982,16/4/2016,0:20,3,0
721316506789785000,join the newell rubbermaid team see our latest opening here il,"Chicago, IL",41.8781136,-87.6297982,16/4/2016,12:37,4,0
720732376620335000,join the nordstrom team see our latest opening here illinois,"Oak Brook, IL",41.8397865,-87.9535534,14/4/2016,21:56,5,0
720650456771395000,join the officeteam team see our latest opening here il,"Chicago, IL",41.8839927,-87.6197056,14/4/2016,16:30,5,0
721094721494392000,join the oracle team see our latest opening here il,"Itasca, IL",41.9750287,-88.0072909,15/4/2016,21:55,5,0
720708846868508000,join the oreilly auto parts team see our latest opening here il,"Anna, IL",37.4605243,-89.2354243,14/4/2016,20:22,5,0
721127679097896000,join the panera bread team see our latest opening here il,"Schaumburg, IL",42.024553,-88.140443,16/4/2016,0:06,3,0
721045632232726000,join the panera bread team see our latest opening here il,"Woodridge, IL",41.7498263,-88.0151253,15/4/2016,18:40,3,0
720710334034481000,join the panera bread team see our latest opening here il,"Carbondale, IL",37.7273304,-89.1984816,14/4/2016,20:28,5,0
720684199829590000,join the panera bread team see our latest opening here il,"Machesney Park, IL",42.366003,-89.0274316,14/4/2016,18:44,5,0
