721152154380148000,drinking a deluxe malt liquor by castle of the king,"Hillsborough, NJ",40.5135,-74.6342,16/4/2016,1:44,1,2
721128453152620000,drinking a dirty blonde by glendora nj,"Glendora, NJ",39.8397,-75.0739,16/4/2016,0:09,1,2
721130494675546000,drinking a dortmunder gold by at,"Eatontown, NJ",40.2884,-74.0534,16/4/2016,0:18,1,2
721132947764600000,drinking a fika by angry erik brewing nicoles ten restaurant,"Victory Gardens, NJ",40.8703,-74.5476,16/4/2016,0:27,0,1
721125944791015000,drinking a funnel cake by at,"Cardiff, NJ",39.434,-74.6103,15/4/2016,23:59,0,2
720732679847677000,drinking a general washingtons tavern porter by phillipsburg nj,"Phillipsburg, NJ",40.6935,-75.1904,14/4/2016,21:57,1,2
721135044216168000,drinking a gold bar blonde by manskirt brewery,"Hackettstown, NJ",40.8539,-74.8298,16/4/2016,0:36,0,2
721142281651232000,drinking a grape swisher by at,"Cardiff, NJ",39.434,-74.6103,16/4/2016,1:04,0,2
721012573726969000,drinking a guinness draught by at,"Westmont, NJ",39.9048,-75.042,15/4/2016,16:29,1,2
721175234846572000,drinking a guinness draught by chelsea pub inn,"Atlantic City, NJ",39.3534,-74.4475,16/4/2016,3:15,0,2
721179025381699000,drinking a harpoon boston irish stout by world of beer,"New Brunswick, NJ",40.4943,-74.4438,16/4/2016,3:30,0,2
721206856035790000,drinking a hazed hoppy session ale by at,"Asbury Park, NJ",40.2165,-74.0092,16/4/2016,5:21,0,2
721134487996928000,drinking a head high by at,"Eatontown, NJ",40.2884,-74.0534,16/4/2016,0:33,0,2
721179101936148000,drinking a head high by world of beer,"New Brunswick, NJ",40.4943,-74.4438,16/4/2016,3:31,0,2
721119633479245000,drinking a hoegaarden blanche by brouwerij van hoegaarden at,"Heathcote, NJ",40.3927,-74.5659,15/4/2016,23:34,1,1
720778536475324000,drinking a hop lab citra pale ale by at,"Green Brook, NJ",40.6021,-74.4781,15/4/2016,0:59,0,2
721099517391675000,drinking a hop showers by sewaren new jersey,"Sewaren, NJ",40.5626,-74.2564,15/4/2016,22:14,1,2
720736772221702000,drinking a javahorn by at,"Clark, NJ",40.6269,-74.3067,14/4/2016,22:13,0,2
721148772571619000,drinking a kentucky breakfast stout kbs by at,"Readington, NJ",40.6183,-74.7405,16/4/2016,1:30,0,2
721164450481446000,drinking a keystone light by coors brewing company phillipsburg nj,"Phillipsburg, NJ",40.6935,-75.1904,16/4/2016,2:32,1,1
721171487168839000,drinking a mad michael by la isla restaurant,"Hoboken, NJ",40.7509,-74.0253,16/4/2016,3:00,1,2
721132869087817000,drinking a megaboss ipa by nicoles ten restaurant,"Victory Gardens, NJ",40.8703,-74.5476,16/4/2016,0:27,0,2
721126243836555000,drinking a miller lite by phillipsburg nj,"Phillipsburg, NJ",40.6935,-75.1904,16/4/2016,0:01,1,2
721143355019759000,drinking a miller lite by warren lanes,"Phillipsburg, NJ",40.6976,-75.1797,16/4/2016,1:09,1,2
721142905616928000,drinking a modelo especial by at,"Heathcote, NJ",40.3927,-74.5659,16/4/2016,1:07,1,2
721138619864494000,drinking a moneyman ipa by highbridge,"Medford Lakes, NJ",39.8289,-74.8171,16/4/2016,0:50,0,2
721127048354402000,drinking a nitro ipa by at,"Heathcote, NJ",40.3927,-74.5659,16/4/2016,0:04,1,2
721209555112304000,drinking a pabst blue ribbon by hopatcong nj,"Hopatcong, NJ",40.9332,-74.6603,16/4/2016,5:32,0,2
721209258574917000,drinking a pabst blue ribbon by hopatcong nj,"Hopatcong, NJ",40.9332,-74.6603,16/4/2016,5:31,0,2
721139227585552000,drinking a passion fruit kicker by matts sex pad,"Absecon, NJ",39.4667,-74.5144,16/4/2016,0:52,0,2
720754881204785000,drinking a peroni original by la taverna,"Dayton, NJ",40.3754,-74.5119,14/4/2016,23:25,1,2
721134597216563000,drinking a pitch pine ale by at,"McKee City, NJ",39.4505,-74.6473,16/4/2016,0:34,0,2
721141184098406000,drinking a pocket trick by at,"Cardiff, NJ",39.434,-74.6103,16/4/2016,1:00,0,2
721119506882564000,drinking a pocket trick by club,"Absecon, NJ",39.4753,-74.5037,15/4/2016,23:34,1,2
721148339190898000,drinking a pocket trick by west caldwell nj,"West Caldwell, NJ",40.8502,-74.2939,16/4/2016,1:28,1,2
721115986536087000,drinking a pride by demented brewing company at,"Hoboken, NJ",40.7401,-74.0309,15/4/2016,23:20,0,1
721116319563792000,drinking a prohibition ale by the iron room,"Chelsea Heights, NJ",39.3585,-74.4609,15/4/2016,23:21,0,2
720710455203860000,drinking a raison dextra by otts,"Medford Lakes, NJ",39.8699,-74.8113,14/4/2016,20:28,0,2
721173407581265000,drinking a rampant by at,"Morristown, NJ",40.8209,-74.4813,16/4/2016,3:08,0,2
721177765102260000,drinking a rampant by steinbach building,"Asbury Park, NJ",40.2165,-74.01,16/4/2016,3:25,0,2
720736815481810000,drinking a red headed step brewer by departed soles brewing company at,"Clark, NJ",40.6269,-74.3067,14/4/2016,22:13,0,1
721125527118024000,drinking a regular coffee by nicoles ten restaurant,"Victory Gardens, NJ",40.8703,-74.5476,15/4/2016,23:58,0,2
720735376537755000,drinking a roly poly pils by at,"Clark, NJ",40.6269,-74.3067,14/4/2016,22:07,0,2
720833762464915000,drinking a samuel adams cold snap by the rock bar grill,"Clifton, NJ",40.8399,-74.1343,15/4/2016,4:38,0,2
721047017267572000,drinking a space cake by b2 bar bistro,"Red Bank, NJ",40.346,-74.0762,15/4/2016,18:46,1,2
721132578049290000,drinking a spruce mousse by nicoles ten restaurant,"Victory Gardens, NJ",40.8703,-74.5476,16/4/2016,0:26,0,2
721096374259945000,drinking a stacys mom by beach st in north wildwood,"North Wildwood, NJ",39.0029,-74.7873,15/4/2016,22:02,1,3
721120123856293000,drinking a stupid stout by the taproom grill,"Westmont, NJ",39.8997,-75.0529,15/4/2016,23:36,0,2
720753963352604000,drinking a summer shandy by at,"Ramblewood, NJ",39.9274,-74.9563,14/4/2016,23:21,0,2
721181860177571000,drinking a taddy porter by world of beer,"New Brunswick, NJ",40.4943,-74.4438,16/4/2016,3:42,0,2
721139239518355000,drinking a tank farmhouse ale by at,"Metuchen, NJ",40.5412,-74.361,16/4/2016,0:52,0,2
721143925466079000,drinking a traditional lager by romas ristorante,"North Arlington, NJ",40.7919,-74.1323,16/4/2016,1:11,1,2
721150432270237000,drinking a vallejo by beesleys point,"Beesleys Point, NJ",39.2851,-74.6273,16/4/2016,1:37,0,2
721183424401260000,drinking a variabull batch by world of beer,"New Brunswick, NJ",40.4943,-74.4438,16/4/2016,3:48,0,2
720776904811421000,drinking a what the butler saw by cross orange,"Asbury Park, NJ",40.2166,-74.0088,15/4/2016,0:53,0,2
721234432523386000,drinking a window seat by short hills nj,"Millburn, NJ",40.7392,-74.3272,16/4/2016,7:11,0,2
721202448552038000,drinking a window seat by short hills nj,"Millburn, NJ",40.7392,-74.3272,16/4/2016,5:03,1,2
720713434552262000,drinking a yards saison by at,"Hillsborough, NJ",40.5013,-74.6436,14/4/2016,20:40,0,2
720736994503041000,drinking an a dark night by departed soles brewing company at,"Clark, NJ",40.6269,-74.3067,14/4/2016,22:14,0,1
721158609409863000,drinking an a night to end all dawns vanilla by marmora,"Marmora, NJ",39.2645,-74.6471,16/4/2016,2:09,0,2
720732838648266000,drinking an abbey dubbel by at,"Jersey City, NJ",40.7152,-74.0469,14/4/2016,21:57,0,2
721132809847447000,drinking an all day ipa by thirsty turtle,"Cranford, NJ",40.6541,-74.3061,16/4/2016,0:27,0,2
721170743015444000,drinking an angel of darkness by zabranskys pit stop,"Maywood, NJ",40.9047,-74.0582,16/4/2016,2:57,0,2
721134043371335000,drinking an by sexy shack,"Williamstown, NJ",39.6705,-74.9969,16/4/2016,0:32,1,2
720835428316684000,drinking an elmes mild manor by harvest moon brewery new jersey harvest moon brewery,"New Brunswick, NJ",40.4962,-74.4442,15/4/2016,4:45,1,1
720835120127561000,drinking an elmes mild manor by harvest moon brewery new jersey harvest moon brewery,"New Brunswick, NJ",40.4962,-74.4442,15/4/2016,4:44,1,1
720736560497475000,drinking an india pale ale ipa by at,"Hillsborough, NJ",40.5013,-74.6436,14/4/2016,22:12,0,2
721129110714585000,drinking an ipa by at,"Lakewood, NJ",40.0747,-74.1885,16/4/2016,0:12,0,2
720774784074846000,drinking an ipa by at,"Green Brook, NJ",40.6021,-74.4781,15/4/2016,0:44,0,2
720828996540235000,drinking an on fleek by short hills nj,"Millburn, NJ",40.7392,-74.3272,15/4/2016,4:19,1,3
721092202278031000,drinking an otra vez by phillipsburg nj,"Phillipsburg, NJ",40.6935,-75.1904,15/4/2016,21:45,0,2
721127106571333000,drinking an ovb creamsicle ipa by at,"Cardiff, NJ",39.434,-74.6103,16/4/2016,0:04,0,2
721134713352691000,drinking an smash by at,"McKee City, NJ",39.4505,-74.6473,16/4/2016,0:34,0,2
721139808287006000,drinking the great porter by manskirt brewery,"Hackettstown, NJ",40.8539,-74.8298,16/4/2016,0:55,0,2
721010429284257000,dropped off the last payment for the wedding we cant believe it_,"Smithville, NJ",39.495173,-74.46058381,15/4/2016,16:20,0,0
720777979715002000,dropping off red oak drive cherry hill in cherry hill nj,"Springdale, NJ",39.89356671,-74.98779563,15/4/2016,0:57,0,1
720777027968573000,duanepressure_music_goneup roadblock radio new jersey,"East Orange, NJ",40.75297355,-74.22781164,15/4/2016,0:53,2,1
720828483945914000,dubbed or subbed i dont care just shut up and watch it and enjoy,"Egg Harbor City, NJ",39.53065408,-74.65179909,15/4/2016,4:17,0,1
721132593979203000,dude food at in woodland park nj,"Woodland Park, NJ",40.88461176,-74.21002513,16/4/2016,0:26,0,1
720686590037778000,dump trump teaneck marriott at glenpointe in teaneck nj,"Teaneck, NJ",40.87163386,-74.00499695,14/4/2016,18:54,0,1
721123316854091000,dunya merkezine yolculuk jersey city new jersey,"Jersey City, NJ",40.7114,-74.0647,15/4/2016,23:49,0,1
721116075706957000,during wedding beer drinking a blitzkrieg hops double ipa by at,"Tinton Falls, NJ",40.2851,-74.0794,15/4/2016,23:20,0,2
721162965702086000,duval bar lounge in linden nj,"Linden, NJ",40.6281228,-74.24588243,16/4/2016,2:27,6,1
721173747336667000,eagles are majestic mahwah new jersey,"Mahwah, NJ",41.0886,-74.1442,16/4/2016,3:09,0,1
721269507122139000,east_,"East Freehold, NJ",40.2729,-74.239,16/4/2016,9:30,7,1
720832129504923000,el duo perfecto live__ rutgers university tonight friday april travis hall_,"New Brunswick, NJ",40.50319371,-74.45245113,15/4/2016,4:32,0,0
721202023270649000,el jefe pennsville new jersey,"Pennsville, NJ",39.656,-75.5171,16/4/2016,5:02,0,1
721148538252607000,elias_the_lion_lainez getting in the ring baby its going down,"Asbury Park, NJ",40.215839,-74.009789,16/4/2016,1:29,2,0
721134125961342000,elliptical the party room and gym in cherry hill nj,"Cherry Hill Mall, NJ",39.934754,-74.985783,16/4/2016,0:32,0,1
721092059872911000,emcare emergency department nurse physician assistant nj,"Holmdel, NJ",40.3451095,-74.1840322,15/4/2016,21:45,4,0
720660836184776000,emily i are waiting in line for ems road test fingers crossed nj motor vehicle commission dmv,"Lawrence, NJ",40.28754652,-74.68871713,14/4/2016,17:11,0,1
721066392045428000,empty glasses full hearts seconds mod cup_,"Jersey City, NJ",40.744987,-74.043847,15/4/2016,20:03,4,1
720998465782824000,en los estudios de telemundo en vivo haciendo mi segmento decorativos de,"Fort Lee, NJ",40.85993,-73.96998,15/4/2016,15:33,1,0
720962241332424000,en route to walt whitman service area in cherry hill nj,"Ashland, NJ",39.88576739,-75.00263214,15/4/2016,13:09,1,1
721181098345119000,enjoying a a night to end all dawns coconut by shop rite shopping center,"Marmora, NJ",39.2653,-74.6506,16/4/2016,3:39,0,2
720737035372392000,enjoying a beatitude mosaic dry hopped tart saison by sewaren new jersey,"Sewaren, NJ",40.5626,-74.2564,14/4/2016,22:14,1,2
721098957062062000,enjoying a the waldos special ale aka waldos by at,"Bayville, NJ",39.8914,-74.1768,15/4/2016,22:12,1,2
721183685328900000,enjoying angelinas first play cinderella kids jordan road school public schools,"Somers Point, NJ",39.31960797,-74.60707144,16/4/2016,3:49,0,1
721183928963436000,enough said american cut bar grill nj,"Englewood Cliffs, NJ",40.87985,-73.9508199,16/4/2016,3:50,1,1
721173088466046000,es primavera y las tortugas en mi ciudad lo saben lake carnegie,"Princeton, NJ",40.37038611,-74.62154722,16/4/2016,3:07,0,1
721162687405621000,escolevi in studio studio dub sessions open spots link up for_,"Irvington, NJ",40.7257,-74.2321,16/4/2016,2:25,1,0
721141753298878000,esto eh lo k biene south p,"Paterson, NJ",40.89059712,-74.15592101,16/4/2016,1:02,1,1
721182599192920000,esto es un verdadero goal__ new jersery,"Newark, NJ",40.77210392,-74.16462809,16/4/2016,3:45,4,1
721285086432264000,even after all this time the sun never says to the earth you owe_,"Margate City, NJ",39.31807461,-74.51520556,16/4/2016,10:32,0,0
721046460704428000,even sadder even if contraception were banned for every soul conceived literally trillions more would never see,"Nutley, NJ",40.77477477,-74.13895387,15/4/2016,18:44,0,1
721046469390835000,even then infinitely many more would never be conceived but at least wed be doing the best we could given female,"Nutley, NJ",40.77477477,-74.13895387,15/4/2016,18:44,0,1
720655679690829000,every appointment its something different with this guy another pleased client._,"West Orange, NJ",40.79041,-74.2330099,14/4/2016,16:51,0,0
721046467964702000,every months off to rest until they used up all their eggs or until they died whichever came,"Nutley, NJ",40.77477477,-74.13895387,15/4/2016,18:44,0,1
721156278404325000,every needs a fortress of solitude secaucus annex,"Secaucus, NJ",40.79328874,-74.06935441,16/4/2016,2:00,3,1
721150622272253000,every potato needs a carrot taka taka,"Asbury Park, NJ",40.215702,-74.01163,16/4/2016,1:38,0,1
721288550117941000,ewr las newark liberty international airport ewr in newark nj,"Newark, NJ",40.68968494,-74.17938709,16/4/2016,10:46,0,1
720684377060077000,ewr mco newark liberty international airport,"Newark, NJ",40.6925,-74.16861111,14/4/2016,18:45,3,1
720903858248159000,ewr mco newark liberty international airport ewr in newark nj,"Newark, NJ",40.68968494,-74.17938709,15/4/2016,9:17,0,2
720738806362738000,ewr sfo newark liberty international airport ewr in newark nj,"Newark, NJ",40.68968494,-74.17938709,14/4/2016,22:21,0,1
720610838273503000,ex police chief of ac calling me telling me im on my way up to_,"Leonia, NJ",40.86407258,-73.99237682,14/4/2016,13:53,0,0
720714658328547000,exactly month away edc,"East Rutherford, NJ",40.81334115,-74.07691929,14/4/2016,20:45,5,1
721122480405028000,exchange place boardwalk,"Jersey City, NJ",40.71676458,-74.03263949,15/4/2016,23:46,1,1
721011557145190000,excuse me blonde,"Millburn, NJ",40.71837365,-74.32861526,15/4/2016,16:25,6,1
721164472732225000,exited the birth canal,"Nutley, NJ",40.77477477,-74.13895387,16/4/2016,2:33,0,1
721092279838969000,explains us in one picture montclair state university,"Little Falls, NJ",40.86082817,-74.19896016,15/4/2016,21:46,0,1
721002219651215000,express sales associate nj,"Toms River, NJ",39.9537358,-74.1979458,15/4/2016,15:48,6,0
721154655825358000,f.u.c.k k.o.b.e,"Trenton, NJ",40.19830742,-74.75026981,16/4/2016,1:54,0,3
721151667438157000,f_r_i_e_n_d_s cedar gardens,"Mercerville, NJ",40.231442,-74.679112,16/4/2016,1:42,0,1
720855684863012000,fab in the building bliss lounge,"Clifton, NJ",40.8527069,-74.1736374,15/4/2016,6:06,0,1
720855329425100000,fab in the building mr chop em up we gon be there soon bliss lounge,"Clifton, NJ",40.8527069,-74.1736374,15/4/2016,6:04,1,1
721171769755832000,facing more shots then kobe took in his last game on a weekly basis there is no better goalie_,"Red Bank, NJ",40.34027887,-74.068605,16/4/2016,3:02,0,0
721164690940948000,fam takes on relay alpha gamma delta at seton hall university,"South Orange, NJ",40.74279,-74.24659,16/4/2016,2:33,0,1
721179109280362000,fantastic player,"Toms River, NJ",39.9715838,-74.1364288,16/4/2016,3:31,1,0
721281142956040000,favorite health care staffing licensed practical nurse lpn nj,"Vineland, NJ",39.4863773,-75.0259637,16/4/2016,10:16,2,0
721095377475141000,favorite health care staffing registered nurse rn er per diem nj,"Marlton, NJ",39.8912248,-74.9218324,15/4/2016,21:58,5,0
721127755119599000,favorite health care staffing registered nurse rn or per nj,"Camden, NJ",39.9259463,-75.1196199,16/4/2016,0:07,2,0
720650943528763000,favorite health care staffing registered nurse rn pcu per diem nj,"Summit, NJ",40.7146376,-74.3646122,14/4/2016,16:32,5,0
720655365981929000,favorite health care staffing registered nurse rn tel contract nj,"Ridgewood, NJ",40.9792645,-74.1165313,14/4/2016,16:50,5,0
721027466186375000,fazendo um cafezinho importado pra come_ar a comemorar o impeachment,"Weehawken, NJ",40.768903,-74.015427,15/4/2016,17:28,1,1
721176804145278000,featuring mixed and by of,"East Orange, NJ",40.75297355,-74.22781164,16/4/2016,3:22,2,3
721065358979768000,feeding into my narcissism this fine spring day vineland new jersey,"Vineland, NJ",39.4804,-75.014,15/4/2016,19:59,0,1
720711991594246000,feeding turtle back zoo,"West Orange, NJ",40.76785343,-74.28099636,14/4/2016,20:35,2,1
720659765047779000,feel like a new fuccin man camden new jersey,"Camden, NJ",39.9372,-75.1062,14/4/2016,17:07,3,1
721027373307719000,feel me lmao the man doesnt know what to do at home,"Turnersville, NJ",39.7352093,-75.0701544,15/4/2016,17:28,0,1
720715429388361000,feeling good newark new jersey,"Newark, NJ",40.7352,-74.1849,14/4/2016,20:48,0,1
721133279764746000,feeling you need a tonight well stop by we are making those,"Union Beach, NJ",40.44218,-74.1651,16/4/2016,0:29,4,0
721140824529100000,feels good to be back home bayville waterfront,"Berkeley, NJ",39.909122,-74.136346,16/4/2016,0:59,3,1
720706088480423000,felt awesome to shut down george street in new brunswick while taking back the night alongside_,"New Brunswick, NJ",40.4961366,-74.44060433,14/4/2016,20:11,0,0
721097084305338000,felt like a coach today i forgot how much ive missed this__,"Cranford, NJ",40.66798,-74.31815,15/4/2016,22:05,3,0
721150732905394000,fersoh hunting for wally westwood new jersey,"Westwood, NJ",40.9885,-74.0307,16/4/2016,1:38,2,1
721093191898939000,final boys lax middle twp,"Erma, NJ",38.98255693,-74.90390969,15/4/2016,21:49,2,3
720770008788398000,final cut hyatt house,"Parsippany, NJ",40.83725471,-74.44270984,15/4/2016,0:25,0,1
720963244555247000,final day of there is still room call now to sign up ages_,"Glen Rock, NJ",40.9700246,-74.1257897,15/4/2016,13:13,1,0
721120123122225000,final dress is about to start two river theater,"Red Bank, NJ",40.34979915,-74.07503555,15/4/2016,23:36,1,1
720834820675280000,fine by me ive been playing pretty well these past couple days in top,"Egg Harbor City, NJ",39.5306074,-74.65175071,15/4/2016,4:43,0,1
721132972242444000,finished work at bayonne family community center,"Bayonne, NJ",40.65794,-74.1142,16/4/2016,0:27,0,0
721132453532868000,finished work at bayonne ymca,"Bayonne, NJ",40.66153,-74.1155,16/4/2016,0:25,0,0
720660309824774000,fire service technician alarm systems cintas corporation EMO_NEG nj,"Ledgewood, NJ",40.883677,-74.657272,14/4/2016,17:09,3,0
720613358165172000,firestone walker luponic distortion now available on tap,"Berlin, NJ",39.7890278,-74.91157,14/4/2016,14:03,1,1
720770872366252000,firestone walker sucaba now available in bottles,"Linden, NJ",40.6219203,-74.2474855,15/4/2016,0:29,1,1
721024486846255000,first aid safety service manager cintas corporation EMO_NEG nj,"Ledgewood, NJ",40.883677,-74.657272,15/4/2016,17:16,4,0
721020307755163000,first continent is hiring chemical sales in glen rock apply today,"Glen Rock, NJ",40.960638,-74.123216,15/4/2016,17:00,1,0
721274689046372000,first daybreak drive home of the season,"Weehawken, NJ",40.76533022,-74.02321093,16/4/2016,9:51,5,0
721160654804152000,first of many prahm pics woodlake country club,"Lakewood, NJ",40.09022721,-74.17107296,16/4/2016,2:17,0,1
721132124397506000,first of many prahm pics woodlake country club,"Lakewood, NJ",40.09022721,-74.17107296,16/4/2016,0:24,0,1
721097208641298000,first of many prahm pics woodlake country club,"Lakewood, NJ",40.09022721,-74.17107296,15/4/2016,22:05,0,1
720709548009512000,first our soccer ball got stuck up there then the football got stuck from trying to hit the_,"New Brunswick, NJ",40.50319371,-74.45245113,14/4/2016,20:25,0,0
721237180975173000,first person to comment with the right answer gets a comped bungalow at the camden beach club in_,"Camden, NJ",39.9372,-75.1062,16/4/2016,7:21,0,0
721020788304965000,fishy fishy stamna restaurant,"Bloomfield, NJ",40.8277442,-74.1870873,15/4/2016,17:02,0,1
721005256847572000,flemington depa is hiring full time floor in flemington apply today,"Klinesville, NJ",40.518392,-74.868072,15/4/2016,16:00,1,0
720939493067530000,fly away from to on newark liberty international airport,"Newark, NJ",40.6925,-74.16861111,15/4/2016,11:39,3,1
721120664959258000,flying back to prague its been an insane week at and in our nyc office and with,"Newark, NJ",40.68968494,-74.17938709,15/4/2016,23:38,1,0
721317066486079000,flying the union jack too beautiful victorian homes everywhere glad they preserved them the_,"Cape May, NJ",38.93171,-74.92075,16/4/2016,12:39,0,1
721128033978068000,foods time red robin gourmet burgers in rockaway nj,"Dover, NJ",40.90686387,-74.5527935,16/4/2016,0:08,0,2
721128877410689000,for sale sunset drive bedroom full bath half bath offered for_,"Stone Harbor, NJ",39.0507,-74.7609,16/4/2016,0:11,2,0
721138318373588000,for shark river hills new jersey,"Shark River Hills, NJ",40.1949,-74.0483,16/4/2016,0:49,5,1
720836321007144000,for sure,"Egg Harbor City, NJ",39.53061686,-74.65177562,15/4/2016,4:49,0,1
721072048588595000,for the defense of the galaxy,"Jersey City, NJ",40.7114,-74.0647,15/4/2016,20:25,5,1
721026941873094000,for the fan level up entertainment,"Pleasantville, NJ",39.39160966,-74.55861501,15/4/2016,17:26,3,1
720754558415151000,for those who do not know this man he is budge huskey the president ceo of coldwell banker_,"Morristown, NJ",40.79999337,-74.48094226,14/4/2016,23:24,0,0
720688274386337000,for you glad you cleared the air with trump he might be our next president we can only hope,"Middletown, NJ",40.37215976,-74.10617966,14/4/2016,19:00,0,1
720963539477884000,fords new jersey,"Fords, NJ",40.5371,-74.314,15/4/2016,13:14,1,1
721182685654355000,formal readyliving life to the fullest,"Harrison, NJ",40.74637711,-74.16501016,16/4/2016,3:45,1,0
721123257865216000,formal with my whole crystal plaza,"Livingston, NJ",40.7897873,-74.3364716,15/4/2016,23:49,0,1
721138006199898000,formal__ ocean place resort spa,"Long Branch, NJ",40.30457,-73.97933,16/4/2016,0:47,0,1
720565726147407000,fort lee new jersey,"Fort Lee, NJ",40.85064,-73.971007,14/4/2016,10:53,2,1
721164120884649000,found a cute little dungeon today with my favorite bean verona_,"Verona, NJ",40.82650275,-74.24700965,16/4/2016,2:31,0,1
721005255706734000,fox and hound t is hiring pre in lebanon apply today,"Lebanon, NJ",40.643468,-74.81999,15/4/2016,16:00,1,0
721121997275734000,frats are for girls too hanover marriott,"Cedar Knolls, NJ",40.8361092,-74.4491425,15/4/2016,23:44,0,1
721045849200070000,fred wilma truly flintstones bills,"Pitman, NJ",39.73255913,-75.12810588,15/4/2016,18:41,0,1
720736461499285000,free coffee day at in woodbridge nj,"Fords, NJ",40.53617397,-74.29738062,14/4/2016,22:12,0,1
721023840529354000,free samples meet ivan cabrera nutrition zone,"Rockaway, NJ",40.88845,-74.52534,15/4/2016,17:14,0,1
721278596828962000,fresenius medical care inpatient services rn perdiem perth amboy nj,"Perth Amboy, NJ",40.5067723,-74.2654234,16/4/2016,10:06,5,0
721018913945825000,fresenius medical care inpatient services rn perdiem perth amboy nj,"Perth Amboy, NJ",40.5067723,-74.2654234,15/4/2016,16:54,5,0
720630651892817000,fresenius medical care phlebotomistfloat nj,"Paramus, NJ",40.9445428,-74.0754189,14/4/2016,15:11,7,0
721172989576921000,friday cranford hotel restaurant and pub,"Cranford, NJ",40.6550867,-74.3046698,16/4/2016,3:06,0,1
721171457607405000,friday mood,"Summit, NJ",40.72168912,-74.33769325,16/4/2016,3:00,3,1
721282944065646000,friday night,"Glassboro, NJ",39.7107551,-75.1153297,16/4/2016,10:23,0,1
721119976745250000,friday night bbq surf bbq in rumson nj,"Rumson, NJ",40.3723918,-73.99955679,15/4/2016,23:36,1,1
721139431395225000,friday night bowl stelton lanes,"Piscataway, NJ",40.53333,-74.41932,16/4/2016,0:53,3,1
721115733673947000,friday night family and tomato pie holy tomato too,"Mullica Hill, NJ",39.73888641,-75.22481456,15/4/2016,23:19,0,1
721134729630785000,friday night laxs justice getting after it,"Springdale, NJ",39.86726814,-74.95808899,16/4/2016,0:34,4,1
721006644616896000,friday night magic,"Fords, NJ",40.5280531,-74.3059431,15/4/2016,16:05,4,0
721166076738998000,friday night red buddha lounge,"Lyndhurst, NJ",40.80317394,-74.12272471,16/4/2016,2:39,0,1
721163141141368000,friday prayers islamic circle of mercer county,"Lawrence, NJ",40.27248,-74.68387,16/4/2016,2:27,0,1
720914731872038000,friday schedule,"Oakhurst, NJ",40.25309524,-74.04060367,15/4/2016,10:00,0,0
720910221900689000,friday spin super fitness logan in logan township nj,"Beckett, NJ",39.76263058,-75.35312176,15/4/2016,9:42,0,1
721124353723731000,fridays mikie squared tgif start your weekend off right introducing craft beers they are_,"Hoboken, NJ",40.7440491,-74.029213,15/4/2016,23:53,0,1
720658943060520000,frontend the creative group EMO_NEG nj,"Saddle Brook, NJ",40.9040085,-74.1007318,14/4/2016,17:04,6,0
721183849389002000,fuck a caption lodi new jersey,"Lodi, NJ",40.877915,-74.0825,16/4/2016,3:50,0,1
721151831720730000,fuck tyler johnson,"Princeton Junction, NJ",40.30139652,-74.57864799,16/4/2016,1:42,0,0
721121605938614000,full my cup lets go,"East Orange, NJ",40.75297355,-74.22781164,15/4/2016,23:42,2,2
721002158758498000,full service EMO_POS dont get cut by the rest get cut by the best,"Jersey City, NJ",40.71245,-74.08353,15/4/2016,15:48,2,0
720555977884483000,furthest thing from perfect like everyone i know newark liberty_,"Newark, NJ",40.6925,-74.16861111,14/4/2016,10:15,0,1
