721123756165435000,so over all this,"Mercerville, NJ",40.2230783,-74.7236183,15/4/2016,23:51,0,0
721164347989487000,so pumped at the show your the man borgata hotel casino spa,"Atlantic City, NJ",39.37804328,-74.43471001,16/4/2016,2:32,0,3
721166550892474000,so sleepy wheres my come wawa food market in mount laurel nj,"Moorestown, NJ",39.96693653,-74.920195,16/4/2016,2:41,1,1
721151753572454000,so tasty drinking a whango by glendora nj,"Glendora, NJ",39.8397,-75.0739,16/4/2016,1:42,1,2
721136729634111000,so tell me why is wrong with the tip suggestion here the cheesecake factory,"Wayne, NJ",40.888915,-74.258492,16/4/2016,0:42,0,1
720834594006704000,so that coffee i had hours ago yeah great idea,"Egg Harbor City, NJ",39.53065408,-74.65179909,15/4/2016,4:42,0,0
721288965588979000,so this happened thanks to andy kubert for stopping by and thanks to for_,"Montclair, NJ",40.813655,-74.217597,16/4/2016,10:47,0,1
720707441567076000,so this happened today overpeck park,"Leonia, NJ",40.86740971,-73.99379934,14/4/2016,20:16,0,1
720754148115935000,so you might hate me for this but idc lol happy birthdayy to_,"Seaside Heights, NJ",39.93890109,-74.07422996,14/4/2016,23:22,0,0
721092081121243000,so yummy menya sandaime,"Fort Lee, NJ",40.849857,-73.967847,15/4/2016,21:45,1,1
720662857390534000,social worker msw per diem deborah EMO_NEG nj,"Browns Mills, NJ",39.9726147,-74.5829331,14/4/2016,17:19,4,0
720770113092337000,sold,"Belleville, NJ",40.8026972,-74.1461803,15/4/2016,0:26,9,0
721133757600833000,soleil george washington bridge,"Fort Lee, NJ",40.8529434,-73.9669189,16/4/2016,0:31,0,1
721278440339611000,solid belgian with lots of different nuggets of flavor drinking a monks blood driving,"Cinnaminson, NJ",39.9949,-74.9758,16/4/2016,10:05,0,1
721095534291873000,some belt less pulling crazy thing is i still feel so much faster and more comfortable_,"Wayne, NJ",40.8908005,-74.2501526,15/4/2016,21:59,0,0
720663287407489000,some cheesesteak on a thursday tjs pizza,"Asbury Park, NJ",40.21969,-74.01207,14/4/2016,17:21,0,1
720611423018217000,some classes have been cancelled at both due to,"Newark, NJ",40.74112435,-74.17349185,14/4/2016,13:55,1,3
720650113920692000,some drivers going for a test drive on,"Lawrence, NJ",40.27903278,-74.73549634,14/4/2016,16:29,1,0
721094496382033000,some highkey pals rowan university,"Glassboro, NJ",39.70986376,-75.11927102,15/4/2016,21:54,0,1
721173099253616000,some kid who asked me to take a picture prom woodlake country club,"Lakewood, NJ",40.09022721,-74.17107296,16/4/2016,3:07,0,2
721174604765507000,some much need relief metuchen new jersey,"Metuchen, NJ",40.542445,-74.362767,16/4/2016,3:13,2,1
721119061434769000,some of our dancers practicing our emotional alzheimers foundation benefit routine today in_,"Wall, NJ",40.1344299,-74.0619888,15/4/2016,23:32,0,0
721140042945527000,some people seem to get all sunshine and some all_,"Bay Head, NJ",40.070315,-74.048162,16/4/2016,0:55,1,0
721005552885710000,some save the dates for my good friends at calvary baptist church in morristown nj_,"Lumberton, NJ",39.98116,-74.7989,15/4/2016,16:01,0,0
721124200509902000,someone likes whipped cream chimney rock inn,"Gillette, NJ",40.6791399,-74.4542699,15/4/2016,23:53,1,1
720829475953377000,something about having surgery in the morning makes you want to hug everyone who retweeted your tweets i love you guys,"East Freehold, NJ",40.2727166,-74.2297424,15/4/2016,4:21,1,1
720706096680345000,something something istanbul,"Cedarwood Park, NJ",40.0277873,-74.13830087,14/4/2016,20:11,1,0
721065259256168000,sometimes its necessary to take a few extra minutes on the walk home to remind myself where i_,"Fort Lee, NJ",40.8529434,-73.9669189,15/4/2016,19:58,0,0
721156210368458000,son cubano,"West New York, NJ",40.78133282,-74.00543242,16/4/2016,2:00,0,1
721091017429094000,sonic drivein carhop server nj,"Elizabeth, NJ",40.6718761,-74.2000805,15/4/2016,21:41,7,0
721047978128093000,sonny and fox looking fit and happy prepping for rolex,"Peapack and Gladstone, NJ",40.69762,-74.653013,15/4/2016,18:50,3,0
721066765824884000,soo much tammy davis_,"Bellmawr, NJ",39.867,-75.0916,15/4/2016,20:04,5,1
721160680762544000,sothe resturant has an article in the starledger and my beet salad is in the feature photo_,"Millburn, NJ",40.7197609,-74.3205185,16/4/2016,2:17,0,0
721299439025950000,sound healing with the quartz crystal singing bowls was incredible last night thank you michele_,"Mullica Hill, NJ",39.75547562,-75.25950473,16/4/2016,11:29,0,0
721025469882187000,sounds interesting to work here gotta decide by tomorrow posh entertainment in cranford nj,"Cranford, NJ",40.65104832,-74.29643525,15/4/2016,17:20,0,1
720829939017093000,sounds like a good idea,"Egg Harbor City, NJ",39.53050599,-74.65155314,15/4/2016,4:23,0,2
721170565982236000,southern tier live now available on tap,"Morristown, NJ",40.796657,-74.482454,16/4/2016,2:57,1,1
720714978840428000,spa day blue wave auto spa car wash in hazlet nj,"Hazlet, NJ",40.42259008,-74.18943383,14/4/2016,20:46,0,1
721093114526457000,spa hair pretty much yup this is what happens after massage if you dont get regular massages_,"Millburn, NJ",40.74276712,-74.3665674,15/4/2016,21:49,0,0
720901090468851000,special event on eb at new jersey level toll plaza,"Fort Lee, NJ",40.854645,-73.96987,15/4/2016,9:06,1,0
721091063935438000,spectacular day wayne new jersey,"Wayne, NJ",40.9421,-74.2505,15/4/2016,21:41,0,1
720837762555912000,spent my night doing this the crafts section is now neat and organized dollar tree,"Closter, NJ",40.96960424,-73.95707828,15/4/2016,4:54,0,1
720778260435611000,spicy grilled,"Paterson, NJ",40.88979,-74.15459,15/4/2016,0:58,8,1
721183428234887000,spring finally inside my apt montclair new jersey,"Montclair, NJ",40.8223,-74.212,16/4/2016,3:48,3,1
720654177635012000,spring fling luncheon american legion post in edison nj,"Edison, NJ",40.533879,-74.33791637,14/4/2016,16:45,1,1
721181902770544000,spring is here a little walk in my backyard,"Jersey City, NJ",40.7079656,-74.0356756,16/4/2016,3:42,1,0
720713448036835000,spring is here shot an ar today go and cape may new jersey,"Cape May, NJ",38.940782,-74.903198,14/4/2016,20:40,2,3
721092396918956000,springtime__ bohn hall,"Little Falls, NJ",40.8635479,-74.19476361,15/4/2016,21:46,0,1
721183510996758000,squad goals cuban petes restaurant tapas,"Montclair, NJ",40.8131608,-74.2168556,16/4/2016,3:48,4,1
721140832351494000,squinty spring break smiles ocean grove new jersey,"Ocean Grove, NJ",40.21182,-74.006944,16/4/2016,0:59,0,1
721139380245676000,srry for this basic pose but were all feelin extra proud to be a part of sigma kappa today_,"Ewing, NJ",40.26831462,-74.77903068,16/4/2016,0:53,0,0
720912746779394000,star_motorcycles,"East Rutherford, NJ",40.8150951,-74.0747794,15/4/2016,9:52,6,0
720998653943349000,starbucks barista us,"New Brunswick, NJ",40.4962347,-74.4439853,15/4/2016,15:34,6,0
721002300634836000,starbucks barista us nassau street nj,"Princeton, NJ",40.3500023,-74.6595213,15/4/2016,15:48,7,0
720649909326782000,starbucks in somerville nj,"Somerville, NJ",40.56925581,-74.61597584,14/4/2016,16:28,1,1
720633322074812000,starbucks shift supervisor us state route nj,"Wayne, NJ",40.8899547,-74.2507059,14/4/2016,15:22,6,0
720655701509431000,start a family tradition with a oneofakind keepsake from proof of your family_,"Red Bank, NJ",40.351237,-74.065553,14/4/2016,16:51,1,0
721002123366768000,starting today i will be dropping remixs original music every_,"Newark, NJ",40.6925,-74.16861111,15/4/2016,15:47,0,0
720737453406031000,status saks,"Millburn, NJ",40.74025254,-74.36242537,14/4/2016,22:16,6,1
721181250422120000,stefbref collingswood new jersey,"Collingswood, NJ",39.915275,-75.078392,16/4/2016,3:39,0,1
721123530168000000,stephanie kris rehearsal dinner la sicilia in belleville nj,"Belleville, NJ",40.78638437,-74.15327157,15/4/2016,23:50,0,1
720959338924285000,sterling jewelers sales associate nj,"Burlington, NJ",40.0778317,-74.8181485,15/4/2016,12:57,6,0
721169056041209000,stl didnt deserve this i hope they destroy the blackhawks in chicago,"Princeton Junction, NJ",40.30131018,-74.57875303,16/4/2016,2:51,0,0
720684432454238000,stopover in newark newark liberty international airport ewr in newark nj,"Newark, NJ",40.68968494,-74.17938709,14/4/2016,18:45,0,1
721064813611261000,store director madewell bridgewater commons madewell EMO_NEG nj,"Bridgewater, NJ",40.5971482,-74.6283316,15/4/2016,19:57,6,0
721012110805700000,store manager genuine parts napa EMO_NEG nj,"Pennsauken, NJ",39.9671069,-75.0319086,15/4/2016,16:27,6,0
721152902811660000,store manager the vitamin shoppe EMO_NEG nj,"Toms River, NJ",39.9817037,-74.1831528,16/4/2016,1:47,5,0
721317233654255000,store manager whbm EMO_NEG nj,"Edison, NJ",40.5230137,-74.3411515,16/4/2016,12:40,5,0
721004097235607000,store seasonal employee lumber lowes stores EMO_NEG nj,"Bayonne, NJ",40.6687141,-74.1143091,15/4/2016,15:55,5,0
721098767227686000,store supervisor franklin beekman td bank us EMO_NEG nj,"Franklin Park, NJ",40.4334602,-74.5480697,15/4/2016,22:11,4,0
721317300608110000,strawberry banana smoothie with pineapple juice as the base so good,"Camden, NJ",39.933107,-75.10479,16/4/2016,12:40,0,0
721027711058087000,strawberry mousse cake for my tinies secaucus new jersey,"Secaucus, NJ",40.781958,-74.067649,15/4/2016,17:29,3,1
721023677890822000,street beach barnegat light long beach island,"Barnegat Light, NJ",39.74283658,-74.11127873,15/4/2016,17:13,3,1
720770702815674000,street jazz,"Jackson, NJ",40.1120644,-74.3528137,15/4/2016,0:28,4,0
721160306345525000,string session with the pink haired pregnant lady new jersery,"Newark, NJ",40.77210392,-74.16462809,16/4/2016,2:16,0,1
721120854352891000,strong balance game city of jersey city,"Jersey City, NJ",40.72672606,-74.07325984,15/4/2016,23:39,0,1
721137731049357000,successful arm day with the sqaud,"Paramus, NJ",40.93575035,-74.06911524,16/4/2016,0:46,2,3
721072878939152000,such a beautiful day in princeton new jersey,"Princeton, NJ",40.3522,-74.6571,15/4/2016,20:29,1,1
720854046412648000,such a beautiful view with beautiful people hamilton park weehawken new jersey,"Weehawken, NJ",40.7715334,-74.0161137,15/4/2016,5:59,0,1
721317919016296000,such gorgeous clam by slay girls__,"Sayreville, NJ",40.47378603,-74.34225468,16/4/2016,12:42,0,2
721143031752167000,sucks if that is your bag sitting on the tarmac newark liberty international airport,"Newark, NJ",40.6925,-74.16861111,16/4/2016,1:07,1,1
721147804249272000,sudden noises frighten me even ones that i make,"Little Falls, NJ",40.87326885,-74.20372221,16/4/2016,1:26,4,0
720960367476670000,summer intern program supply chain the linde group EMO_NEG nj,"New Providence, NJ",40.6951408,-74.4012651,15/4/2016,13:02,4,0
721255495231610000,summer office associate avalonbay EMO_NEG wood,"Ridgewood, NJ",40.9792645,-74.1165313,16/4/2016,8:34,5,0
721001901857366000,summer toes all ready for music in atlantic city new jersey,"Atlantic City, NJ",39.365,-74.439,15/4/2016,15:47,2,1
721298098106990000,sunrise senior living maintenance assistant nj,"Morris Plains, NJ",40.8395922,-74.4818698,16/4/2016,11:24,5,0
721065181673955000,sunrise systems inc project manager ii nj,"Trenton, NJ",40.22,-74.74,15/4/2016,19:58,7,0
721162365224390000,supplemental health care physical therapist nj,"West Freehold, NJ",40.2136754,-74.3000878,16/4/2016,2:24,5,0
720779002571395000,supplemental health care physical therapist nj,"West Freehold, NJ",40.2136754,-74.3000878,15/4/2016,1:01,5,0
721091795925336000,supplemental health care travel registered nurse nj,"Summit, NJ",40.7146376,-74.3646122,15/4/2016,21:44,6,0
721154886964879000,support my guy april at soho night club everything starts from now album_,"Fort Lee, NJ",40.8521996,-73.9698486,16/4/2016,1:54,0,1
720776530213752000,surf city lbi,"Surf City, NJ",39.66541652,-74.16285921,15/4/2016,0:51,0,1
721001507789914000,surviving bubbles,"Oakhurst, NJ",40.2547632,-74.0400055,15/4/2016,15:45,0,0
721020048261951000,sushi ichiban sushi in nj,"Ledgewood, NJ",40.87889791,-74.64489516,15/4/2016,16:59,0,1
721099176218652000,sushi time imperial in west paterson nj,"Woodland Park, NJ",40.88493517,-74.21105119,15/4/2016,22:13,0,1
720998424246620000,suzanne somers gets her hair done at the david mycheals salon,"Fords, NJ",40.5371,-74.314,15/4/2016,15:33,1,0
720738681896771000,swingathon morning class getting in part of our finisher today kettlebell swings are a_,"Berlin, NJ",39.7932011,-74.9071173,14/4/2016,22:21,0,0
720998601229512000,swingin into spring roxbury high school turf field,"Succasunna, NJ",40.85996282,-74.64117732,15/4/2016,15:33,0,1
721144905507037000,szn sushi lounge totowa,"Totowa, NJ",40.89422581,-74.22837633,16/4/2016,1:15,0,1
721010377681715000,tabletop day april,"Fords, NJ",40.5280531,-74.3059431,15/4/2016,16:20,4,0
721157649451118000,take a break from life and explore new towns verona lake,"Verona, NJ",40.82650275,-74.24700965,16/4/2016,2:05,0,1
720769961678016000,take advantage of this great offer._,"Ewing, NJ",40.250478,-74.778267,15/4/2016,0:25,0,0
721134338482384000,take kwon do belt test tonight jumping front kick for board break forms and kick_,"Hasbrouck Heights, NJ",40.8626685,-74.0776761,16/4/2016,0:33,0,0
721173723580006000,taken by my one and only happy year anniversary red_,"Secaucus, NJ",40.78959247,-74.04498043,16/4/2016,3:09,0,2
720809892290916000,taking the dave chappelle skit to the next level,"Barnegat, NJ",39.7404798,-74.2448037,15/4/2016,3:04,0,1
721047131738476000,taking the dogs for a little walk mount holly new jersey,"Mount Holly, NJ",39.9928,-74.7881,15/4/2016,18:46,0,1
721148237223215000,talent is everywhere world of beer,"New Brunswick, NJ",40.49404,-74.443352,16/4/2016,1:28,4,1
721007634615287000,talk of the towne in penns grove nj,"Carneys Point, NJ",39.73518312,-75.45919776,15/4/2016,16:09,3,1
720658235812945000,talking shit gone get you hit boy dont get wet up its a set up babyy__,"Hamilton Square, NJ",40.2231575,-74.6460816,14/4/2016,17:01,0,0
721236344576557000,tall glass of merlot__ almonesson new jersey,"Deptford, NJ",39.8189,-75.0989,16/4/2016,7:18,0,1
721013776435154000,tam outside ca oracle EMO_NEG nj,"Trenton, NJ",40.2170534,-74.7429384,15/4/2016,16:34,6,0
721072000698028000,tan your can at coco bond starting tuesday april call to reserve your_,"Shrewsbury, NJ",40.3257484,-74.0607071,15/4/2016,20:25,0,0
720557153002500000,tandem weekend register now east_,"Vineland, NJ",39.46996172,-75.04478764,14/4/2016,10:19,2,0
720732960555692000,tarde juntos wayne new jersey,"Wayne, NJ",40.9421,-74.2505,14/4/2016,21:58,0,1
721098771623448000,taste just like a lasagna and looks nice lasagna al santillos brick oven pizza,"Elizabeth, NJ",40.64897237,-74.21648924,15/4/2016,22:11,0,1
721094576086368000,tatlatmoe,"Ramsey, NJ",41.0616,-74.12476,15/4/2016,21:55,2,4
721158567785586000,tavares is actually clutch,"Princeton Junction, NJ",40.30139489,-74.57870004,16/4/2016,2:09,0,0
721024462468943000,taylor by david todd mccarty for salt magazine,"Cape May Point, NJ",38.936909,-74.965374,15/4/2016,17:16,4,0
721067997071306000,tbt to grade rowan university,"Glassboro, NJ",39.70986376,-75.11927102,15/4/2016,20:09,1,1
720707147672068000,td bank ballpark,"Finderne, NJ",40.56107087,-74.55354854,14/4/2016,20:15,3,1
720956437715767000,td bank us credit portfolio manager nj,"Turnersville, NJ",39.789513,-75.088026,15/4/2016,12:46,6,0
720614036358844000,td bank us seasonal teller i nj,"Greenwich, NJ",40.6773024,-75.1406768,14/4/2016,14:05,6,0
720591445837545000,td bank us seasonal teller i nj,"Freehold, NJ",40.2453713,-74.2820588,14/4/2016,12:36,6,0
721145213318754000,te esperamos passaic new jersey,"Passaic, NJ",40.856413,-74.12694,16/4/2016,1:16,2,1
721116667317649000,team member nj,"East Brunswick, NJ",40.4303776,-74.3856283,15/4/2016,23:23,4,0
720936593368813000,techobloc patio installation,"Colonia, NJ",40.5914,-74.3143,15/4/2016,11:27,6,0
721174110735310000,tell me that look like her it will make my day liberty state park,"Jersey City, NJ",40.7079656,-74.0356756,16/4/2016,3:11,0,1
720869799094394000,tengo a mis menores asiendo miles atlantic city expressway,"McKee City, NJ",39.44979,-74.63905,15/4/2016,7:02,2,1
720885166210707000,tenhamos um bom dia somewhere over the rainbow,"Pine Lake Park, NJ",40.00698,-74.26573,15/4/2016,8:03,0,1
721169911444320000,tfw,"Morristown, NJ",40.7972057,-74.4721011,16/4/2016,2:54,0,0
721146563029045000,tfw,"Whippany, NJ",40.8140161,-74.3992019,16/4/2016,1:21,0,1
720586359006752000,than after work headed to_,"Paterson, NJ",40.9155,-74.1629,14/4/2016,12:15,2,0
721242776852164000,thank you everybody that came out to we back next_,"Elizabeth, NJ",40.66263,-74.21499,16/4/2016,7:44,0,1
721248384024059000,thank you for a great night my old bridge new jersey,"Old Bridge, NJ",40.3977,-74.3343,16/4/2016,8:06,3,1
720656839839518000,thank you for being one of my little rays of sunshine in this cloudy day called life forever_,"West Long Branch, NJ",40.28294,-74.00436,14/4/2016,16:55,0,0
721161237468459000,thank you for our thank yous at,"Toms River, NJ",39.953236,-74.196744,16/4/2016,2:20,4,1
721168590263623000,thank you for the most scrumptious meal wildwoods nj,"Wildwood, NJ",38.98921084,-74.81124421,16/4/2016,2:49,0,1
721067451446861000,thank you john anderson and three volunteers in putting our lawn guitar back together._,"Barclay, NJ",39.9035666,-74.9693332,15/4/2016,20:07,0,0
721001229254569000,thankful for dollar beers and am dino nuggets rho,"Trenton, NJ",40.2069422,-74.76502066,15/4/2016,15:44,0,1
721010934588796000,thanks for taking us in last night sunrise bay,"Absecon, NJ",39.48163478,-74.50816073,15/4/2016,16:22,0,1
720962194192502000,thanks for the motivation flaniganfinancial nothing beats an workout with,"Teaneck, NJ",40.888315,-74.021019,15/4/2016,13:09,0,1
721207279899377000,thanks for the retweet,"East Freehold, NJ",40.2728569,-74.230182,16/4/2016,5:23,0,1
721003554958393000,thanks for the surprise treat at work why does_,"Piscataway, NJ",40.52354994,-74.44056381,15/4/2016,15:53,0,0
721132764049747000,thanks for tolerating my shit everyday in class and always sending me links to scripts happy_,"Hazlet, NJ",40.424323,-74.152997,16/4/2016,0:27,0,0
721146720378347000,thanks markmeismer and for a fun first ft brookecolletti s head EMO_POS,"Jersey City, NJ",40.7114,-74.0647,16/4/2016,1:22,0,1
721004077606445000,thanks mom and sis for helping with movers this would fucking suck otherwise hudson river_,"Edgewater, NJ",40.82456361,-73.97299044,15/4/2016,15:55,0,1
720630835733520000,thanks to veronica and william for their purchase of their also even many more_,"Newark, NJ",40.74802287,-74.16887741,14/4/2016,15:12,2,0
721146708990799000,that combo platter tho,"West Orange, NJ",40.8103155,-74.2602899,16/4/2016,1:22,7,1
721163459623149000,that face you make when i suggest apple cider vinegar is a good idea,"Belleville, NJ",40.79754962,-74.1463378,16/4/2016,2:29,2,0
720837487082344000,that is such a cock block i hate when that happens i wanna just cry sometimes,"Egg Harbor City, NJ",39.53042647,-74.65145155,15/4/2016,4:53,0,1
720608307459829000,that moment started chanting for in his last ten seconds it was_,"Little Falls, NJ",40.86082817,-74.19896016,14/4/2016,13:43,2,1
721180101279420000,that moment when the homie catches the perfect picture to capture your fly__ flight club,"Jersey City, NJ",40.7377326,-74.0539817,16/4/2016,3:35,0,1
720715057387077000,that was fun thanks again mrs stinson for inviting me to come speak to zays class about_,"Lumberton, NJ",39.98116,-74.7989,14/4/2016,20:47,0,0
721272613855719000,that was mine until i went to kooper__s tavern in fells point in baltimore the bison there is incredible,"Williamstown, NJ",39.6936907,-74.99919447,16/4/2016,9:42,0,1
721163956807708000,thats bullshit,"Princeton Junction, NJ",40.30152903,-74.57872258,16/4/2016,2:31,0,0
720836889977028000,thats exactly what i do and throw some cinnamon in it straight fire,"Egg Harbor City, NJ",39.53042647,-74.65145155,15/4/2016,4:51,0,1
720831208968486000,thats league for you one way or another you get hella salty,"Egg Harbor City, NJ",39.53056612,-74.65163698,15/4/2016,4:28,0,2
721131405288169000,thats my dad redds biergarten,"Newark, NJ",40.73478,-74.17046,16/4/2016,0:21,0,1
721206629644038000,thats why youre my fav,"Egg Harbor City, NJ",39.53035535,-74.65156489,16/4/2016,5:20,0,1
721026467065298000,the acupuncturist suggested me to try this considering i love coffee,"Ridgewood, NJ",40.973462,-74.095652,15/4/2016,17:24,2,0
721137520210231000,the apparently does not react well to the in the room at the,"Wayne, NJ",40.8908005,-74.2501526,16/4/2016,0:45,4,0
721093625468305000,the artful way the donuts are displayed at purple glaze its an interactive menu you point to_,"Asbury Park, NJ",40.21757104,-74.00962669,15/4/2016,21:51,0,0
721296545841160000,the beginning of wisdom is this get wisdom though it cost all you have get_,"Piscataway, NJ",40.5477599,-74.48281,16/4/2016,11:17,0,0
721138555628699000,the bernards inn,"Bernardsville, NJ",40.71774888,-74.57057889,16/4/2016,0:50,1,1
720962213079552000,the best cupcakes ive ever made call me betty crocker__ toms river high school north,"Toms River, NJ",39.983265,-74.19578682,15/4/2016,13:09,0,1
721141234723631000,the best ever sardinian lemon drop carmines,"Atlantic City, NJ",39.35325,-74.44522,16/4/2016,1:00,1,1
720664110799708000,the best graduation gift what a perfect time to graduate super_,"Newark, NJ",40.741388,-74.190352,14/4/2016,17:24,0,0
721020928923213000,the best muscle maker grill,"Wayne, NJ",40.959588,-74.237516,15/4/2016,17:02,1,2
721160625943142000,the best view in the world i live in the best place of the world the rest es monte y_,"North Bergen, NJ",40.8017,-73.998484,16/4/2016,2:17,0,0
721203849856307000,the big homie killed it tonight at perle_,"New Brunswick, NJ",40.49532244,-74.44380077,16/4/2016,5:09,2,3
721143951563075000,the biggest game of the season up to this point saint joseph high school_,"Metuchen, NJ",40.5515437,-74.3712867,16/4/2016,1:11,1,1
720609272879382000,the billion dollar big data question,"Jersey City, NJ",40.7201886,-74.0431856,14/4/2016,13:46,0,0
721020062220607000,the boy and the tentacle stamna restaurant,"Bloomfield, NJ",40.8277442,-74.1870873,15/4/2016,16:59,0,1
721015776862339000,the cellular connection verizon tcc sales consultant nj,"Millville, NJ",39.4020596,-75.0393438,15/4/2016,16:42,4,0
720713742917312000,the cheesecake factory busser nj,"Cherry Hill, NJ",39.9253287,-75.0339747,14/4/2016,20:42,7,0
720960706149920000,the cheesecake factory server nj,"Edison, NJ",40.5491933,-74.3357363,15/4/2016,13:03,7,0
721181828736901000,the continental in the playground pier on the,"Atlantic City, NJ",39.365,-74.439,16/4/2016,3:42,5,0
721097451495493000,the coolest people redds biergarten,"Newark, NJ",40.73478,-74.17046,15/4/2016,22:06,0,1
721096639579103000,the correct way to spend ocean city new jersey,"Ocean City, NJ",39.2654,-74.5938,15/4/2016,22:03,0,1
720998466004975000,the countdown to national pretzel day is on learn how you can celebrate with us,"East Brunswick, NJ",40.4235899,-74.38201128,15/4/2016,15:33,0,0
721012446803001000,the creative group contracthire package designer nj,"Springdale, NJ",39.8817088,-74.955948,15/4/2016,16:28,6,0
720666809297272000,the creative group graphic designer nj,"Mahwah, NJ",41.088611,-74.144167,14/4/2016,17:35,6,0
721016992614977000,the date is set for may basketball clinic ran by team endurance and my program as well._,"Plainfield, NJ",40.6175214,-74.4171787,15/4/2016,16:47,0,0
720555719506964000,the eagle has landed newark liberty international airport,"Newark, NJ",40.6925,-74.16861111,14/4/2016,10:14,1,2
720650897592725000,the famous derbyjaxon in the house come shop with us society femme,"Westwood, NJ",40.9929318,-74.0302985,14/4/2016,16:32,0,2
721124139919085000,the first cappuccino from the new machine woodbury new jersey,"Woodbury, NJ",39.837907,-75.15153,15/4/2016,23:52,0,1
721001524013481000,the gangs all here with extras in the bag mannys texas weiner,"Union, NJ",40.71724,-74.29166,15/4/2016,15:45,0,2
720664365532188000,the greeks are out today are hosting an autism awareness tabling event in the msc and_,"Union, NJ",40.67967122,-74.23372986,14/4/2016,17:25,0,1
721180838315048000,the in new brunswick nj,"New Brunswick, NJ",40.49391531,-74.44383544,16/4/2016,3:38,0,4
721046464529637000,the inside of a womb maybe we should legally require all girls women starting at menses to be impregnated,"Nutley, NJ",40.77477477,-74.13895387,15/4/2016,18:44,0,1
720589434677276000,the it team hard at work at ronald mcdonald house in always good to take some time and_,"Camden, NJ",39.942223,-75.118391,14/4/2016,12:28,1,0
720686556105846000,the kingdom beneath the sea is a realm unknown by its own inhabitants automatically ruled by a_,"Union, NJ",40.697,-74.2704,14/4/2016,18:53,0,0
721009419081904000,the lacerda team has open houses this sunday team member jesse lacerda is putting up the_,"South Plainfield, NJ",40.5807,-74.414,15/4/2016,16:16,0,0
720712881935880000,the life of dhwang80,"New Brunswick, NJ",40.4962,-74.44125,14/4/2016,20:38,7,0
720958825042325000,the linde group summer intern program supply chain nj,"New Providence, NJ",40.6951408,-74.4012651,15/4/2016,12:55,5,0
720663612872794000,the linde group summer intern program supply chain nj,"New Providence, NJ",40.6951408,-74.4012651,14/4/2016,17:22,5,0
721120334787788000,the lobby,"Elizabeth, NJ",40.677955,-74.1959498,15/4/2016,23:37,2,1
720661716036550000,the lord is my shepard queenv_thetrendsetter is back at it with_,"Elizabeth, NJ",40.6595001,-74.2145615,14/4/2016,17:15,0,0
721010039251726000,the lovely ladies and i of zeta chi rider university,"Lawrence, NJ",40.27946689,-74.73651013,15/4/2016,16:19,3,1
