720653774361075000,its back heading to for writing conference its presenting._,"Newark, NJ",40.6925,-74.16861111,14/4/2016,16:43,2,0
721139417478467000,its been a long week and i still have one more workday to go but before i finish this week_,"Marlton Lakes, NJ",39.8131,-74.8908,16/4/2016,0:53,0,0
721012165159686000,its do or die time which unit to bidding war lambertville new jersey,"Lambertville, NJ",40.368563,-74.943049,15/4/2016,16:27,0,1
720961134812073000,its friday and we all received that blessing to be able to wake up_,"Union, NJ",40.67967122,-74.23372986,15/4/2016,13:05,0,0
721143108700868000,its friday friday at more in river edge nj,"River Edge, NJ",40.912895,-74.036667,16/4/2016,1:08,0,1
721071216778305000,its friday if you survived another work week or just need to get your weekend started in_,"Newark, NJ",40.74420328,-74.16700596,15/4/2016,20:22,0,0
721158509463748000,its friday night yall come hang with me right here at the tremont lounge_,"East Orange, NJ",40.75103,-74.22687,16/4/2016,2:09,0,0
720735633015083000,its funny i remember getting off the bus everyday when i was in elementary school hoping_,"Florham Park, NJ",40.7755287,-74.43112726,14/4/2016,22:09,0,0
720981341865684000,its going to be a beautiful weekend come visit us and get some lbi gear to start off the_,"Beach Haven, NJ",39.56955,-74.2364,15/4/2016,14:25,0,0
721206656294453000,its gonna be a great street fair this sunday in millburn short hills see you there_,"Millburn, NJ",40.7337,-74.3201,16/4/2016,5:20,0,0
721131278213455000,its good to be queen burger king,"Raritan, NJ",40.57726657,-74.63275871,16/4/2016,0:21,2,1
720735555768696000,its here EMO_POS washington township high school,"Turnersville, NJ",39.741073,-75.077862,14/4/2016,22:08,0,1
721137632848293000,its lit crystal plaza,"Livingston, NJ",40.7897873,-74.3364716,16/4/2016,0:46,2,1
721120101521498000,its megans birthday here she is with rob the cheesecake factory,"Wayne, NJ",40.888915,-74.258492,15/4/2016,23:36,0,1
721176749250342000,its my birthday still rutgers university college avenue_,"New Brunswick, NJ",40.5025552,-74.4514252,16/4/2016,3:21,0,1
721164477484441000,its not many of us we just smile at each other rockaway borough,"Rockaway, NJ",40.89127254,-74.51278685,16/4/2016,2:33,0,1
721163191917682000,its only nearly and my laptop charger broke life sucks no league and no naruto,"Egg Harbor City, NJ",39.53051188,-74.65182152,16/4/2016,2:27,0,0
721163328383512000,its quite fitting that the last sunset in my was with my dog best friend in the park where_,"Hoboken, NJ",40.74935,-74.03214,16/4/2016,2:28,0,0
721008046693072000,its so were throwing it back to one of our first ever work spaces for,"Jersey City, NJ",40.7114,-74.0647,15/4/2016,16:11,1,0
721165253086732000,its that time for some murder burgers at in newark nj,"Newark, NJ",40.77255243,-74.161913,16/4/2016,2:36,1,2
721143806150733000,its time to go home now newark liberty international airport ewr in newark nj,"Newark, NJ",40.68968494,-74.17938709,16/4/2016,1:10,0,1
721207526310617000,its vivo lounge,"Newark, NJ",40.72892777,-74.15805448,16/4/2016,5:24,3,1
720560243349024000,ive experienced so many moments with my girl ariannashaghaghi but,"Wyckoff, NJ",40.9986,-74.1671,14/4/2016,10:32,1,0
721212684700688000,ive never heard mood something that bizarre,"Egg Harbor City, NJ",39.53049015,-74.65177382,16/4/2016,5:44,0,1
721003272719306000,j crew sales associate j.crew factory jersey shore crewcuts nj,"Tinton Falls, NJ",40.3042773,-74.1004185,15/4/2016,15:52,5,0
720587390486597000,j crew sales support associate j.crew factory bergen town center mens nj,"Paramus, NJ",40.9445428,-74.0754189,14/4/2016,12:19,5,0
720556255404658000,j crew sales support associate j.crew factory bergen town center mens nj,"Paramus, NJ",40.9445428,-74.0754189,14/4/2016,10:16,5,0
720736233203376000,james_martorana joint base mcguiredixlakehurst,"Lakehurst, NJ",40.02926181,-74.31441086,14/4/2016,22:11,0,2
721165340240179000,javenblake,"Newark, NJ",40.75768091,-74.19166792,16/4/2016,2:36,6,1
721002399591239000,jersey cherry hill nj in cherry hill nj,"Cherry Hill Mall, NJ",39.93481552,-75.03065586,15/4/2016,15:49,0,2
720886783949430000,joe let me hear it,"Jersey City, NJ",40.72403647,-74.06704168,15/4/2016,8:09,0,1
721147115456569000,johnson,"Bellmawr, NJ",39.8692315,-75.1089642,16/4/2016,1:24,0,1
721026920603918000,join me tonight at six oh nines installment of the new location_,"Long Branch, NJ",40.2979,-73.991,15/4/2016,17:26,1,0
720960980260298000,join the accountemps team see our latest opening here nj,"Saddle Brook, NJ",40.9040085,-74.1007318,15/4/2016,13:04,5,0
721094649603960000,join the aerotek team see our latest opening here nj,"Lakewood, NJ",40.0978929,-74.2176435,15/4/2016,21:55,4,0
721005418676289000,join the aerotek team see our latest opening here nj,"Elizabeth, NJ",40.6639916,-74.2107006,15/4/2016,16:01,4,0
720711571974918000,join the aerotek team see our latest opening here nj,"Tinton Falls, NJ",40.3042773,-74.1004185,14/4/2016,20:33,4,0
720588699650498000,join the aerotek team see our latest opening here nj,"Cherry Hill, NJ",39.926813,-75.0246312,14/4/2016,12:25,4,0
720868255808618000,join the avalonbay team see our latest opening here nj,"Princeton North, NJ",40.3572976,-74.6672226,15/4/2016,6:55,4,0
721299867381796000,join the bayada home health care team see our latest opening here nj,"Wayne, NJ",40.9253725,-74.2765441,16/4/2016,11:31,3,0
721091253413089000,join the bayada home health care team see our latest opening here nj,"Pennsville, NJ",39.6284514,-75.4984978,15/4/2016,21:42,3,0
721068459505790000,join the bayada home health care team see our latest opening here nj,"East Orange, NJ",40.767323,-74.2048677,15/4/2016,20:11,3,0
721067571114409000,join the bayada home health care team see our latest opening here nj,"Bloomfield, NJ",40.8067546,-74.1854209,15/4/2016,20:08,3,0
721002311615524000,join the bayada home health care team see our latest opening here nj,"North Plainfield, NJ",40.6301025,-74.4273743,15/4/2016,15:48,3,0
720964175384608000,join the bayada home health care team see our latest opening here nj,"Hackensack, NJ",40.8859325,-74.0434736,15/4/2016,13:17,3,0
720955844100132000,join the bayada home health care team see our latest opening here nj,"Millville, NJ",39.4020596,-75.0393438,15/4/2016,12:44,3,0
720652288449056000,join the bayada home health care team see our latest opening here nj,"Cardiff, NJ",39.3899391,-74.596021,14/4/2016,16:37,4,0
720631503487520000,join the bayada home health care team see our latest opening here nj,"Hawthorne, NJ",40.9492649,-74.1537549,14/4/2016,15:15,4,0
720589417639858000,join the cintas corporation team see our latest opening here nj,"Ledgewood, NJ",40.883677,-74.657272,14/4/2016,12:27,5,0
721095071903277000,join the cognizant team see our latest opening here nj,"Martinsville, NJ",40.6231391,-74.5990673,15/4/2016,21:57,5,0
720555672903876000,join the cognizant team see our latest opening here nj,"Berkeley Heights, NJ",40.6808726,-74.4310524,14/4/2016,10:13,4,0
721138158465785000,join the compass group usa team see our latest opening here nj,"Paramus, NJ",40.9445428,-74.0754189,16/4/2016,0:48,5,0
720735594100318000,join the cort business services corp team see our latest opening here nj,"Cinnaminson, NJ",39.9969646,-74.9927693,14/4/2016,22:08,4,0
721001749620719000,join the cvs health team see our latest opening here nj,"Newark, NJ",40.735657,-74.1723667,15/4/2016,15:46,4,0
720650777086156000,join the cvs health team see our latest opening here nj,"Bernardsville, NJ",40.7187119,-74.569324,14/4/2016,16:31,5,0
720712517228437000,join the deborah team see our latest opening here nj,"Browns Mills, NJ",39.9726147,-74.5829331,14/4/2016,20:37,3,0
720613390968709000,join the department of veterans affairs team see our latest opening here nj,"Basking Ridge, NJ",40.6853792,-74.5471009,14/4/2016,14:03,4,0
720687703369461000,join the express team see our latest opening here nj,"Wayne, NJ",40.9253725,-74.2765441,14/4/2016,18:58,5,0
720630582753951000,join the favorite health care staffing team see our latest opening here nj,"Newark, NJ",40.735657,-74.1723667,14/4/2016,15:11,4,0
720587549350035000,join the favorite health care staffing team see our latest opening here nj,"Stratford, NJ",39.8267807,-75.0154461,14/4/2016,12:20,4,0
721139841308557000,join the fiserv team see our latest opening here nj,"Parsippany, NJ",40.8652865,-74.4173877,16/4/2016,0:55,4,0
721010596318064000,join the genuine parts napa team see our latest opening here nj,"Riverside, NJ",40.0323338,-74.9573908,15/4/2016,16:21,5,0
720737728959131000,join the genuine parts napa team see our latest opening here nj,"Flemington, NJ",40.5123258,-74.8593318,14/4/2016,22:17,4,0
720653608639815000,join the helzberg diamonds team see our latest opening here nj,"Paramus, NJ",40.9445428,-74.0754189,14/4/2016,16:43,4,0
721093168532328000,join the hmshost team see our latest opening here nj,"Cranbury, NJ",40.3025907,-74.511172,15/4/2016,21:49,5,0
720659524860780000,join the interim healthcare team see our latest opening here nj,"Mercerville, NJ",40.2547923,-74.6794883,14/4/2016,17:06,5,0
721011344653164000,join the intertek team see our latest opening here nj,"Newark, NJ",40.735657,-74.1723667,15/4/2016,16:24,5,0
720890562786660000,join the j crew team see our latest opening here nj,"Tinton Falls, NJ",40.3042773,-74.1004185,15/4/2016,8:24,4,0
720631156287229000,join the jobjuncture team see our latest opening here nj,"Jersey City, NJ",40.7281575,-74.0776417,14/4/2016,15:13,4,0
720608508056436000,join the kellogg team see our latest opening here,"Chesilhurst, NJ",39.6895606,-74.8826645,14/4/2016,13:43,5,0
721118428526850000,join the kellymitchell group team see our latest opening here nj,"Woodcliff Lake, NJ",41.0234304,-74.0665297,15/4/2016,23:30,4,0
720683692696281000,join the ktp graduate team see our latest opening here nj,"Jersey City, NJ",40.7281575,-74.0776417,14/4/2016,18:42,5,0
721015972123967000,join the lexmark team see our latest opening here nj,"Park Ridge, NJ",41.0375968,-74.0406956,15/4/2016,16:42,6,0
721070627503779000,join the linde us team see our latest opening here nj,"Alpha, NJ",40.6670439,-75.1573972,15/4/2016,20:20,4,0
721172106499633000,join the loves travel stops country st team see our latest opening here,"Bordentown, NJ",40.1480827,-74.6945737,16/4/2016,3:03,1,0
720713450276519000,join the lowes stores team see our latest opening here nj,"Lumberton, NJ",39.9676482,-74.8003877,14/4/2016,20:40,4,0
720590564656218000,join the lumber team see our latest opening here nj,"Manahawkin, NJ",39.695397,-74.2587527,14/4/2016,12:32,4,0
720960624360960000,join the macys beauty team see our latest opening here nj,"Wayne, NJ",40.8903725,-74.2578342,15/4/2016,13:03,5,0
720652717291536000,join the macys retail team see our latest opening here nj,"Paramus, NJ",40.9566392,-74.0689585,14/4/2016,16:39,5,0
721010172315848000,join the marinemax team see our latest opening here nj,"Brick, NJ",40.0751159,-74.0995831,15/4/2016,16:19,5,0
721012940871049000,join the mcdonalds corporation team see our latest opening here nj,"Marlboro, NJ",40.3380949,-74.2687291,15/4/2016,16:30,4,0
720607825974525000,join the mcdonalds corporation team see our latest opening here nj,"Marlboro, NJ",40.3380949,-74.2687291,14/4/2016,13:41,4,0
721072069727784000,join the medexpress team see our latest opening here nj,"Rockaway, NJ",40.9012101,-74.5143232,15/4/2016,20:25,6,0
721116203540815000,join the nordstrom team see our latest opening here new jersey,"Millburn, NJ",40.7483499,-74.3232194,15/4/2016,23:21,3,0
720732583110119000,join the nordstrom team see our latest opening here new jersey,"Paramus, NJ",40.9445428,-74.0754189,14/4/2016,21:56,5,0
720960046440402000,join the officeteam team see our latest opening here nj,"Mount Laurel, NJ",39.934002,-74.8909988,15/4/2016,13:00,5,0
721092266228469000,join the oracle team see our latest opening here nj,"Mount Laurel, NJ",39.934002,-74.8909988,15/4/2016,21:46,5,0
721067781853057000,join the panera bread team see our latest opening here nj,"Lawrence, NJ",40.3063125,-74.6785929,15/4/2016,20:08,5,0
720958783455776000,join the panera bread team see our latest opening here nj,"Lawrence, NJ",40.3063125,-74.6785929,15/4/2016,12:55,5,0
720914970678956000,join the performance food group team see our latest opening here new jersey,"Swedesboro, NJ",39.7476136,-75.3104654,15/4/2016,10:01,3,0
721009547532341000,join the robert half finance accounting team see our latest opening here nj,"Randolph, NJ",40.8478065,-74.5747248,15/4/2016,16:17,4,0
721317527356243000,join the robert half technology team see our latest opening here nj,"Mount Laurel, NJ",39.934002,-74.8909988,16/4/2016,12:41,4,0
720650760082448000,join the speedway team see our latest opening here nj,"Perth Amboy, NJ",40.5090949,-74.2766186,14/4/2016,16:31,5,0
721011818622111000,join the sterling jewelers team see our latest opening here nj,"Echelon, NJ",39.8494917,-75.0027522,15/4/2016,16:26,5,0
720964553534611000,join the stride rite team see our latest opening here nj,"Marlton, NJ",39.8912248,-74.9218324,15/4/2016,13:18,5,0
720982307742425000,join the sunrise senior living team see our latest opening here,"Edison, NJ",40.5187154,-74.4120953,15/4/2016,14:29,3,0
720630512436424000,join the sunrise systems inc team see our latest opening here nj,"Trenton, NJ",40.22,-74.74,14/4/2016,15:11,5,0
721282991977148000,join the supplemental health care team see our latest opening here,"Hackensack, NJ",40.8859325,-74.0434736,16/4/2016,10:24,2,0
721090673504423000,join the td bank us team see our latest opening here nj,"Ramblewood, NJ",39.9236287,-74.9541999,15/4/2016,21:39,5,0
720659953837445000,join the td bank us team see our latest opening here nj,"Tenafly, NJ",40.9341955,-73.9618489,14/4/2016,17:08,5,0
720776498005737000,join the the creative group team see our latest opening here nj,"Red Bank, NJ",40.3470543,-74.0643065,15/4/2016,0:51,4,0
720631084447182000,join the the creative group team see our latest opening here nj,"Lake Hiawatha, NJ",40.8620476,-74.3939339,14/4/2016,15:13,5,0
720687344152477000,join the the job window enterprises inc team see our latest opening here nj,"Barclay, NJ",39.9021937,-74.9968543,14/4/2016,18:57,3,0
721295439937425000,join the the vitamin shoppe team see our latest opening here nj,"Watchung, NJ",40.6419216,-74.4159679,16/4/2016,11:13,4,0
720900766500651000,join the the vitamin shoppe team see our latest opening here nj,"Secaucus, NJ",40.7895453,-74.0565298,15/4/2016,9:05,4,0
720827823322103000,join the the vitamin shoppe team see our latest opening here nj,"Lawrence, NJ",40.3020452,-74.6823756,15/4/2016,4:15,4,0
720660472245059000,join the the vitamin shoppe team see our latest opening here nj,"North Bergen, NJ",40.8042674,-74.012084,14/4/2016,17:10,4,0
720654587980488000,join the the vitamin shoppe team see our latest opening here nj,"Ramblewood, NJ",39.9428265,-74.9502879,14/4/2016,16:46,5,0
720658005490950000,join the zenith education group team see our latest opening here nj,"South Plainfield, NJ",40.5559951,-74.4256947,14/4/2016,17:00,4,0
721177528535265000,join us with kon nsls mps and res life for the walk against intolerance meet at the student_,"Little Falls, NJ",40.86082817,-74.19896016,16/4/2016,3:24,0,0
721146716922257000,jokes and jokes and cut my check scottish rite auditorium in collingswood nj,"Collingswood, NJ",39.91552964,-75.08451462,16/4/2016,1:22,0,1
721298805522571000,jonathan a mase says valero is the best gas station they give you back your credit card before pumping a,"East Orange, NJ",40.74555,-74.223418,16/4/2016,11:26,0,0
721017039490543000,jules gets a view of the river and the upper west side connecting to mid town we can monitor_,"Edgewater, NJ",40.82456361,-73.97299044,15/4/2016,16:47,0,0
721125218375192000,jumping brook country club,"Neptune, NJ",40.21767179,-74.08165137,15/4/2016,23:57,0,1
721148022105759000,just a couple more important items unpacked before bed because you want quick access to a_,"Edgewater, NJ",40.82456361,-73.97299044,16/4/2016,1:27,0,0
721130569866813000,just a few regular schemegular jersey girls tryna grubwe waiting on one more_,"Madison Park, NJ",40.45337132,-74.29835545,16/4/2016,0:18,0,0
721011207436537000,just aint dealing with that i need to save my sanity,"Egg Harbor City, NJ",39.53051962,-74.6516742,15/4/2016,16:24,0,1
721142860502986000,just because is highly underrated most definitely one of my favorites sharing_,"Point Pleasant Beach, NJ",40.08441,-74.04785,16/4/2016,1:07,1,0
721133828786561000,just because the past is painful doesnt mean the future will be,"Parsippany, NJ",40.85440773,-74.42938666,16/4/2016,0:31,0,1
720687783065620000,just gave my butts a rubdown figured id share with the whole class these bad boys are gonna_,"Wyckoff, NJ",40.98523,-74.16936,14/4/2016,18:58,0,0
720631206514188000,just getting started putting out all the new stuff including some beautiful pieces of english_,"Collingswood, NJ",39.9162598,-75.0681763,14/4/2016,15:14,0,0
721160862199721000,just got back from glow fest at knollwood elementary school in piscataway nj we were working_,"Piscataway, NJ",40.538854,-74.487627,16/4/2016,2:18,0,0
720809930547179000,just got done shooting our juicy journey video with and so_,"Hackensack, NJ",40.8764915,-74.065773,15/4/2016,3:04,0,2
721022584985260000,just in,"Morristown, NJ",40.7965562,-74.4746341,15/4/2016,17:09,9,0
720666774165917000,just in time for mothers day we are announcing a special one day mommy and me minisession_,"Blackwood, NJ",39.79890275,-75.06536854,14/4/2016,17:35,0,0
720771055892172000,just kidding itd be a blast,"Jersey City, NJ",40.75080073,-74.05201579,15/4/2016,0:29,0,1
720711844734844000,just knocked out this miler after knocking out early interview now heading to date,"Weehawken, NJ",40.7657275,-74.02149181,14/4/2016,20:34,0,0
721023962566811000,just made some chicken burgers all chicken breast garlic sea salt black pepper lemon,"Wyckoff, NJ",40.98523,-74.16936,15/4/2016,17:14,0,0
721070598659665000,just picked up those tees getting ready for game tomorrow loud_,"Long Branch, NJ",40.284292,-73.986773,15/4/2016,20:20,4,1
720657226063589000,just posted a photo a simple brain injury support group organization inc,"East Brunswick, NJ",40.41785,-74.42027,14/4/2016,16:57,0,1
720655938072535000,just posted a photo a simple brain injury support group organization inc,"East Brunswick, NJ",40.41785,-74.42027,14/4/2016,16:52,0,1
721094113895018000,just posted a photo al santillos brick oven pizza,"Elizabeth, NJ",40.64897237,-74.21648924,15/4/2016,21:53,0,1
720736715950923000,just posted a photo artiste salon,"Hamden, NJ",40.59660227,-74.87327675,14/4/2016,22:13,0,1
720938034607198000,just posted a photo avenue event space,"Teaneck, NJ",40.901126,-74.00535,15/4/2016,11:33,0,1
721163187995811000,just posted a photo b52s lounge restaurant ceviche bar,"Harrison, NJ",40.7475348,-74.1607128,16/4/2016,2:27,0,1
721147669876490000,just posted a photo banana kings paterson nj,"Paterson, NJ",40.90773,-74.16253,16/4/2016,1:26,0,1
721069273972654000,just posted a photo barcode,"Elizabeth, NJ",40.6721,-74.21366,15/4/2016,20:14,0,1
720981287356534000,just posted a photo barrington new jersey,"Barrington, NJ",39.8705,-75.0526,15/4/2016,14:25,0,1
721122847012184000,just posted a photo bay head new jersey,"Bay Head, NJ",40.070315,-74.048162,15/4/2016,23:47,0,1
720738640360566000,just posted a photo bloomingdales short hills,"Millburn, NJ",40.74053524,-74.36131202,14/4/2016,22:20,0,1
721135038193123000,just posted a photo city of east orange,"East Orange, NJ",40.7653427,-74.2160187,16/4/2016,0:36,0,1
720959616037888000,just posted a photo crunch north bergen,"North Bergen, NJ",40.7737198,-74.036911,15/4/2016,12:59,0,1
720658029893578000,just posted a photo dennys,"Avenel, NJ",40.58269712,-74.29270506,14/4/2016,17:00,0,1
721135534794477000,just posted a photo elmwood park new jersey,"Elmwood Park, NJ",40.9056,-74.1199,16/4/2016,0:38,0,1
720658482429562000,just posted a photo english town raceway park,"Old Bridge, NJ",40.3326952,-74.353474,14/4/2016,17:02,0,1
721184255099834000,just posted a photo enigma hair studio llc,"Passaic, NJ",40.84667408,-74.12688013,16/4/2016,3:51,0,1
720754413556670000,just posted a photo essex county safari mini golf,"West Orange, NJ",40.76892118,-74.28474447,14/4/2016,23:23,0,1
721316892242243000,just posted a photo fratellis coal burning pizza,"Elmwood Park, NJ",40.8928299,-74.11747,16/4/2016,12:38,0,1
720708591368421000,just posted a photo garett mountain,"Woodland Park, NJ",40.89947596,-74.18114637,14/4/2016,20:21,0,1
720660802404020000,just posted a photo garrett mountain reservation,"Paterson, NJ",40.898,-74.17182,14/4/2016,17:11,0,1
720660289180540000,just posted a photo garrett mountain reservation,"Paterson, NJ",40.898,-74.17182,14/4/2016,17:09,0,1
720659527952134000,just posted a photo garrett mountain reservation,"Paterson, NJ",40.898,-74.17182,14/4/2016,17:06,0,1
721012211364200000,just posted a photo gem sports,"Fair Lawn, NJ",40.9254993,-74.1002754,15/4/2016,16:28,0,1
720654160220315000,just posted a photo glen rock new jersey,"Glen Rock, NJ",40.959471,-74.125202,14/4/2016,16:45,0,1
721129620792340000,just posted a photo gorilla bloodline,"Cardiff, NJ",39.40460553,-74.55880484,16/4/2016,0:14,0,1
721046831761727000,just posted a photo jackson liberty high school,"Whitesville, NJ",40.091645,-74.265447,15/4/2016,18:45,0,1
721152307799273000,just posted a photo lebanon new jersey,"Lebanon, NJ",40.641862,-74.833312,16/4/2016,1:44,0,1
721012508513816000,just posted a photo life house,"Newark, NJ",40.72701313,-74.15389469,15/4/2016,16:29,0,1
720557695082872000,just posted a photo little falls new jersey,"Little Falls, NJ",40.8798,-74.2284,14/4/2016,10:21,0,1
720556486922006000,just posted a photo little falls new jersey,"Little Falls, NJ",40.8798,-74.2284,14/4/2016,10:17,0,1
720663301391261000,just posted a photo orange new jersey,"Orange, NJ",40.7683,-74.236,14/4/2016,17:21,0,1
721184450894110000,just posted a photo passaic new jersey,"Passaic, NJ",40.856413,-74.12694,16/4/2016,3:52,0,1
720733033595207000,just posted a photo pro surf coaches,"Oceanport, NJ",40.3102188,-74.0296631,14/4/2016,21:58,0,1
721142172708401000,just posted a photo roanoke st,"Avenel, NJ",40.57102321,-74.28913676,16/4/2016,1:04,0,1
720659485740646000,just posted a photo rockaway new jersey,"Rockaway, NJ",40.895786,-74.517431,14/4/2016,17:06,0,1
720956318115368000,just posted a photo rutgers university college avenue campus,"New Brunswick, NJ",40.5025552,-74.4514252,15/4/2016,12:45,0,1
721289374097285000,just posted a photo saddle brook park,"Saddle Brook, NJ",40.91748679,-74.0906346,16/4/2016,10:49,0,1
720608408462880000,just posted a photo second street the back end,"Swedesboro, NJ",39.75132837,-75.30681087,14/4/2016,13:43,0,1
721093462196645000,just posted a photo shoprite of hamilton plaza,"Hamilton Square, NJ",40.226329,-74.66469,15/4/2016,21:50,0,1
721173487713394000,just posted a photo stockton university,"Pomona, NJ",39.4910583,-74.5276184,16/4/2016,3:08,0,1
720659194685308000,just posted a photo tavern on the rocks,"Rockaway, NJ",40.90138262,-74.51406856,14/4/2016,17:05,0,1
720659391729504000,just posted a photo the exchange,"Rockaway, NJ",40.89784,-74.50619,14/4/2016,17:06,0,1
721048005357498000,just posted a photo the pool after dark at harrahs resort atlantic city,"Atlantic City, NJ",39.38443785,-74.42968543,15/4/2016,18:50,0,1
721137387615555000,just posted a photo three,"Hammonton, NJ",39.63861,-74.81139,16/4/2016,0:45,0,1
721206303859847000,just posted a photo trenton new jersey,"Trenton, NJ",40.2217,-74.7561,16/4/2016,5:19,0,1
720935902093058000,just posted a photo west windsor new jersey,"Princeton Junction, NJ",40.2981,-74.6192,15/4/2016,11:24,0,1
721072736601313000,just posted a photo woolwich twp,"Woolwich, NJ",39.74571854,-75.33114965,15/4/2016,20:28,0,1
721238910131703000,just posted a video adega lounge,"Newark, NJ",40.72997943,-74.15981822,16/4/2016,7:28,0,1
720715042799427000,just posted a video borgata hotel casino spa,"Atlantic City, NJ",39.37804328,-74.43471001,14/4/2016,20:47,0,1
720660192061440000,just posted a video dennys,"Avenel, NJ",40.58269712,-74.29270506,14/4/2016,17:09,0,1
721125794752425000,just saw robert sean leonard had to google house md to remember his real name because i was so confused,"Woodcliff Lake, NJ",41.04188099,-74.0750687,15/4/2016,23:59,0,0
720776701421207000,just setting up,"Clifton, NJ",40.85791,-74.1479,15/4/2016,0:52,6,1
720778619304300000,just stay smiling and let the hate increase for they dont know any_,"East Orange, NJ",40.766,-74.2117,15/4/2016,0:59,0,0
721090949909233000,just taking advantage of this awesome weather and day off with the hubs george_,"Fort Lee, NJ",40.8529434,-73.9669189,15/4/2016,21:40,0,1
720959869403025000,just wacking the silly weeds at work man they grow fast bankbridge,"Deptford, NJ",39.81556,-75.11309,15/4/2016,13:00,0,1
721125825731567000,kane cortijo now available in growlers,"Sparta, NJ",41.0331509,-74.637079,15/4/2016,23:59,2,1
721126227537477000,kane harrow now available in growlers,"Sparta, NJ",41.0331509,-74.637079,16/4/2016,0:01,2,1
721126018870861000,kane hop lab citra pale ale now available in growlers,"Sparta, NJ",41.0331509,-74.637079,16/4/2016,0:00,2,1
721126100504547000,kane hop lab triple ipa now available in growlers,"Sparta, NJ",41.0331509,-74.637079,16/4/2016,0:00,2,1
721125742281650000,kane overhead ipa now available in growlers,"Sparta, NJ",41.0331509,-74.637079,15/4/2016,23:59,2,1
721125952433074000,kane port omna chocolate now available in growlers,"Sparta, NJ",41.0331509,-74.637079,15/4/2016,23:59,2,0
721126166590001000,kane vengeful heart now available in growlers,"Sparta, NJ",41.0331509,-74.637079,16/4/2016,0:00,2,1
