720775310531305000,siren records,8,1
720774445674196000,siren records,7,1
721014300228378000,siren records,6,1
720775679080558000,siren records,7,1
721014051720073000,siren records,6,1
721130978446569000,siren records,7,1
720633118202466000,siren_,8,1
721026621017227000,sitting here watching my favorite show,0,1
720651546569089000,size infrared aj6 now available instore and online at shop_,0,0
721128428414615000,skeletonwitch concert drinking a witte by at,0,2
721130932552339000,skip the line baby dont look back tonight we high class,0,0
720835642020614000,sky is our limit buckley recreational field,0,1
721138618656538000,slash and spread,6,0
721150316914323000,slay university of pittsburgh,0,1
721142922494799000,sleeping dallas does he need braces,3,0
720735231758585000,slow traffic in on i76 wb between vine st expwy and girard ave delay of min,2,0
720754099830927000,slow traffic in on i95 nb north of betsy ross brg to brg st accident shoulder blocked at brg st delay of min,2,0
721120412457807000,slow traffic on i95 nb between us322 and i476 delay of mins,1,0
720715118934249000,small goals small rewards postgreen,1,1
721213198947508000,small little sea shell filler piece from a walk in tonight,2,0
720776354145419000,smc is conducting our last photo shoot for the summer because i am going on maternity leave may_,0,0
720770632921849000,smells hoppier than it tastes drinking an even keel by at,0,2
721115823297970000,smile bright my dear youre a diamond and god loves you philadelphia pennsylvania,0,1
721121900974469000,smoking a romacraft formarian smoke manayunk cigar lounge,0,3
720709031040458000,snapshot along the ride east norriton pa i love this couples_,0,0
720981191168380000,snapshot along the ride montgomery county pa west,0,1
721274694846951000,sneak peaking at photos from will be posting some later_,1,0
721067657882112000,snicker_bite great jobs ladies andorra saladworks,1,2
721160992529362000,snuck down to the front row phillies game,3,2
721026338660986000,snuggle up for a midday read were down to copies in the shop open until,0,0
720960552361672000,so far this is one of our most downloaded episodes subscribe now to get and stay,0,0
721153819221049000,so i hit him in the dm like hey bighead member when i was your woman crush he said yeah,0,0
721020641915248000,so its spring lansdale pennsylvania,3,1
721171098344255000,so much for doing hw after work__ the continental midtown in philadelphia pa,0,1
721022827000918000,so thanks for everyone who has been so supportive during my college_,0,0
721161122942988000,so they surprised me with balloons and a present in my car after musical for my birthday_,0,0
721115616602689000,so this happened today wizards world of tattoos,1,1
720956513943175000,so u did all that cursing out yee then missed events talking bout how proud u was u got to_,0,0
721123864248320000,soccer practice highmark stadium,0,1
720650651219283000,soft flexing upper st clair high school panthers stadium,1,2
720630580950523000,softball with the work gang thx for pics bro0ksie shissler_,0,1
721003573870333000,software algorithm engineer faro technologies inc EMO_NEG pa,5,0
721161954023370000,solid stuff like a glass of bourbon poured over bourbon barrel aged smashed blueberry,1,0
720631245462441000,some dog from the,0,1
720775467662499000,some memories there north philadelphia,5,1
721001804767629000,some of my students at dalton_,5,1
721161202966138000,somebody wants to play,0,0
721317750799372000,somebodys ready to tailgate are beaver stadium penn state,2,2
721013877601923000,somethings wrong cause my beer is fading got a devils harvest in m devils harvest,1,0
721017079906885000,sometimes going short convinces you to go even shorter tracy gave this client an undercut with_,0,0
721140212777127000,sometimes it feels like spring drexel university,0,1
721132178604695000,sometimes tequila and nachos arent enough to kickstart your weekend so you turn to wine and_,0,0
720960851243433000,sometimes we cant see the blessings that are right in our faces we_,0,0
720658232386183000,sometimes you gotta take time out of your thursday to eat yummy stuff from food trucks with your_,0,0
721150377136164000,somewhere between psychotic and iconic stripe club,0,1
721158579827449000,son im so grateful to god and you ms tootsie soul food cafe,0,1
720865927496007000,sonic drivein cook pa,5,0
720649924245716000,sonic drivein general manager pa,7,0
721136496984657000,soo i got my second tattoo today i feel pretty good about it guerilla art tattoo company,0,1
720631435808350000,soon philadelphia pennsylvania,2,1
721177491763765000,sorority noise was pretty rad theatre of living arts,0,1
721182374625718000,south beach philly lookin niicee tonight gonna be so turnt up i cant wait i hope yall_,0,0
721143799607664000,south street bridge tonight at work,3,1
721070716930637000,special disco mix game on lock at,4,0
720630572754853000,special pie available by the slice today duck duck liver pigs blood pork pie made of_,0,0
720779111183081000,spectacled phipps conservatory and botanical gardens,0,1
721120674303979000,speechlanguage pathologist cumberland therapy services EMO_NEG pa,2,0
720732408564228000,speedway leaderretail sales pa,6,0
720961363170832000,speedway leaderretail sales pa,6,0
720982007619059000,speedway manager traineeretail sales pa,6,0
720960001443913000,speedway manager traineeretail sales pa,6,0
720565017800798000,spent me freestyle official_,0,3
721066573851705000,spent the day in margaritaville with my bff__ point park university,0,1
721065510658441000,spent this sunny afternoon working with and sipping on delicious coldpressed_,0,1
721143026584854000,spice in philadelphia pa,4,1
721137849232441000,spins in the air w the greatest of ease,1,3
721163450471292000,spontaneous tattoo today studio one tattoo,1,1
721137373829009000,spontaneous trips to pittsburgh are what we live for pittsburgh pennsylvania,0,1
721123752621314000,sports club,1,1
721129135951777000,sports club,1,1
721176086730645000,spot on this year such a delicious beer love fat heads drinking a bonehead red death star,1,1
721097149593821000,spring buttercream flowers are in bloom exactly what your weekend needs the_,0,1
720612685587591000,spring cleaning,0,0
720736676360761000,spring comes the thorn does not drop off west james st,4,1
721095715527782000,spring scallops are here house made pork sausage carrot mustard greens dill._,0,0
720706530849472000,spring time and friends personality portraits pittsburgh photographer jessica mastronie photography,0,0
720809799969968000,squaad goblinwasteoid the cheese palace,2,2
720662224709251000,ss16 philadelphia pennsylvania,0,1
721129673841905000,st stephens green,0,1
721005728274653000,st teresa a woman__s longing to preach,0,0
720586623977545000,staff physician emergency medicine department of veterans affairs EMO_NEG pa,3,0
720566959901794000,stage buddy from our last performance next show is on april at_,0,0
720963783615582000,stairs philadelphia museum of art,1,1
721135652419538000,standing ovation for ben thomas national constitution center,1,2
720960050018189000,starbucks barista us,6,0
720959040692457000,starbucks shift supervisor us,6,0
720998209061937000,starbucks shift supervisor us,6,0
720710519649218000,starbucks shift supervisor us banksville rd pa,6,0
720654038191058000,starbucks shift supervisor us grant street pa,6,0
720908501938151000,starrstatus_ent present performing his single mula,1,2
721124370077335000,starter william cuevas gives up a run in the but sox lead lehigh valley after full in allentown,1,0
720713096747032000,starting next monday it is week at calligramme we are dedicated to knowing exactly_,0,1
721140810239057000,starting off block party weekend with some of the best bloomsburg university of pennsylvania,0,1
721099463847186000,starting the weekend off with a fabulous veggie burger and a delicious sly fox pils the abbaye,0,1
721171630291034000,state college pennsylvania,1,1
721165441490690000,state college pennsylvania,4,1
720685862464462000,stay humble__ do what u do just_,2,0
721297335922270000,still drawing a pic s day,5,0
720657280283385000,still in line very cuckoo bananas right now,2,1
720714704658833000,still rockin dem headphone jawns circa northeast philadelphia,1,1
721176376418705000,still waiting on this order to ship,0,0
721134845783576000,still working law offices of thomas d kenny pc in philadelphia pa,0,1
721162073238069000,stillbigmama the fillmore philadelphia,0,2
721001766729285000,stop by rittenhouse square near the walnut entrance to see our live painting,0,0
720666465234358000,stop looking up my nose had to take a floral selfie after seeing these beautiful flowers on_,0,0
721095665904787000,stopped traffic in on i476 nb between i95 and accident left lane blocked at delay of mins,4,0
720715903147446000,stopped traffic in on vine st expwy eb between i76 and broad st accident center lane blocked at broad st delay of mins,1,0
720716226763206000,stopped traffic in on vine st expwy eb between i76 and broad st accident shoulder blocked at broad st delay of mins,1,0
720683674237214000,stopped traffic in on vine st expwy wb between and broad st accident right lane blocked at broad st delay of mins,1,0
720632692690329000,stopping by west boutiques,2,1
720610717494153000,store manager candidate dollar general corporation EMO_NEG in,6,0
720907509280612000,store manager the vitamin shoppe EMO_NEG pa,5,0
721211689442680000,strangemusicinc sold out show good job nightclub reverb,0,2
720587414146781000,stress levels on high,1,0
721169601837547000,striving toward the wisdom that only god of heaven can give hate me or love me my heart for you all stays the same,0,0
720960815302516000,structure fire in on bower hl rd both at sylvandell dr,2,0
720586548224204000,structure fire in on stotler rd north of universal rd,2,0
720633318308360000,students and community standing strong against hatred and bigotry._,2,0
721048066208505000,studying for finals like university of pittsburgh,0,1
721317923965546000,such a great pic we thought it needed to be posted twice with repostapp._,1,1
721141313429708000,such an amazing night at the ladies conference it makes me just want_,0,0
721120316236247000,such good vibes here tonight were having so much fun that its silly,2,0
720736609927360000,sullivans steakhouse king of prussia,1,1
721119348702724000,sun dont shine in the shade pittsburgh pennsylvania,0,1
721065792289316000,sun water and friends personality portraits pittsburgh senior portraits jessica mastronie photography,0,0
721097384302944000,sunny and sounds like a joe nichols track drinking an ipa hampton inn fitness center,1,1
720711905153671000,sunny days makes me think about todays haul from the carnegie_,3,1
721023875635503000,sunopta grains and foods inc qa technician pa,6,0
721206681531617000,sunrise senior living care manager cna pa,5,0
720664662400962000,suns not out guns out penn state university,1,1
720658731583741000,supplemental health care neuroscience icu registered nurse rn pa,5,0
720555003333574000,supplemental health care part time slp cc needed in pa,3,0
720658190778535000,supplemental health care registered nurse rn travel nurse pa,5,0
720591404494233000,supplemental health care speech therapist needed in lower merion pa,5,0
720981118971813000,support associate whbm EMO_NEG pa,5,0
721002110045696000,suppression installer tyco EMO_NEG pa,6,0
721072750144655000,surprise let the philly birthday weekend celebration begin thanks to cam for_,0,1
721141794847723000,sushi haven minado,3,1
720735932521926000,sweet back of the shoulder piece who wants,3,0
721010840233713000,t.g.i.f looks like the last day for sweaters too for awhile,2,0
721146729639329000,tacocat everybody hits for tacocat pujol and audacity in philadelphia pa,0,1
720707538501513000,tag a friend get healthy check out my,4,0
721095852710825000,tag her and tell her to go to the riverview my fellow south philadelphians__ the clock_,0,0
721120011507658000,tailgating food run giant food store in dickson city pa,0,1
720832174673367000,take a chance go after that job you want let yourself love live life as a daring adventure_,0,0
721026955676491000,take the devils out my life and preach the gospel benjamin_,0,1
721121782149750000,taking a break from treehousebrewco for some excellent local fare elise saison from_,0,0
720566164322193000,taking care of getting this ready for a to the_,5,0
721136675544367000,taking selfies instead of paying attention to the sport,3,0
721183286202994000,talking sex fun,3,0
721067943707025000,talking to residents and community leaders at the precinct about the sugary drink tax._,0,0
720776763807252000,tamsula,0,0
720777026756485000,tan looks good in white risky buiness,0,1
721134131581689000,tastes like a regular ale slight warming sensation after drinking quite an inte fever dream,0,0
721158907486420000,tastes like a smore no joke drinking a youre killing me smores caliente pizza hampton,0,1
721095556697886000,tastes slightly thin drinking a greenfield bridge is falling down by at,0,2
721179067169566000,tasty with rum and coffee lots of coffee bean and slight rum flavor brown beard,2,0
721173643498139000,tau delt formal round three__ the poconos,0,1
721094892793896000,tax weekend,9,0
720998286769963000,taxi starts today at showtimes at with a on rotten,0,1
720656548964536000,tbt bc i miss nighttime pirate games the beautiful city how_,0,0
720632162836488000,teaching my cousin the crane stance live and die by the fist meadville pennsylvania,1,1
721139517969727000,team member pa,4,0
720666942382678000,technical difficulties our east stroudsburg location is not open today use code whoops414 for off,1,0
720732658318188000,teen night tonight bacc the_,1,1
721020929808154000,teeth university of pittsburgh school of dental medicine in pittsburgh pa,0,1
721316765192486000,telecommunications technician the ckhobbie group EMO_NEG pa,6,0
720665900500668000,telephone financial consultant i or ii bank EMO_NEG pa,6,0
721023370956029000,temple alumni weekend started yesterday grown and sexy event saturday we at the loft barra_,0,1
721098662978457000,temple university,0,1
721123829322362000,ten rows from the stage hell yes f.m kirby center,1,1
720735419038572000,tension headache septa suburban station in philadelphia pa,1,2
720912860067573000,tgif center city philly,0,1
721090719637577000,tgif pepslovers come in for these amazing drafts for only and house wines from in_,0,0
721003153785798000,tgif temple university in philadelphia pa,0,2
720914690260537000,tgifeven tho im driving weekend see ya soon boss at darby station in darby pa,0,1
721157218318618000,thaddeus stevens_,9,1
721156738255183000,thank god for all i missed cuz it led me here to this temple university,0,1
721020349773672000,thank you dr bloom and dr bernstein for an excellent preceptorship,2,3
720607473992876000,thank you elton brand for a great career i have always been a huge fan_ since the days with the_,0,0
721131390331461000,thank you for selecting my photo i appreciate it congrats to the other winners_,0,0
721299019469819000,thank you for the preshow note it was thoughtful and amazing just like you,0,1
721164371305570000,thank you for visiting moravian archibald johnston hall moravian college,1,2
721147108808663000,thank you for your excellent service congratulations on years of business max is_,0,1
721014863947034000,thank you god for my lunch walmart greensburg,1,1
721181187503493000,thank you hannah for a very exciting and super entertaining friday EMO_POS i tanned yeah got a_,0,0
721156722325331000,thank you made my night tap room on,0,2
721140706069196000,thank you reading pa,3,2
721172244391702000,thankful for her notes because i never go to class ily__ kutztown_,0,1
721138181890908000,thanks for being my guy all these years i love you daddy,1,0
721092365247717000,thanks for getting steak two beers and as many add ons as possible_,0,0
721169806607675000,thanks for guiding me hibachi japanese steakhouse sushi bar,0,1
720771354811854000,thanks for making the run from second base easy for me again,0,1
721145837389094000,thanks for riding the bus for hours to go to formal with me,0,1
721210485757108000,thanks for showing love nightclub reverb,0,2
720964636150009000,thanks for surprising me with dinner at fogo de chao it was amazing also that cheesecake was_,0,0
720659448985948000,thanks for the monkey order tara enjoyed making this little guy for you keep up the good work_,0,0
721201657397141000,thanks for the welcome penn state university,3,1
721212563774652000,thanks gotti for chilling and spitting the real shit nightclub reverb,0,1
721176955429597000,thanks iggypopofficial excellent concert academy of music,1,2
721099271190233000,thanks jake,0,1
721132444099952000,thanks jamie nick loves it too he has kisses fo kentucky breakfast stout kbs,0,0
720609059167170000,thanks rothmanortho and thats how a post,4,1
721165553843494000,thanks so freaking much for answering my texts hun EMO_NEG,0,0
720958747418472000,thanks to the best roomie ever im so glad we got so close you are_,0,0
720809972150509000,thankyou hunny for the invite,4,2
720732134147813000,that cobb salad hit the spot,5,0
721211988521721000,that how i look like after lunch wilkesbarre pennsylvania,0,1
721201248087748000,that i am oils all,0,1
721024899557498000,that one time when my best friend jumped off a cliff on fire eric__herner1_,0,0
721120019187302000,that point in time where you cant imagine things being any more_,0,0
720954898657972000,that sounds like a good idea,0,1
721154706043748000,that was some good eats,2,0
721022712957825000,thats a wrap alburtis tavern in alburtis pa,1,1
721090857890406000,the almanac indicates that it is time for apricots welcome to apricot de brettaville,1,0
721022592304484000,the annual heroes in hours in just over a month away come join us on may27th as we_,0,0
721119650839302000,the are still the_,3,0
721001478014504000,the beautiful and warm temps make these a little less intimidating,3,0
720779107890524000,the beginning of the birthday festivities for carley cheesecake_,0,1
721316989654929000,the begins long in the tooth,4,1
721014037295669000,the bell tower at temple university,0,1
721025319776477000,the book trader,4,4
721170755740962000,the brothers ashton cigar bar,1,1
720888300265947000,the bruery terreux batch no now available in bottles,1,0
721128612397780000,the bs i need in life bff pnc park pittsburgh pirate game,0,1
721163129665642000,the candidate who gets my vote is the one who champions paid leave that will empower families,1,0
720957242460123000,the cellular connection wireless sales consultant pittston pa,5,0
721151818835877000,the closest we ever came to cuffing the coney,0,1
721095024423907000,the club at nevillewood,0,1
720738735260770000,the creative group copywriter pa,6,0
720736568013500000,the creative group graphic designer consumer experience needed pa,5,0
721090740856627000,the creative group graphic designer pharma experience in malvern pa pa,4,0
720715026974187000,the creative group prezi presentation specialist pa,6,0
721149836423249000,the crew takes,3,1
721069200584871000,the curmudgeon survives we still have a few pours left of our founders curmudgeon,0,0
720653741343522000,the days philadelphia pennsylvania,2,1
720898233065574000,the eagles schedule is out four primetime games this season,0,0
721098913655205000,the east coast in spring time,6,0
721164031164342000,the end of yet another spring season temple university,0,1
721161390359244000,the feels are real tonightafter visiting earlier i can_,1,0
721070488408223000,the fight against sexual assault begins with enforcing the idea that it does not matter what._,0,0
721139887093768000,the fillmore philadelphia,1,1
721167755102302000,the floor is sticky we need to leave,0,0
721027213064179000,the glory days missing those days gateway high school_,1,1
720738047998857000,the goat philadelphia city,0,1
720710739531534000,the gorilla was mackin pittsburgh zoo ppg aquarium,1,1
720717089690914000,the hanging out in the backyard,6,1
721144274688020000,the happiest of hours shortys bar,0,1
721023565168922000,the hard wayand some ice cream turkey hill experience,0,1
721150626281881000,the hawk will never die but cancer should__,2,1
721095874697424000,the hibiscus adds a tart bite nice drinking a respect your elderberries at,1,1
721298070655365000,the horticulture center in philadelphia pa,0,3
721012073707216000,the i got hrs to go look east petersburg pennsylvania,0,1
720960834168422000,the is widened and looks needs to be rolled though,4,0
721012485654863000,the job window enterprises inc fashion cosmetic brand marketing assistant pa,3,0
720631300453834000,the job window enterprises inc junior assistant marketing manager pa,5,0
721175331441405000,the joy formidable underground arts,2,1
721009650322313000,the joys of fatherhood me and my youngest,4,1
720778673243168000,the kimmel center for the performing arts,1,1
721165539759009000,the kimmel_,4,1
720828739634876000,the king weasel has arrived xanders bada bing cigar lounge,0,1
720959260025319000,the lancaster central market,0,1
721143332789821000,the loves of my life fit to a tee reading pa,4,1
720661178842611000,the making of the nfl schedule,2,0
721096473212030000,the malt shines up front while the hips sneak up on you mash paddle vs hipster,1,0
721160153823711000,the man is here james franco archibald johnston hall moravian college,0,2
721098056280760000,the mango is mellow throughout not overly for the astounding shemonster mango i.p.a,1,0
721068369781329000,the master at work,6,0
720736776336338000,the mighty glorifiers davis temple baptist church,0,1
721007660225572000,the most beautiful crystal chandelier the barnes foundation,0,1
721204809517412000,the most sexiest man on earth,1,1
721093134550106000,the newest employee at,7,0
721094483425697000,the nice thing about busy vacations is that i get exercise without going to a gym,0,1
721047849337794000,the nights king last night at the gameofthrones seven kingdoms launch_,0,1
721011983244488000,the orange chicken is awesome china wok in millersville pa,0,1
720567575227314000,the outgoing igc president after she spoke about change and growth._,0,0
720711171083382000,the performance group customer service representative pa,5,0
721295090426228000,the personal chef,1,1
721153779790426000,the personal chef,1,1
720713403149479000,the places we go for our clients especially on a gorgeous day like today,2,0
720733118311899000,the prince i miss you nephew you was my young o.g_,0,1
720776252475502000,the ragin cajun ft joes crab shack,4,1
721120325052669000,the result of working over hours a week the past few weeks bless my coworkers for letting_,0,0
721140809228279000,the sad face philadelphia pennsylvania,0,1
721184413040533000,the season of the bourbon south philadelphia tap room,1,1
720754038510366000,the sky also seems to be cheering for the flyers right now,0,1
721168506939711000,the smiling moose,0,1
720630523153018000,the start of the day called for a positive vibes smoothie we pick_,0,0
721294059793432000,the startline is set and walk ups are still welcome reg opens at race starts at,1,0
721046241031942000,the sun makes everything better street glide hot metal harleydavidson,1,1
721046118403076000,the tacos were good but this sweet friend was better point park university conservatory of_,0,1
721131187897393000,the tho saint thomas school,1,1
721028018592985000,the today northampton valley country club,3,1
720658832532242000,the trocadero,0,1
721005203483463000,the turn up lol discovery charter school,1,1
721132287086080000,the view from mfredcall s window at center city philly,0,1
721025257146941000,the vitamin shoppe assistant store manager pa,6,0
720657101140283000,the vitamin shoppe assistant store manager pa,6,0
720663399932104000,the vitamin shoppe store manager pa,5,0
721018711067336000,the vitamin shoppe store manager pa,6,0
720959801878941000,the vitamin shoppe store manager pa,5,0
720651978292875000,the vitamin shoppe store manager pa,6,0
721130376505241000,the weekend is off to a great start montezuma of gettysburg,1,1
721316043680063000,the world is a book and those who dont travel read only a page,0,0
720651022885130000,the yikes gang doing dining out for life yards brewing company in philadelphia pa,0,1
721097418100629000,then days after the art show im getitgallery philadelphia pennsylvania,1,1
721286833129275000,there are a billion reasons to be happy but honest to goodness real true love makes me_,0,0
721278352628326000,there is a first time for everything but at least its for a good_,0,0
720609227853688000,there is probably a funny caption about being full of hot airi think we have to let our_,0,0
720613379937665000,theres a new wawa coming to center city and theres free coffee at all locations today,0,0
720735991665946000,theres a pigeon walking around here with a serious limp and i now have a new band name for future use,0,0
720715370571677000,theres a time for everything and today it was to settle on my_,0,0
720662215628423000,thermo fisher scientific intern web developer pa,6,0
721009942048677000,these bigeyed sad kitties need a home theyre begging you im begging you take them home._,0,0
720566604510179000,these guys brighten my mondays university of_,1,1
721017305828708000,thesis defended pitt public health,2,1
721132162678988000,theta chi at the military ball indiana country club,0,1
721201694344933000,they always get bonus points,0,4
721163946959441000,they didnt show the kiera knightly video clip where she says its not over before the bottom of the ninth inningthats pretty bad,0,0
