721005373860106000,klover contracting inc drywall hangers and finishers pa,5,0
721165540606222000,know i can always count on you to always support me_,1,1
720588683947016000,kobe leaving the game the only way he knows how on top after an amazing individual performance._,0,0
720981994021253000,koto musician tamiko iida at upmc shadyside anniversary celebration upmc shadyside,0,1
721092628133974000,kristens children west chester east high school,0,1
721097705884225000,kutztown university of pennsylvania,0,1
720735664577196000,kyan on first taliq on second downingtown_,1,1
721164737900363000,la casa de melly,1,1
720707870954663000,lack of clutch hitting cole__s missteps hurt pirates in loss,3,0
720707870812020000,lack of clutch hitting cole__s missteps hurt pirates in_,2,0
721150383662505000,ladies night and im feelin alrightt west tavern,0,1
721119212794748000,lafayette vs bucknell beautiful evening for lax,1,0
720735788464414000,lancaster pennsylvania,6,1
720835017601982000,landed pittsburgh international airport pit in pittsburgh pa,0,1
720664363896414000,lane restrictions lifted in on i eb between pa412 and pa33 slow traffic back to pa412 delay of mins,2,0
720658439555260000,lane restrictions lifted on i wb between pa309 and pa100 jammed back to pa309 delay of mins,1,0
721070660282245000,languageline solutions portuguese interpreters pa,6,0
720956903921037000,languageline solutions rade interpreters pa,6,0
720940273665060000,large crowds protesting various issues tied up traffic around city hall yesterday evening,0,0
720778040066879000,last,0,0
721097925456171000,last but not least the full roster for philadelphia pennsylvania,0,1
721012256549519000,last day for depositsstop by shop todayopen until,4,0
721091980604735000,last fling lets get it university of pennsylvania,0,1
721143880989585000,last ke formal with my go to gateway clipper_,1,1
720981904590249000,last night i cried watching my lil bro take my breath away at the bynam in sonya tayehs it_,0,0
721297228078411000,last night solid ipa drinking a billy halfstack ipa dog and bull brew music house,0,1
721148368609800000,last nights dinner of maryland style crab cakes in classic rouille roasted red pepper,0,0
720715589459845000,last review for tonights class i believe home,0,1
721017528672194000,last session is about to happen,5,0
721180994913570000,last year i had the honor of originating the role of gabriella in the clos gallery of heroes_,0,0
720651790744576000,lather rinse repeat katiethekat chopshop studio,0,2
721133326094966000,latinos bien chulos rolling deep at the schreyer house EMO_POS i always_,0,0
721137325187719000,laughin u kno duquesne incline,0,1
720657335379582000,laughter is the best kind of medicine robert morris university,0,1
720608173053329000,laying down the framework of another protein i designed for my senior thesis,1,0
721153050384187000,lead cut to on and outs in the bottom of the in lehigh jorge marban on to try to nail it down,1,0
720708663296540000,learned a lot about vegan lifestyle and tasted some amazing vegan food last night thanks_,0,0
720737658293612000,learning how to prepare the good stuff ravioli class senti,3,1
720708773195739000,legit ipa citrusy nose catty hops drinking a breaking bud by at,1,2
720831233224089000,legit killed it tonight chinatown philadelphia,0,3
721018883130261000,lehigh,2,1
720958780272324000,lehigh valley center for indepen career coach pa,6,0
721316678768791000,lehigh valley health network case manager womens health pa,5,0
721003265723269000,lehigh valley health network patient services representative pa,5,0
721095661710475000,lemon chocolate chip gluten free scone made for me by my amazing husband asahsci,1,0
721025222133030000,less thinkin more drinkin drinking an english old ale dock street brewery restaurant,0,1
720734767235379000,let me get in my zone im mentally preparing myself for this weekend starting with tonight_,0,0
721183742287613000,let me rarararara rock yo body jessiegrello northhampton,0,1
721115582100189000,let the weekend begin lancaster pennsylvania,1,1
721166524770336000,lets celebrate with a toast and get lost in the night state college pennsylvania,0,1
721116223774269000,lets do this smoke manayunk cigar lounge,1,2
721116366351310000,lets get bucd up pnc park,0,1
721151087089184000,lets get it aplus at sunoco in collingdale pa,0,2
720737632607723000,lets get it at in pittsburgh pa,0,1
721094027286822000,lets go bucs drinking a landshark lager by at,2,2
721122440202567000,lets go bucs pnc club level section,0,1
720652184703135000,lets go bucs pnc park,5,1
720739073707675000,lets go erie seahawks jerry uht park,0,1
720737298858536000,lets go flyers pour house,1,1
721143161221873000,lets go phillies philadelphia phillies,0,1
721136731089547000,lets go phillies vs nats citizens bank park,1,1
721011531408916000,lets go pitt,7,1
721154066798284000,lets look at the good the parlor is fierce got rid of the dead weight additional,0,0
721130548215701000,lets talk sex toys you got questions i got,0,0
720567332192432000,lexisnexis risk automation quality engineering lead pa,5,0
720588575759151000,lexisnexis risk director vertical marketpayer pa,5,0
720609053492117000,lexisnexis risk senior business consultant pharmacy pa,5,0
720775399957929000,lexmark field service tech philadelphia pa pa,5,0
721129757820260000,lf rusney castillo lines a single to left and is with rbi thus far lead lehigh valley halfway thru this one,1,0
720754416245207000,liacouras walk,0,1
721090735756288000,licensed financial service representative allstate insurance pa,5,0
721012339990863000,life a little gift to everyone that doesnt like me uptown,0,1
720774923233284000,life is too short to live in hate,0,0
720737071623704000,light crisp refreshing drinking a golden hop ipa by mom marucas pizza shop,1,2
721210894500372000,like fuck outta here its my photo you the man thanks for showing love nightclub_,0,2
721276515812569000,like grapes,8,0
721177363497754000,like most people peripheral visions been the soundtrack to the last year of my life glad i_,0,0
720954904999636000,lil uzi,0,0
721120352454225000,listening to the colemans talk about bullshit ollies barber shop,2,1
720687898169896000,literally my favorite person on this we are thee cutest best_,0,0
720654409806516000,little red reallyy reallyy liked her donut,3,0
720754773062852000,live from washington as flyers get set for game vs capitals how they will honor ed snider on action news on_,0,0
720715434215931000,live love nailed it on stage today presenting for calling all_,1,1
721162943266713000,live nice vibes heritage,3,1
720776221886398000,living beyond affordances,0,0
720738140374306000,living cedar park in philadelphia pa,0,1
720828614820761000,living colour chameleon club,3,1
720770654874836000,lobster crepe streets on carson,0,1
721069403945701000,local art south st,0,1
721091346509901000,lock haven pennsylvania,0,1
721118469899493000,logan,5,1
721163226147229000,logan inn,4,1
720811759272136000,lol ppl that know nothing of you have an opinion about you that says more and them than you let bitter ppl be,0,0
721158764955627000,long island citizens bank park,0,1
721170845503238000,longway the washington pennsylvania,0,1
720684288233054000,look at all of the people locust,1,1
721116830815907000,look at that everywhere day phillies game,4,2
721014498950139000,look champion villanova mbb ring the bell at nyse,0,0
720775004904955000,look into my eyes and see the reflection of your soul,0,0
721179997017346000,look long enough and i will devour your soul__,1,0
720684491044483000,look out around new joint for ya south philly broad street,0,1
721177623200669000,look who i found at psu state college pennsylvania,0,1
721069791906291000,looking forward to seeing my philadanco family tonight i will be on hand helping out this_,0,0
721183443044929000,looking forward to sharing this great space with sisters tomorrow first a little bit of sleep_,0,0
720735701407440000,lord taylor,1,1
721156180249341000,lorena and i are actual best friend goals elmwood park zoo,0,1
721143251684732000,lots of hops great can artwork drinking a ninja vs unicorn inkydinkydudes inkydinkybrewhouse,1,1
721158614812082000,loud rock from the uk hell yes underground arts for the joy formidable with everything everything,0,1
721154513592143000,love my girls mcdowell high school,0,1
721047214932398000,love steaks pats king of cheesesteak,3,1
721001486004555000,love the full cycle of this photo this is a photo of one of our favorite sisterentrepreneur,0,0
721142773714395000,love the grapefruit flavor drinking a grapefruit sculpin by the cove,0,2
721166400287547000,love these dudes special thanks to navy and special thanks_,0,1
721140171434012000,love these ladies cant wait to see the beautiful bride walk down the aisle._,0,0
721231625611292000,love this beer such pleasant hops drinking a galaxy hero by death star,0,2
721120125835849000,love this kid have fun tonight aston community center,0,1
721070797628964000,love this man right here to death soldiers sailors memorial_,0,1
721026103163289000,love this town standing ovations smart audiences after i kill you tonight and tomorrow lets_,0,0
721131309813338000,love zee train paoli pennsylvania,0,1
721148969150242000,loved it,0,1
721096804717211000,loves drinking out of straw sewickley hotel,0,1
721095287586955000,loves travel stops country st maintenance technician tire care pa,4,0
721137734753128000,lovin my pnc park,2,2
721027308769959000,loving studying what we learn phl philadelphia international_,1,2
720631396599996000,lower merion high school,2,1
720661455226294000,lowes stores customer service associate ii pa,5,0
720708036218589000,lowes stores head cashier pa,5,0
720959899862052000,lowes stores outside lawn and garden loader store seasonal employee pa,4,0
720655518738489000,lowes stores part time day weekday customer service associate requires pa,2,0
720659968840470000,lowes stores part time weekend customer service associate requires pa,3,0
720962458542706000,lowes stores sales specialist flooring pa,5,0
720716345730465000,lowes stores store seasonal employee pa,5,0
721023840093106000,luckys last chance,0,1
721023000083107000,luna cafe,4,2
721022196685012000,luna cafe,7,2
721071341399617000,lunch and a few drinks at the original primantis today primanti brothers strip district_,0,1
721025585963732000,lunch cancun mexican restaurant in fairless hills pa,0,2
721021691737063000,lunch city in philadelphia pa,0,2
721004071054876000,lunch protip hummus to go sunglasses rittenhouse square the friday move dizengoff,0,1
720998864036229000,lunch remembering dad with his favorites here wonton soup and shrimp egg roll with hot tea still great after,0,0
721008647061508000,lunch santinos in jersey shore pa,0,1
720662768521756000,lunch special to speciality wings and truffle fries or regular fries for only,0,0
720660087447162000,lunch spot today mills of victoria,0,1
720654819615207000,lunch the dog house in reading pa,0,1
721024632472494000,lunch with a view rittenhouse square,0,1
721024777037705000,lunch with tim brown fat heads saloon in pittsburgh pa,0,2
721153095309398000,maarios at saloon in pittsburgh pa,0,1
720631837706620000,mack sota good ol days uptown,2,1
720963489414557000,macys retail retail support signing team associate part time tarentum pa macys pa,2,0
721140582089940000,mad as hell he had to take a bath philadelphia pennsylvania,1,1
720775266478485000,made a new friend today,0,0
721097296759365000,made it its nap time before the turn sheraton philadelphia downtown hotel,0,1
721027083154030000,magnitude earthquake hits southern japan tsunami advisory issued,0,1
720717175170801000,maintenance mechanic supervisor aerotek EMO_NEG pa,5,0
721139877211959000,makes a diving effort for a fly ball against the tigers,2,1
720707079334465000,makin friends carnegie mellon university,0,1
720712505543233000,making improvements successfully clears a box jump during his workout today_,0,1
721069632862482000,making my debut tonight at in philadelphia shout out to_,0,0
720591028009504000,making smaller work while visiting friends acrylic and ink the city of monessen,0,1
721163403327324000,man delivered pizza on bike here make more money than a taxi driver,0,0
720708512209211000,man gets to years in carjacking crash that killed family,0,0
721141657664692000,man the greek bells are ringing in for oberon it must be good oberon ale,1,0
721130778608803000,manager traineeretail sales speedway EMO_NEG pa,5,0
721016628851380000,mango black tea lemonade on this gorgeous day starbucks in cranberry township pa,0,1
721018104634089000,mar champs at in bethlehem pa,0,1
720716934812073000,march or rally in progress in on broad st both between girard ave and fairmount ave,2,0
721317584256307000,mark from admissions stellar opening presentation alumni hall_,2,1
721130941159186000,marks breakfast everyone elses sciullos deli catering in gibsonia pa,0,1
721160944269791000,marlon brando,0,0
721250059107454000,marte robs hr with incredible acrobatic catch,3,0
721169738806726000,martin sheen the stars come out at night,0,0
721150828963356000,mason porter world cafe live,0,1
720714717233176000,masonite machine operator pa,6,0
721127295293886000,mass gainers are a scam just make a lean shake add some good fats and carbs way cheaper,0,1
721125564518690000,massive thanks to my in laws for taking us to and buying dinner at one of the best meals ive_,0,0
720650966400417000,matching with bay in our free penguins shirt on this beautiful thursday,1,0
720650151526674000,maurices associate manager mit pa,6,0
721164930909495000,max brenner,0,1
721152220268331000,may not have won nationals but we won the the north atlantic region love my team.__ thanks for_,0,0
721025362566602000,may pulaski hall open bar free food good vibes good times,0,1
720562587839119000,maybe if you texted me instead of only snapchatting this relationship would go further your know i hate snap like cmon,0,0
721255332295495000,mayor kenney tabs new fire and prisons commissioners,0,0
721290571168526000,mays sandwich shop inc,0,1
721135833391214000,mcadams feeney conversing about music moments fair haired maidens mcgillins olde ale house,0,1
720611984366899000,mcdonalds corporation maintenance opportunities pa,6,0
721001295352442000,mcdonalds corporation parttime opportunities pa,6,0
721008315979796000,mcdonalds corporation parttime opportunities pa,6,0
720611059157995000,mcdonalds corporation parttime opportunities pa,6,0
721091160869965000,mcdonalds corporation parttime opportunities pa,6,0
721028225107800000,mcdonalds corporation parttime opportunities pa,6,0
721023536102383000,mcdonalds corporation parttime opportunities pa,6,0
720589249217560000,mcdonalds corporation parttime opportunities pa,6,0
720713734054764000,mcdonalds corporation shift manager pa,6,0
721095329001541000,mcdonalds corporation shift manager pa,6,0
720607956480499000,mcginyy gets my vote,0,1
721255067186290000,me and harper having our milk drinking a milk stout nitro by jesss love nest,0,2
721160616350781000,me and my conjoined twin east pennsboro high school,0,1
720566100312866000,me and my first penn ifc exec thanks guys for the support in_,0,0
720660718832500000,me and walt were supposed to get tattoos monthss ago now i have to wait til like this time next year,0,0
721121586150010000,me and wifey going out,4,0
721169965454356000,me at tn tla,0,1
721017812525785000,me getting right with the camera man lol before my_,0,0
721141627708968000,me ha robado el mes de,2,0
721132986339565000,me out to the ball game__ citizens bank park,0,1
721150577770672000,me saint francis university,0,1
721174023586123000,me too,0,1
721125491961245000,medexpress front office assistant pa,7,0
721023819587006000,medexpress physician pa,7,0
721091119606444000,medexpress physician pa,7,0
720998199960272000,medexpress physician pa,7,0
721153806004789000,meet me at johnniebleu for my birthday philly johnnie bleu,0,1
721177460977446000,meet my sexy friend kate twinslet,6,0
720710632555700000,meet the joe bag from hammitt rwl shadyside roberta weissburg leathers,0,1
721099381634703000,meeting an old friend for dinner yay for girl time at in bensalem pa,0,1
720982484490399000,meg and i stopped to take a break during this mornings grounds inspection,2,0
721201394875666000,meghan halley encourages me to take adventures point state park,1,1
721157846931361000,mercer high school,1,1
721158900058300000,mexicali cantina,0,1
720754996392755000,michael ray giant center,0,1
721005034075512000,midday boost espresso a mano in pittsburgh pa,0,1
721129246790430000,might as well checkout what this hoopla is about,1,0
721137560727261000,military ball with the best__ indiana country club,0,1
721144252978348000,milk teeth being rad as fudge,6,0
721169812576149000,minado,2,1
720851730037014000,minimalist the dungeon philly,0,1
720712801082159000,ministry support diakon luthera lpn pa,6,0
720653674884833000,miso bbq ramen vegan edition,6,0
721213350764523000,mispillion reach around ipa now available on tap,1,1
721138014374596000,miss retreat so much right now malvern retreat house,0,1
721164473914908000,missed you crazy five points cocktail lounge,0,1
721147614880604000,missing friday nights like these nazareth area high school,1,1
721272600983433000,missing you miles hope you are enjoying those vinyls from philly radafilmgroup,0,1
721133280620249000,mlb notebook giants call up setonla salle grad law,3,0
721164311318634000,mm drinking a speedway stout hawaiian by tria taproom,0,2
720608928321679000,mobbin pittsburgh pensylvannia,1,1
721147849413668000,mocking cruz,0,1
721160498952077000,mom get in omg nazareth area high school,0,1
721127166189113000,moms aunts at waist watchers the musical cant wait to see pammy,1,1
721115947415838000,monsignor bonner archbishop prendergast catholic high school,0,1
720657105775128000,month on chosen1 and apex male week cobra non extreme caps with,0,1
721007622741180000,months ago we were saying see you later as you left for basic,0,0
721128456591929000,months out from the injury making nothing but progress every day._,0,0
721143200795074000,mood almost friday philadelphia city,4,1
721136872081203000,mood for tonight tonight gonna be so turnt up i cant wait i hope yall got yall_,0,0
720683319512473000,more appointments perelman center for advanced medicine in philadelphia pa,0,1
721140867021443000,more shot pottsville pennsylvania,0,1
720712791787708000,more stock for record store day this saturday,1,0
720609158144270000,morning EMO_POS,0,2
721242766601138000,mother says her grader walked out of school unnoticed found on busy highway,0,0
721135753254866000,motherfucker,0,0
720658931500998000,msc industrial merchandise selector pa,4,0
721141319310057000,msc industrial supervisor telesales pa,4,0
721065594561253000,msc industrial telesales program pa,6,0
721045543724695000,much hipo randyland,0,1
720710870750273000,much love from your brown eyed girl soakin up some,0,0
721317102272004000,much needed after a night shift and before class starbucks in harrisburg pa,0,1
721066352295993000,much needed churchbrewworks thunder hop after a solid week in,4,0
721158701533523000,much needed cocktail continental midtown restaurant,4,1
721013887613571000,much needed post pssa coloring sesh executive education academy_,0,1
721016325535993000,multivehicle accident in on us19 sb at gilkeson r,2,0
721161358922891000,munchies the clubhouse gibsonia in gibsonia pa,0,2
720683811416248000,museum director dr robert hicks launches a special discussion on the wallpaper in_,0,0
721099535095885000,mushrooms popping up in the blue_,4,2
721045819558883000,mutton in an earthy curry sauce with vegetables and longgrain basmati_,0,0
721021683683995000,my baby dont feel good but we both wanted to see barbershop without_,0,0
721152989281521000,my baby my lil boyfriendeven tho he wouldnt give me a kiss phillies game citizens_,0,2
721143952016060000,my beautiful date tonight and i trying proper brick_,0,1
721156072396996000,my biggest fan is from florida tho to link in my bio_,0,1
721173749769240000,my biggest fan robert morris university,0,1
721172070952861000,my bub coatesville pennsylvania,0,1
721275552385118000,my cute little sparrow wilkesbarre pennsylvania,0,1
721170876469800000,my drink named steve the franklin bar,4,1
721028180253872000,my evening ride into philadelphia pennsylvania,4,1
721156766642397000,my every fridays goes to the dedicated and hungry most players wont come to work on there_,0,0
721099523335065000,my exciting life EMO_POS cyclemat laundry in philadelphia pa,0,1
720612778185129000,my eyes hurt so bad,0,0
720956941233758000,my face when the security line is super long but i got that tsa precheck__,1,1
721158100485541000,my fav movie is playing at the hollywood the hollywood theater in dormont,0,1
721159865834582000,my first tweet check out this photograph theres a railway right behind my room so annonying at night p,0,0
721129673858658000,my friday night,5,1
721132741396447000,my go to and it never lets me down dig drinking a head hunter ipa by the industry bar,0,2
721095104572825000,my kids teach self discipline where talent is the reward more benefits_,2,0
720708662688366000,my knucklehead ass potna brought this to my room on a related,0,0
721231437865885000,my little sisters junior prom,3,0
721228744791302000,my little sisters junior prom,3,0
721229544280166000,my little sisters junior prom,3,0
721228599110582000,my little sisters junior prom,3,0
721115718985641000,my love brothersagemaestro_,3,1
721149717376339000,my love__ hollidaysburg pennsylvania,0,1
720736869223256000,my milkshake was wearing a marshmallow hat burgatory,0,1
721007654492114000,my mother may strangle me for this post but ill take my chances i_,0,0
721182668608679000,my new friend iggypopofficial was absolutely unbelievable probably one of the best_,1,0
721167719773679000,my night just got exponentially better,5,0
721069534619246000,my person sorry for eating the serving mac n cheese without,0,0
720981934243885000,my pole partner day drinker and overall fabulous human of a best friend is getting married_,0,0
720776800893186000,my role models__ love these ladies has_,3,0
721094333336788000,my room for the night see you soon days inn_,0,2
720964668278382000,my saint joes hoe saint josephs university,0,1
721095946784747000,my shelly greene bean indiana university of pennsylvania,0,1
721097792140263000,my stop septa wayne station outbound platform in wayne pa,0,1
721169538394394000,my stunning daughter and her handsome prom date moon prom,0,1
721120387568951000,my sweet angel philadelphia pennsylvania,0,1
720654984325505000,my teeny tiny hair model melhorn castle,3,1
721118466346991000,my three amigos my blessings ill walk a thousand miles to see their smiles__,1,0
721123323644542000,my two favorite things pnc park,0,1
721160658285408000,my two favorites ms tootsie soul food cafe,0,2
721096940491010000,my view today of duquesne_,1,2
720683285215584000,my wife always knows the way to my heart gaucho parrilla argentina,1,1
720998372941950000,my work buddies for the day and one is snoring,1,0
721028101354954000,myself with some sunshine prayer and my favorite crystals i love days like_,0,0
721150404088569000,n ali steak and seafood excellent,1,0
721121767587241000,nah spoilers,0,1
721005209951014000,nails and eye brows done waiting on my massage,3,0
721232049345019000,nathalie,4,0
720685992651325000,national warehouse manager nestle waters na EMO_NEG pa,3,0
720658672490307000,naturally west in state college pa,0,1
721141760370597000,nature at its very finest,8,0
720776572274405000,navy yard,1,1
720711650148376000,need a furry friend but not into scooping litter ive got just the dude for you billy_,0,0
721024706703400000,need some new games for the weekend weve got marvel munchkin and marvel cinematic universe_,0,0
720613108415336000,need this caffeine boost to get to the weekend,3,0
720707502241890000,nephew pitching springside chestnut hill academy,0,1
721139540849766000,never realized how close in plots the jungle book and the lion king were im still taking simba_,0,0
720885594285613000,new belgium la folie now available on tap,1,1
721006644994269000,new cumberland borough park,6,1
721007332772093000,new cumberland borough park,8,1
721006975593500000,new cumberland borough park,6,1
720738563063746000,new glasses and ny said hey world usa optical,0,1
720711062774030000,new handmade pens by write your way,4,0
721130857784848000,new heat out now link in my bio philadelphia pennsylvania,0,1
721046858156662000,new mural alert were currently installing a mural on at buttonwood with,0,0
720738067720638000,new record rack built by goddard goddard renovations more coming soon contact them,0,0
721012927147470000,new specials have landed,6,0
721025957423931000,new vlogs dropping on my youtube channel at click share post enjoy_,1,0
720715204376555000,next contributor david rullo calls salem__s market and grill in the strip a microcosm of_,0,0
721017343149752000,next saturday daddy here wit the whole damn city,2,2
721097651060666000,next stop wayne yeah septa saint davids station in wayne pa,0,2
721143086399778000,next up is a romacraft neanderthal sop smoke,0,4
721008106218635000,next wednesday season continues visit for_,1,1
721098347159908000,nice and refreshing somewhat bitter but not that much green blaze ipa,1,1
721026071362215000,nice and sunny here in pittsburgh regrann from pre workout and post workout_,0,1
721137992845250000,nice balls,0,4
720686139133325000,nice day for a baseball game,2,0
